title,text,link,source
Pakistan: Coronavirus cases fall for 5th straight day,"ISLAMABAD, Pakistan. New coronavirus cases in Pakistan continued to decline for a fifth consecutive day on Wednesday, official data showed. According to the ...",Anadolu Agency,https://www.news.google.com/./articles/CBMiYmh0dHBzOi8vd3d3LmFhLmNvbS50ci9lbi9hc2lhLXBhY2lmaWMvcGFraXN0YW4tY29yb25hdmlydXMtY2FzZXMtZmFsbC1mb3ItNXRoLXN0cmFpZ2h0LWRheS8xODg4MzM30gEA?hl=en-PK&gl=PK&ceid=PK%3Aen
'Smart lockdown' in Pakistan to target 500 coronavirus hotspots,Authorities to impose locality-based lockdowns as country sees one of the world's fastest rates of infections.,Al Jazeera English,https://www.news.google.com/./articles/CAIiELsSN-5dWVKWYDTVk_40K-0qFAgEKgwIACoFCAowhgIwkDgw0O8B?hl=en-PK&gl=PK&ceid=PK%3Aen
Pakistan records lowest single-day spike in coronavirus cases after a month,"ISLAMABAD: Pakistan on Friday recorded its lowest single-day spike in coronavirus cases in about a month after 2,775 people tested positive for the infection, ...",Times of India,https://www.news.google.com/./articles/CAIiEOUucoKdlxtF208xvxAsF7MqGQgEKhAIACoHCAowzrL9CjDC7vQCMOXc1gU?hl=en-PK&gl=PK&ceid=PK%3Aen
Pakistan hospitals struggle as coronavirus cases explode,Country sees multiple consecutive days of record cases and deaths as overworked doctors plead for 'breathing space'.,Al Jazeera English,https://www.news.google.com/./articles/CAIiEFuOCYeq7vIl0fV87oR3E7wqFAgEKgwIACoFCAowhgIwkDgw87UI?hl=en-PK&gl=PK&ceid=PK%3Aen
Pakistan records 153 new coronavirus deaths,"KARACHI, Pakistan. Pakistan on Saturday reported 153 new deaths due to the coronavirus, breaking its previous record of the highest single-day fatalities ever ...",Anadolu Agency,https://www.news.google.com/./articles/CBMiWWh0dHBzOi8vd3d3LmFhLmNvbS50ci9lbi9hc2lhLXBhY2lmaWMvcGFraXN0YW4tcmVjb3Jkcy0xNTMtbmV3LWNvcm9uYXZpcnVzLWRlYXRocy8xODgzODIz0gEA?hl=en-PK&gl=PK&ceid=PK%3Aen
WHO says Pakistan should reimpose lockdown to curb coronavirus,"Cases increased exponentially since the lockdown was lifted in late May, with record-high cases registered on Tuesday.",Al Jazeera English,https://www.news.google.com/./articles/CAIiEDqnVi1rh3adLYZRPgc8fywqFAgEKgwIACoFCAowhgIwkDgw0O8B?hl=en-PK&gl=PK&ceid=PK%3Aen
"India, Pakistan Record Big Jump In Coronavirus Cases","India and Pakistan have experienced their largest single-day increase in coronavirus infections, confirming more than 14,700 cases between them Friday, as the ...",NPR,https://www.news.google.com/./articles/CBMifmh0dHBzOi8vd3d3Lm5wci5vcmcvc2VjdGlvbnMvY29yb25hdmlydXMtbGl2ZS11cGRhdGVzLzIwMjAvMDYvMDUvODcwMTkzNzE4L2luZGlhLXBha2lzdGFuLXJlY29yZC1iaWctanVtcC1pbi1jb3JvbmF2aXJ1cy1jYXNlc9IBAA?hl=en-PK&gl=PK&ceid=PK%3Aen
Pakistan records 136 new coronavirus deaths,"KARACHI, Pakistan. Pakistan on Wednesday reported 136 new deaths due to the coronavirus, breaking its previous record of the highest single-day fatalities ...",Anadolu Agency,https://www.news.google.com/./articles/CBMiWWh0dHBzOi8vd3d3LmFhLmNvbS50ci9lbi9hc2lhLXBhY2lmaWMvcGFraXN0YW4tcmVjb3Jkcy0xMzYtbmV3LWNvcm9uYXZpcnVzLWRlYXRocy8xODc5NjI00gEA?hl=en-PK&gl=PK&ceid=PK%3Aen
"Coronavirus: Rumours, fear and rising Covid deaths in Pakistan","Doctors in Pakistan are warning that the country's already weak healthcare system could soon be overwhelmed by coronavirus patients. So far, with fewer than ...",BBC News,https://www.news.google.com/./articles/CBMiLGh0dHBzOi8vd3d3LmJiYy5jb20vbmV3cy93b3JsZC1hc2lhLTUyOTI1Mjg20gEwaHR0cHM6Ly93d3cuYmJjLmNvbS9uZXdzL2FtcC93b3JsZC1hc2lhLTUyOTI1Mjg2?hl=en-PK&gl=PK&ceid=PK%3Aen
"Pakistan's coronavirus cases count crosses 76,000",Pakistan News: A total of 76106 Covid-19 cases have been reported in Pakistan with 27110 people having recovered from the infection and 1599 deaths due to ...,Times of India,https://www.news.google.com/./articles/CAIiEKPQ7CL06Equwd276Nd8v7EqGQgEKhAIACoHCAowzrL9CjDC7vQCMOXc1gU?hl=en-PK&gl=PK&ceid=PK%3Aen
"Pakistan records over 6,000 more COVID-19 cases","ISLAMABAD, Pakistan. Pakistan on Friday recorded more than 6,000 coronavirus cases over the past 24 hours, the highest single-day rise since the outbreak, ...",Anadolu Agency,https://www.news.google.com/./articles/CBMiXWh0dHBzOi8vd3d3LmFhLmNvbS50ci9lbi9hc2lhLXBhY2lmaWMvcGFraXN0YW4tcmVjb3Jkcy1vdmVyLTYtMDAwLW1vcmUtY292aWQtMTktY2FzZXMvMTg3NDM3MdIBAA?hl=en-PK&gl=PK&ceid=PK%3Aen
"June 9: Punjab, Sindh see surge in coronavirus cases as countrywide tally hits 110,861",The contagion has claimed at least 2216 lives while 35070 patients recovered across the country so far.,The Express Tribune,https://www.news.google.com/./articles/CBMifGh0dHBzOi8vdHJpYnVuZS5jb20ucGsvc3RvcnkvMjIzODcyNC8xLWxpdmUtcGFraXN0YW4tcmVwb3J0cy0xMDAtZGVhdGhzLWxhc3QtMjQtaG91cnMtbmF0aW9ud2lkZS10YWxseS1jcm9zc2VzLTEwODMxNy8_YW1wPTHSAXxodHRwczovL3RyaWJ1bmUuY29tLnBrL3N0b3J5LzIyMzg3MjQvMS1saXZlLXBha2lzdGFuLXJlcG9ydHMtMTAwLWRlYXRocy1sYXN0LTI0LWhvdXJzLW5hdGlvbndpZGUtdGFsbHktY3Jvc3Nlcy0xMDgzMTcvP2FtcD0x?hl=en-PK&gl=PK&ceid=PK%3Aen
"Alarm bells ringing as coronavirus cases surge past 100,000","ISLAMABAD/LAHORE: Pakistan's coronavirus cases surged past 100,000 on Sunday while the death toll crossed 2,000 as the provinces and autonomous ...",Pakistan Today,https://www.news.google.com/./articles/CBMiZ2h0dHBzOi8vd3d3LnBha2lzdGFudG9kYXkuY29tLnBrLzIwMjAvMDYvMDcvYWxhcm0tYmVsbHMtcmluZ2luZy1hcy1jb3JvbmF2aXJ1cy1jYXNlcy1zdXJnZS1wYXN0LTEwMDAwMC_SAWtodHRwczovL3d3dy5wYWtpc3RhbnRvZGF5LmNvbS5way8yMDIwLzA2LzA3L2FsYXJtLWJlbGxzLXJpbmdpbmctYXMtY29yb25hdmlydXMtY2FzZXMtc3VyZ2UtcGFzdC0xMDAwMDAvYW1wLw?hl=en-PK&gl=PK&ceid=PK%3Aen
Pakistan's Confused COVID-19 Response – The Diplomat,Pakistan's coronavirus fight needs clear public messaging to avert a public health crisis.,The Diplomat,https://www.news.google.com/./articles/CBMiRWh0dHBzOi8vdGhlZGlwbG9tYXQuY29tLzIwMjAvMDYvcGFraXN0YW5zLWNvbmZ1c2VkLWNvdmlkLTE5LXJlc3BvbnNlL9IBAA?hl=en-PK&gl=PK&ceid=PK%3Aen
Pakistan: 2nd ex-premier tests positive for coronavirus,"Yousuf Raza Gilani joins growing list of infected politicians, former cricket captain Shahid Afridi also tests positive - Anadolu Agency.",Anadolu Agency,https://www.news.google.com/./articles/CBMiZGh0dHBzOi8vd3d3LmFhLmNvbS50ci9lbi9hc2lhLXBhY2lmaWMvcGFraXN0YW4tMm5kLWV4LXByZW1pZXItdGVzdHMtcG9zaXRpdmUtZm9yLWNvcm9uYXZpcnVzLzE4NzU1ODfSAQA?hl=en-PK&gl=PK&ceid=PK%3Aen
Pakistan's ex-premier tests positive for coronavirus,"KARACHI, Pakistan. Pakistan's former prime minister Shahid Khaqan Abbasi has tested positive for coronavirus, his family and party confirmed on Monday.",Anadolu Agency,https://www.news.google.com/./articles/CBMiYWh0dHBzOi8vd3d3LmFhLmNvbS50ci9lbi9hc2lhLXBhY2lmaWMvcGFraXN0YW5zLWV4LXByZW1pZXItdGVzdHMtcG9zaXRpdmUtZm9yLWNvcm9uYXZpcnVzLzE4Njg5NjbSAQA?hl=en-PK&gl=PK&ceid=PK%3Aen
"Pakistan reports 3,138 new coronavirus cases, total deaths cross 4,000-mark","Islamabad: Pakistan has reported 3,138 new coronavirus cases and 74 more deaths during the last 24 hours, taking the total number of infections in the country ...",ThePrint,https://www.news.google.com/./articles/CBMiamh0dHBzOi8vdGhlcHJpbnQuaW4vd29ybGQvcGFraXN0YW4tcmVwb3J0cy0zMTM4LW5ldy1jb3JvbmF2aXJ1cy1jYXNlcy10b3RhbC1kZWF0aHMtY3Jvc3MtNDAwMC1tYXJrLzQ0OTg3OS_SAW5odHRwczovL3RoZXByaW50LmluL3dvcmxkL3Bha2lzdGFuLXJlcG9ydHMtMzEzOC1uZXctY29yb25hdmlydXMtY2FzZXMtdG90YWwtZGVhdGhzLWNyb3NzLTQwMDAtbWFyay80NDk4NzkvP2FtcA?hl=en-PK&gl=PK&ceid=PK%3Aen
Pakistan reports highest single-day virus deaths,"KARACHI, Pakistan. Pakistan on Saturday broke its previous record of the highest single-day deaths ever from the novel coronavirus, reporting 97 fatalities over ...",Anadolu Agency,https://www.news.google.com/./articles/CBMiXmh0dHBzOi8vd3d3LmFhLmNvbS50ci9lbi9hc2lhLXBhY2lmaWMvcGFraXN0YW4tcmVwb3J0cy1oaWdoZXN0LXNpbmdsZS1kYXktdmlydXMtZGVhdGhzLzE4NjcyMDTSAQA?hl=en-PK&gl=PK&ceid=PK%3Aen
"JUNE 7: Pakistan becomes 14th country to cross 100k Covid-19 cases; death toll tops 2,000",Nationwide tally of coronavirus patients stands at 101487 with 2032 deaths.,The Express Tribune,https://www.news.google.com/./articles/CBMicWh0dHBzOi8vdHJpYnVuZS5jb20ucGsvc3RvcnkvMjIzNzMyMy8xLWxpdmUtcGFraXN0YW5zLWRlYXRoLXRvbGwtY3Jvc3Nlcy0yMDAwLW5hdGlvbndpZGUtdGFsbHktanVtcHMtOTg5NDMvP2FtcD0x0gFxaHR0cHM6Ly90cmlidW5lLmNvbS5way9zdG9yeS8yMjM3MzIzLzEtbGl2ZS1wYWtpc3RhbnMtZGVhdGgtdG9sbC1jcm9zc2VzLTIwMDAtbmF0aW9ud2lkZS10YWxseS1qdW1wcy05ODk0My8_YW1wPTE?hl=en-PK&gl=PK&ceid=PK%3Aen
Pakistan reports highest daily COVID-19 cases,"KARACHI, Pakistan. Pakistan on Friday broke its previous record of the highest single-day rise ever, reporting 4,896 new coronavirus cases in the past 24 hours, ...",Anadolu Agency,https://www.news.google.com/./articles/CBMiW2h0dHBzOi8vd3d3LmFhLmNvbS50ci9lbi9hc2lhLXBhY2lmaWMvcGFraXN0YW4tcmVwb3J0cy1oaWdoZXN0LWRhaWx5LWNvdmlkLTE5LWNhc2VzLzE4NjYyMzXSAQA?hl=en-PK&gl=PK&ceid=PK%3Aen
Pakistan Use of Spy Technology for Coronavirus Patients Raises Concerns,"Pakistan has turned to its spy agency's terror surveillance technology to track coronavirus patients, which rights activists and medical professionals worry could ...",VOA News,https://www.news.google.com/./articles/CAIiEFaIteZ9kefBxDgkQZICWj4qGAgEKg8IACoHCAowqc_1ATCe_xQwg8a1Bg?hl=en-PK&gl=PK&ceid=PK%3Aen
"Coronavirus updates, June 16: Latest news on the COVID-19 pandemic from Pakistan and around the world","The number of confirmed COVID-19 cases in Pakistan rose to 154,335 on Tuesday after new infections were confirmed in the country. The province-wise break ...",Geo News,https://www.news.google.com/./articles/CAIiEClWWSeIcTv-b5WTY2HsaVEqMwgEKioIACIQueFm35xOZipy-QOS9ivtJCoUCAoiELnhZt-cTmYqcvkDkvYr7SQwqpvFBg?hl=en-PK&gl=PK&ceid=PK%3Aen
Pakistan records new daily highest in COVID-19 deaths,"KARACHI, Pakistan. Pakistan on Tuesday reported the highest daily spike ever in deaths from the novel coronavirus, reporting 105 fatalities over the last 24 ...",Anadolu Agency,https://www.news.google.com/./articles/CBMiY2h0dHBzOi8vd3d3LmFhLmNvbS50ci9lbi9hc2lhLXBhY2lmaWMvcGFraXN0YW4tcmVjb3Jkcy1uZXctZGFpbHktaGlnaGVzdC1pbi1jb3ZpZC0xOS1kZWF0aHMvMTg3MDQwMNIBAA?hl=en-PK&gl=PK&ceid=PK%3Aen
Pakistan risking disaster with its contentious coronavirus strategy,Pakistan has recorded more than 4000 coronavirus cases in a single-day – taking the total number of reported infections to over 82000. Some reports suggest ...,DW (English),https://www.news.google.com/./articles/CAIiEN5-MKl6fOqfy4nRkR3zuPUqGAgEKg8IACoHCAoww5LyAzD2zh0w_ru7Bg?hl=en-PK&gl=PK&ceid=PK%3Aen
Pakistan's health system braces for COVID-19 peak,"KARACHI, Pakistan. With hospitals overwhelmed and a sharp rise in the number of deaths, Pakistan's delicate health system is bracing for an imminent peak of ...",Anadolu Agency,https://www.news.google.com/./articles/CBMiXmh0dHBzOi8vd3d3LmFhLmNvbS50ci9lbi9hc2lhLXBhY2lmaWMvcGFraXN0YW5zLWhlYWx0aC1zeXN0ZW0tYnJhY2VzLWZvci1jb3ZpZC0xOS1wZWFrLzE4NjczOTbSAQA?hl=en-PK&gl=PK&ceid=PK%3Aen
Hundreds of children in Pakistan's Sindh infected with COVID-19,"At least 930 children under 10 in southern province have tested positive for coronavirus, raising concerns amid school closures.",Aljazeera.com,https://www.news.google.com/./articles/CBMiaGh0dHBzOi8vd3d3LmFsamF6ZWVyYS5jb20vbmV3cy8yMDIwLzA1L2h1bmRyZWRzLXBha2lzdGFuLWNoaWxkcmVuLTEwLXNpbmRoLWNvdmlkLTE5LTIwMDUyOTA2MjcyOTQ5NC5odG1s0gFsaHR0cHM6Ly93d3cuYWxqYXplZXJhLmNvbS9hbXAvbmV3cy8yMDIwLzA1L2h1bmRyZWRzLXBha2lzdGFuLWNoaWxkcmVuLTEwLXNpbmRoLWNvdmlkLTE5LTIwMDUyOTA2MjcyOTQ5NC5odG1s?hl=en-PK&gl=PK&ceid=PK%3Aen
Coronavirus updates: Latest news on the COVID-19 pandemic from Pakistan and around the world,"BISSAU: Guinea Bissau was warned to prepare for a possible increase in coronavirus cases by the head of its response commission, as a team of Cuban health ...",Geo News,https://www.news.google.com/./articles/CAIiEP0dY5LSK9uhsCPMBVrw6u4qMwgEKioIACIQueFm35xOZipy-QOS9ivtJCoUCAoiELnhZt-cTmYqcvkDkvYr7SQwqpvFBg?hl=en-PK&gl=PK&ceid=PK%3Aen
"LIVE: Pakistan tops China in coronavirus cases as nationwide tally surpasses 87,000",Covid-19 pandemic has completed 100 days in the country with nearly 1800 deaths.,The Express Tribune,https://www.news.google.com/./articles/CBMihgFodHRwczovL3RyaWJ1bmUuY29tLnBrL3N0b3J5LzIyMzUwNjgvMS1saXZlLWRyLXphZmFyLW1pcnphLWV4cHJlc3Nlcy1jb25jZXJuLWluY3JlYXNlLW51bWJlci1jYXNlcy1uYXRpb253aWRlLXRhbGx5LWp1bXBzLTg1MjY0Lz9hbXA9MdIBhgFodHRwczovL3RyaWJ1bmUuY29tLnBrL3N0b3J5LzIyMzUwNjgvMS1saXZlLWRyLXphZmFyLW1pcnphLWV4cHJlc3Nlcy1jb25jZXJuLWluY3JlYXNlLW51bWJlci1jYXNlcy1uYXRpb253aWRlLXRhbGx5LWp1bXBzLTg1MjY0Lz9hbXA9MQ?hl=en-PK&gl=PK&ceid=PK%3Aen
Coronavirus latest: WHO urges Pakistan to lock down,The World Health Organization is urging Pakistan to impose a two-week intermittent lockdown to stem a spike in new cases. Germany will end its border controls ...,DW (English),https://www.news.google.com/./articles/CAIiEJT7BsulT9cv8HkiDPFcWTkqGAgEKg8IACoHCAoww5LyAzD2zh0w_ru7Bg?hl=en-PK&gl=PK&ceid=PK%3Aen
Two More Pakistani Lawmakers Die Of Coronavirus,"In a sign that the death toll from the coronavirus pandemic is mounting in Pakistan, two more lawmakers succumbed to COVID-19 on June 3.",Gandhara,https://www.news.google.com/./articles/CBMiW2h0dHBzOi8vZ2FuZGhhcmEucmZlcmwub3JnL2EvYW5vdGhlci1wYWtpc3RhbmktbGF3bWFrZXItZGllcy1mcm9tLWNvcm9uYXZpcnVzLzMwNjUwNDQ1Lmh0bWzSAV1odHRwczovL2dhbmRoYXJhLnJmZXJsLm9yZy9hbXAvYW5vdGhlci1wYWtpc3RhbmktbGF3bWFrZXItZGllcy1mcm9tLWNvcm9uYXZpcnVzLzMwNjUwNDQ1Lmh0bWw?hl=en-PK&gl=PK&ceid=PK%3Aen
"Only 3 pc Pakistanis clear-headed about coronavirus, survey finds","ISLAMABAD: As Pakistan crossed its highest coronavirus-related deaths in a day, a survey revealed that only three per cent Pakistanis are clear-headed about ...",Pakistan Today,https://www.news.google.com/./articles/CBMibWh0dHBzOi8vd3d3LnBha2lzdGFudG9kYXkuY29tLnBrLzIwMjAvMDYvMDkvb25seS0zLXBjLXBha2lzdGFuaXMtY2xlYXItaGVhZGVkLWFib3V0LWNvcm9uYXZpcnVzLXN1cnZleS1maW5kcy_SAXFodHRwczovL3d3dy5wYWtpc3RhbnRvZGF5LmNvbS5way8yMDIwLzA2LzA5L29ubHktMy1wYy1wYWtpc3RhbmlzLWNsZWFyLWhlYWRlZC1hYm91dC1jb3JvbmF2aXJ1cy1zdXJ2ZXktZmluZHMvYW1wLw?hl=en-PK&gl=PK&ceid=PK%3Aen
Pakistan coronavirus: Concerns grow over use of low-quality masks,"In Pakistan's poorer neighbourhoods, medically approved face-masks are a luxury many cannot afford.",Aljazeera.com,https://www.news.google.com/./articles/CBMicGh0dHBzOi8vd3d3LmFsamF6ZWVyYS5jb20vbmV3cy8yMDIwLzA2L3Bha2lzdGFuLWNvcm9uYXZpcnVzLWNvbmNlcm5zLWdyb3ctbG93LXF1YWxpdHktbWFza3MtMjAwNjA5MDk1MzA4MjAxLmh0bWzSAXRodHRwczovL3d3dy5hbGphemVlcmEuY29tL2FtcC9uZXdzLzIwMjAvMDYvcGFraXN0YW4tY29yb25hdmlydXMtY29uY2VybnMtZ3Jvdy1sb3ctcXVhbGl0eS1tYXNrcy0yMDA2MDkwOTUzMDgyMDEuaHRtbA?hl=en-PK&gl=PK&ceid=PK%3Aen
"Punjab reports 1,615 new coronavirus cases in 24 hours","Punjab reported 1,615 new coronavirus infections in the past 24 hours, taking the total number of infections across the province to 31,104, according to the ...",Pakistan Today,https://www.news.google.com/./articles/CBMiYmh0dHBzOi8vd3d3LnBha2lzdGFudG9kYXkuY29tLnBrLzIwMjAvMDYvMDUvcHVuamFiLXJlcG9ydHMtMTYxNS1uZXctY29yb25hdmlydXMtY2FzZXMtaW4tMjQtaG91cnMv0gFmaHR0cHM6Ly93d3cucGFraXN0YW50b2RheS5jb20ucGsvMjAyMC8wNi8wNS9wdW5qYWItcmVwb3J0cy0xNjE1LW5ldy1jb3JvbmF2aXJ1cy1jYXNlcy1pbi0yNC1ob3Vycy9hbXAv?hl=en-PK&gl=PK&ceid=PK%3Aen
Coronavirus kills 81 in Pakistan over 24 hours - Pakistan - DAWN.COM,Woman doctor among five medical practitioners who lost their lives in same period.,DAWN.com,https://www.news.google.com/./articles/CBMiIWh0dHBzOi8vd3d3LmRhd24uY29tL25ld3MvMTU2MDMzONIBAA?hl=en-PK&gl=PK&ceid=PK%3Aen
WHO calls for intermittent lockdowns in Pakistan as COVID-19 cases rise sharply,More than one in five people have tested positive for COVID-19 over the last two weeks.,The Hindu,https://www.news.google.com/./articles/CBMijwFodHRwczovL3d3dy50aGVoaW5kdS5jb20vbmV3cy9pbnRlcm5hdGlvbmFsL3doby1jYWxscy1mb3ItaW50ZXJtaXR0ZW50LWxvY2tkb3ducy1pbi1wYWtpc3Rhbi1hcy1jb3ZpZC0xOS1jYXNlcy1yaXNlLXNoYXJwbHkvYXJ0aWNsZTMxNzkyMzExLmVjZdIBlAFodHRwczovL3d3dy50aGVoaW5kdS5jb20vbmV3cy9pbnRlcm5hdGlvbmFsL3doby1jYWxscy1mb3ItaW50ZXJtaXR0ZW50LWxvY2tkb3ducy1pbi1wYWtpc3Rhbi1hcy1jb3ZpZC0xOS1jYXNlcy1yaXNlLXNoYXJwbHkvYXJ0aWNsZTMxNzkyMzExLmVjZS9hbXAv?hl=en-PK&gl=PK&ceid=PK%3Aen
"Coronavirus cases across country surge past 185,000","–Over 300 patients have died of Covid-19 in home isolation during past three months. ISLAMABAD: As many as 3,946 new coronavirus cases surfaced in the ...",Pakistan Today,https://www.news.google.com/./articles/CBMiX2h0dHBzOi8vd3d3LnBha2lzdGFudG9kYXkuY29tLnBrLzIwMjAvMDYvMjQvY29yb25hdmlydXMtY2FzZXMtYWNyb3NzLWNvdW50cnktc3VyZ2UtcGFzdC0xODUwMDAv0gFjaHR0cHM6Ly93d3cucGFraXN0YW50b2RheS5jb20ucGsvMjAyMC8wNi8yNC9jb3JvbmF2aXJ1cy1jYXNlcy1hY3Jvc3MtY291bnRyeS1zdXJnZS1wYXN0LTE4NTAwMC9hbXAv?hl=en-PK&gl=PK&ceid=PK%3Aen
"Saudi coronavirus cases exceed 100,000","DUBAI: The number of coronavirus cases in Saudi Arabia exceeded 100,000 on Sunday following a rise in new infections over the past ten days. The Saudi ...",Pakistan Today,https://www.news.google.com/./articles/CBMiUmh0dHBzOi8vd3d3LnBha2lzdGFudG9kYXkuY29tLnBrLzIwMjAvMDYvMDcvc2F1ZGktY29yb25hdmlydXMtY2FzZXMtZXhjZWVkLTEwMDAwMC_SAVZodHRwczovL3d3dy5wYWtpc3RhbnRvZGF5LmNvbS5way8yMDIwLzA2LzA3L3NhdWRpLWNvcm9uYXZpcnVzLWNhc2VzLWV4Y2VlZC0xMDAwMDAvYW1wLw?hl=en-PK&gl=PK&ceid=PK%3Aen
"US records biggest single-day increase with 45,000 new coronavirus cases","NEW YORK: The United States on Friday recorded the largest single-day increase of infections after it recorded 45,242 new cases of Covid-19 on Friday, ...",Pakistan Today,https://www.news.google.com/./articles/CBMidGh0dHBzOi8vd3d3LnBha2lzdGFudG9kYXkuY29tLnBrLzIwMjAvMDYvMjcvdXMtcmVjb3Jkcy1iaWdnZXN0LXNpbmdsZS1kYXktaW5jcmVhc2Utd2l0aC00NTAwMC1uZXctY29yb25hdmlydXMtY2FzZXMv0gF4aHR0cHM6Ly93d3cucGFraXN0YW50b2RheS5jb20ucGsvMjAyMC8wNi8yNy91cy1yZWNvcmRzLWJpZ2dlc3Qtc2luZ2xlLWRheS1pbmNyZWFzZS13aXRoLTQ1MDAwLW5ldy1jb3JvbmF2aXJ1cy1jYXNlcy9hbXAv?hl=en-PK&gl=PK&ceid=PK%3Aen
49 succumb to coronavirus in Punjab within 24 hours,"LAHORE: Punjab province on Friday witnessed an increase of 1,919 Covid-19 cases in the last 24 hours, raising the provincial virus tally to 47,382. According to ...",Pakistan Today,https://www.news.google.com/./articles/CBMiYGh0dHBzOi8vd3d3LnBha2lzdGFudG9kYXkuY29tLnBrLzIwMjAvMDYvMTIvNDktc3VjY3VtYi10by1jb3JvbmF2aXJ1cy1pbi1wdW5qYWItd2l0aGluLTI0LWhvdXJzL9IBZGh0dHBzOi8vd3d3LnBha2lzdGFudG9kYXkuY29tLnBrLzIwMjAvMDYvMTIvNDktc3VjY3VtYi10by1jb3JvbmF2aXJ1cy1pbi1wdW5qYWItd2l0aGluLTI0LWhvdXJzL2FtcC8?hl=en-PK&gl=PK&ceid=PK%3Aen
"2,193 health workers in Pakistan have contracted coronavirus so far","KARACHI: At least 2,193 frontline healthcare workers have tested positive for coronavirus across Pakistan since the emergence of the highly-infectious disease ...",Pakistan Today,https://www.news.google.com/./articles/CBMib2h0dHBzOi8vd3d3LnBha2lzdGFudG9kYXkuY29tLnBrLzIwMjAvMDYvMDIvMjE5My1oZWFsdGgtd29ya2Vycy1pbi1wYWtpc3Rhbi1oYXZlLWNvbnRyYWN0ZWQtY29yb25hdmlydXMtc28tZmFyL9IBc2h0dHBzOi8vd3d3LnBha2lzdGFudG9kYXkuY29tLnBrLzIwMjAvMDYvMDIvMjE5My1oZWFsdGgtd29ya2Vycy1pbi1wYWtpc3Rhbi1oYXZlLWNvbnRyYWN0ZWQtY29yb25hdmlydXMtc28tZmFyL2FtcC8?hl=en-PK&gl=PK&ceid=PK%3Aen
COVID-19 Infections Rise Nearly 500% in Pakistan,"Health officials in Pakistan said Wednesday two more lawmakers have died after contracting the coronavirus, as the national tally of infections has risen by ...",VOA News,https://www.news.google.com/./articles/CAIiENLqD2ACvxV_2sWdtybqe4YqGAgEKg8IACoHCAowqc_1ATCe_xQwjqi1Bg?hl=en-PK&gl=PK&ceid=PK%3Aen
UK economy takes 25 percent hit from coronavirus: Live updates,Britain's economy shrinks by a quarter over March and April as entire sectors are shuttered by the coronavirus lockdown.,Al Jazeera English,https://www.news.google.com/./articles/CAIiEDElDbVWF1tSsnGw8_8Xx9AqFAgEKgwIACoFCAowhgIwkDgw0O8B?hl=en-PK&gl=PK&ceid=PK%3Aen
"Coronavirus: Cases in Pakistan Rise Above 69,470; Death Toll Nears 1,500-mark","The number of coronavirus cases is rapidly increasing since the government eased the lockdown before Eid, which was observed on May 24 in the country.",India.com,https://www.news.google.com/./articles/CAIiEIa7RMiA_lklj7Xkc7hpY2IqGQgEKhAIACoHCAow5dz4CjCO8d4CMOmuiwY?hl=en-PK&gl=PK&ceid=PK%3Aen
Pakistan reports 111 Covid-19 deaths in 24 hours,"ISLAMABAD: With 4,443 new coronavirus cases reported in Pakistan during last 24 hours, the national tally of the cases jumped to 148,921 on Tuesday.",Pakistan Today,https://www.news.google.com/./articles/CBMiXWh0dHBzOi8vd3d3LnBha2lzdGFudG9kYXkuY29tLnBrLzIwMjAvMDYvMTYvcGFraXN0YW4tcmVwb3J0cy0xMTEtY292aWQtMTktZGVhdGhzLWluLTI0LWhvdXJzL9IBYWh0dHBzOi8vd3d3LnBha2lzdGFudG9kYXkuY29tLnBrLzIwMjAvMDYvMTYvcGFraXN0YW4tcmVwb3J0cy0xMTEtY292aWQtMTktZGVhdGhzLWluLTI0LWhvdXJzL2FtcC8?hl=en-PK&gl=PK&ceid=PK%3Aen
Pakistan reports record 78 daily deaths from COVID-19,"KARACHI, Pakistan. Pakistan has reported 78 record deaths from pandemic in a single day since the novel coronavirus struck the South Asian nuclear state in ...",Anadolu Agency,https://www.news.google.com/./articles/CBMiY2h0dHBzOi8vd3d3LmFhLmNvbS50ci9lbi9hc2lhLXBhY2lmaWMvcGFraXN0YW4tcmVwb3J0cy1yZWNvcmQtNzgtZGFpbHktZGVhdGhzLWZyb20tY292aWQtMTkvMTg1ODcxN9IBAA?hl=en-PK&gl=PK&ceid=PK%3Aen
"Coronavirus updates, June 4: Latest news on the COVID-19 pandemic from Pakistan and around the world","The number of confirmed COVID-19 cases in Pakistan rose to 89,874 on Thursday after new infections were confirmed in the country. The province-wise break ...",Geo News,https://www.news.google.com/./articles/CAIiEP2IWgFuYtPjPyAQrwZVymUqMwgEKioIACIQueFm35xOZipy-QOS9ivtJCoUCAoiELnhZt-cTmYqcvkDkvYr7SQwqpvFBg?hl=en-PK&gl=PK&ceid=PK%3Aen
10 players left out of Pakistan squad for England tour over coronavirus: PCB,"LAHORE: Pakistan's cricket team will leave for its tour of England on Sunday without 10 players, after they tested positive for coronavirus at least once this week, ...",Pakistan Today,https://www.news.google.com/./articles/CBMieGh0dHBzOi8vd3d3LnBha2lzdGFudG9kYXkuY29tLnBrLzIwMjAvMDYvMjcvMTAtcGxheWVycy1sZWZ0LW91dC1vZi1wYWtpc3Rhbi1zcXVhZC1mb3ItZW5nbGFuZC10b3VyLW92ZXItY29yb25hdmlydXMtcGNiL9IBfGh0dHBzOi8vd3d3LnBha2lzdGFudG9kYXkuY29tLnBrLzIwMjAvMDYvMjcvMTAtcGxheWVycy1sZWZ0LW91dC1vZi1wYWtpc3Rhbi1zcXVhZC1mb3ItZW5nbGFuZC10b3VyLW92ZXItY29yb25hdmlydXMtcGNiL2FtcC8?hl=en-PK&gl=PK&ceid=PK%3Aen
"50.1% Pakistanis dub covid-19 hoax, 49.9 believe it’s yahoodi saazish: Coronavirus Attitude Tracker","ISLAMABAD: According to Coronavirus Attitude Tracker Survey, by Gallup Pakistan, 50.1 percent Pakistanis believe that covid-19 doesn't exist. The survey ...",Pakistan Today,https://www.news.google.com/./articles/CBMijAFodHRwczovL3d3dy5wYWtpc3RhbnRvZGF5LmNvbS5way8yMDIwLzA2LzI3LzUwLTEtcGFraXN0YW5pcy1kdWItY292aWQtMTktaG9heC00OS05LWJlbGlldmUtaXRzLXlhaG9vZGktc2FhemlzaC1jb3JvbmF2aXJ1cy1hdHRpdHVkZS10cmFja2VyL9IBkAFodHRwczovL3d3dy5wYWtpc3RhbnRvZGF5LmNvbS5way8yMDIwLzA2LzI3LzUwLTEtcGFraXN0YW5pcy1kdWItY292aWQtMTktaG9heC00OS05LWJlbGlldmUtaXRzLXlhaG9vZGktc2FhemlzaC1jb3JvbmF2aXJ1cy1hdHRpdHVkZS10cmFja2VyL2FtcC8?hl=en-PK&gl=PK&ceid=PK%3Aen
Pakistan opposition leader tests positive for COVID-19,"ISLAMABAD, Pakistan. Pakistan's main opposition leader Shehbaz Sharif has contracted the novel coronavirus, his family and party confirmed on Thursday.",Anadolu Agency,https://www.news.google.com/./articles/CBMiZGh0dHBzOi8vd3d3LmFhLmNvbS50ci9lbi9hc2lhLXBhY2lmaWMvcGFraXN0YW4tb3Bwb3NpdGlvbi1sZWFkZXItdGVzdHMtcG9zaXRpdmUtZm9yLWNvdmlkLTE5LzE4NzMwODjSAQA?hl=en-PK&gl=PK&ceid=PK%3Aen
The Latest: Pakistan sees more than 100 virus deaths in day,"Pakistan has recorded more than 100 deaths in a single day from COVID-19 for the first time since keeping statistics in mid-March, when the country first ...",ABC News,https://www.news.google.com/./articles/CBMiY2h0dHBzOi8vYWJjbmV3cy5nby5jb20vSGVhbHRoL3dpcmVTdG9yeS9sYXRlc3QtcGFraXN0YW4tc3VycGFzc2VzLTEwMDAwMC1jb3JvbmF2aXJ1cy1jYXNlcy03MTEyNjk1ONIBZ2h0dHBzOi8vYWJjbmV3cy5nby5jb20vYW1wL0hlYWx0aC93aXJlU3RvcnkvbGF0ZXN0LXBha2lzdGFuLXN1cnBhc3Nlcy0xMDAwMDAtY29yb25hdmlydXMtY2FzZXMtNzExMjY5NTg?hl=en-PK&gl=PK&ceid=PK%3Aen
"Setting priorities straight, Punjab govt dedicates sports complex to coronavirus infected athletes","LAHORE – Silencing its critics in an emphatic manner yet again, the Punjab government has comprehensively addressed claims that it isn't taking covid-19 ...",Pakistan Today,https://www.news.google.com/./articles/CBMijgFodHRwczovL3d3dy5wYWtpc3RhbnRvZGF5LmNvbS5way8yMDIwLzA2LzI3L3NldHRpbmctcHJpb3JpdGllcy1zdHJhaWdodC1wdW5qYWItZ292dC1kZWRpY2F0ZXMtc3BvcnRzLWNvbXBsZXgtdG8tY29yb25hdmlydXMtaW5mZWN0ZWQtYXRobGV0ZXMv0gGSAWh0dHBzOi8vd3d3LnBha2lzdGFudG9kYXkuY29tLnBrLzIwMjAvMDYvMjcvc2V0dGluZy1wcmlvcml0aWVzLXN0cmFpZ2h0LXB1bmphYi1nb3Z0LWRlZGljYXRlcy1zcG9ydHMtY29tcGxleC10by1jb3JvbmF2aXJ1cy1pbmZlY3RlZC1hdGhsZXRlcy9hbXAv?hl=en-PK&gl=PK&ceid=PK%3Aen
"Asymptomatic spread of coronavirus is ‘very rare,’ WHO says","NEW YORK: Coronavirus patients without symptoms aren't driving the spread of the virus, World Health Organisation (WHO) officials said Monday, casting doubt ...",Pakistan Today,https://www.news.google.com/./articles/CBMiZWh0dHBzOi8vd3d3LnBha2lzdGFudG9kYXkuY29tLnBrLzIwMjAvMDYvMDkvYXN5bXB0b21hdGljLXNwcmVhZC1vZi1jb3JvbmF2aXJ1cy1pcy12ZXJ5LXJhcmUtd2hvLXNheXMv0gFpaHR0cHM6Ly93d3cucGFraXN0YW50b2RheS5jb20ucGsvMjAyMC8wNi8wOS9hc3ltcHRvbWF0aWMtc3ByZWFkLW9mLWNvcm9uYXZpcnVzLWlzLXZlcnktcmFyZS13aG8tc2F5cy9hbXAv?hl=en-PK&gl=PK&ceid=PK%3Aen
Pakistan plane crashed after pilots distracted by coronavirus fears,Preliminary report finds 'human error' – including failing to put the wheels down – to blame for crash that killed 98 people in Karachi.,The Guardian,https://www.news.google.com/./articles/CAIiEF6nPsxgdi5HjmWkT4oXl4EqFwgEKg4IACoGCAowl6p7MN-zCTDZ4PsF?hl=en-PK&gl=PK&ceid=PK%3Aen
