title,text,link,source
"Coronavirus Updates: Confirmed cases in Maharashtra ..,074 new infections reported today; toll reaches 8,671","Coronavirus Updates: According to a state health department bulletin, over 1.98 lakh patients have been discharged till date and the recovery rate stands at ...",Firstpost,https://www.news.google.com/./articles/CAIiEOUglm51QmjxTUjbr2vhX40qGAgEKg8IACoHCAow5v6PATDrwA8wr93OBg?hl=en-PK&gl=PK&ceid=PK%3Aen
India coronavirus numbers explained: Four states growing faster than national average,"India Coronavirus, Covid-19 Cases Tracker Today Latest News Update: Tamil Nadu, Karnataka, Telangana, and Andhra Pradesh are now in the top ten list of ...",The Indian Express,https://www.news.google.com/./articles/CAIiEP9Aw8GEwRsrC4A2Ec4NBqoqGAgEKg8IACoHCAow3rvTBDD89X4wwLbmBQ?hl=en-PK&gl=PK&ceid=PK%3Aen
"Coronavirus (COVID-19) Update: Daily Roundup July 1, 2020","The U.S. Food and Drug Administration today announced the following actions taken in its ongoing response effort to the COVID-19 pandemic: Today, the U.S. ...",FDA.gov,https://www.news.google.com/./articles/CBMiaWh0dHBzOi8vd3d3LmZkYS5nb3YvbmV3cy1ldmVudHMvcHJlc3MtYW5ub3VuY2VtZW50cy9jb3JvbmF2aXJ1cy1jb3ZpZC0xOS11cGRhdGUtZGFpbHktcm91bmR1cC1qdWx5LTEtMjAyMNIBAA?hl=en-PK&gl=PK&ceid=PK%3Aen
"Coronavirus daily news updates, July 4: What to know today about COVID-19 in the Seattle area, Washington state and the world","Editor's note: This is a live account of COVID-19 updates from Saturday, July 4, as the day unfolded. It is no longer being updated. Click here to see all the most ...",Seattle Times,https://www.news.google.com/./articles/CBMirAFodHRwczovL3d3dy5zZWF0dGxldGltZXMuY29tL3NlYXR0bGUtbmV3cy9oZWFsdGgvY29yb25hdmlydXMtZGFpbHktbmV3cy11cGRhdGVzLWp1bHktNC13aGF0LXRvLWtub3ctdG9kYXktYWJvdXQtY292aWQtMTktaW4tdGhlLXNlYXR0bGUtYXJlYS13YXNoaW5ndG9uLXN0YXRlLWFuZC10aGUtd29ybGQv0gGyAWh0dHBzOi8vd3d3LnNlYXR0bGV0aW1lcy5jb20vc2VhdHRsZS1uZXdzL2hlYWx0aC9jb3JvbmF2aXJ1cy1kYWlseS1uZXdzLXVwZGF0ZXMtanVseS00LXdoYXQtdG8ta25vdy10b2RheS1hYm91dC1jb3ZpZC0xOS1pbi10aGUtc2VhdHRsZS1hcmVhLXdhc2hpbmd0b24tc3RhdGUtYW5kLXRoZS13b3JsZC8_YW1wPTE?hl=en-PK&gl=PK&ceid=PK%3Aen
"Coronavirus India Updates, 04 July: Bihar CM Nitish Kumar sends swab sample for Covid test after attending event with infected BJP leader","Coronavirus India News Updates Today, Covid-19 Tracker, Corona Cases in India News Update: Tamil Nadu has become the second Indian state, after ...",The Indian Express,https://www.news.google.com/./articles/CAIiEDNlXwspx9tU2f1cEjaljMwqGAgEKg8IACoHCAow3rvTBDD89X4w8ZXmBQ?hl=en-PK&gl=PK&ceid=PK%3Aen
"As coronavirus cases skyrocket, US marks July Fourth with pleas for people to skip the parties","After a week of skyrocketing coronavirus cases in the United States, officials are issuing a stark warning this July Fourth: Skip the parties.",CNN,https://www.news.google.com/./articles/CAIiEEm1tluI1W0Zv3IGGp-0SX4qGQgEKhAIACoHCAowocv1CjCSptoCMPrTpgU?hl=en-PK&gl=PK&ceid=PK%3Aen
Coronavirus update: Trump says U.S. has ‘made a lot of progress’ controlling the pandemic as the country logs 26th straight day of record average case totals,"President Trump said Saturday that his administration had “made a lot of progress” on controlling the novel coronavirus pandemic, even as the seven-day ...",The Washington Post,https://www.news.google.com/./articles/CAIiEEiI4da5FpYdEeIY301qBfkqGAgEKg8IACoHCAowjtSUCjC30XQw1o3TBg?hl=en-PK&gl=PK&ceid=PK%3Aen
WHO says Pakistan should reimpose lockdown to curb coronavirus,"Cases increased exponentially since the lockdown was lifted in late May, with record-high cases registered on Tuesday.",Al Jazeera English,https://www.news.google.com/./articles/CAIiEDqnVi1rh3adLYZRPgc8fywqFAgEKgwIACoFCAowhgIwkDgw0O8B?hl=en-PK&gl=PK&ceid=PK%3Aen
"U.S. Coronavirus Cases Are Rising Sharply, but Deaths Are Still Down","After a minor late-spring lull, the number of confirmed coronavirus cases in the United States is once again on the rise. States like Arizona, Florida and Texas are ...",The New York Times,https://www.news.google.com/./articles/CAIiELahHh62kWiKONg666dsvAoqFwgEKg8IACoHCAowjuuKAzCWrzwwxoIY?hl=en-PK&gl=PK&ceid=PK%3Aen
"Coronavirus Australia live news: Victoria reports 67 new cases, Daniel Andrews announces support for public housing residents in lockdown","Victoria's Chief Health Officer Brett Sutton says four more cases of COVID-19 have been linked to Melbourne public housing units under lockdown, warning that ...",ABC News,https://www.news.google.com/./articles/CAIiEAQknYwXAbqYCyzFoUyIAS8qFwgEKg4IACoGCAow3vI9MPeaCDDEvrgG?hl=en-PK&gl=PK&ceid=PK%3Aen
"Today’s coronavirus news: As England’s bars reopen, Boris says ‘let’s not blow it now’; Ontario courthouses to resume in-person hearings Monday",The latest coronavirus news from Canada and around the world Saturday. This file will be updated throughout the day. Web links to longer stories if available.,Toronto Star,https://www.news.google.com/./articles/CBMiugFodHRwczovL3d3dy50aGVzdGFyLmNvbS9uZXdzL2NhbmFkYS8yMDIwLzA3LzA0L3RvZGF5cy1jb3JvbmF2aXJ1cy1uZXdzLWFzLWVuZ2xhbmRzLWJhci1yZW9wZW4tYm9yaXMtc2F5cy1sZXRzLW5vdC1ibG93LWl0LW5vdy1vbnRhcmlvLWNvdXJ0aG91c2VzLXRvLXJlc3VtZS1pbi1wZXJzb24taGVhcmluZ3MtbW9uZGF5Lmh0bWzSAb4BaHR0cHM6Ly93d3cudGhlc3Rhci5jb20vYW1wL25ld3MvY2FuYWRhLzIwMjAvMDcvMDQvdG9kYXlzLWNvcm9uYXZpcnVzLW5ld3MtYXMtZW5nbGFuZHMtYmFyLXJlb3Blbi1ib3Jpcy1zYXlzLWxldHMtbm90LWJsb3ctaXQtbm93LW9udGFyaW8tY291cnRob3VzZXMtdG8tcmVzdW1lLWluLXBlcnNvbi1oZWFyaW5ncy1tb25kYXkuaHRtbA?hl=en-PK&gl=PK&ceid=PK%3Aen
Coronavirus Briefing: What Happened Today,"Californians are asking themselves, what went wrong?",The New York Times,https://www.news.google.com/./articles/CAIiEMrvNbQTBnZ58vAa8sbVnb4qFwgEKg8IACoHCAowjuuKAzCWrzww5oEY?hl=en-PK&gl=PK&ceid=PK%3Aen
WHO sees 'green shoots of hope' in coronavirus pandemic: Live,"Despite cases still accelerating globally, WHO chief says steroid-based treatment holds promise in fight against virus.",Al Jazeera English,https://www.news.google.com/./articles/CAIiEKbbT7wO4mofPiFGPZblExQqFAgEKgwIACoFCAowhgIwkDgw0O8B?hl=en-PK&gl=PK&ceid=PK%3Aen
Tamil Nadu Coronavirus News Live Updates: CM to meet TN Governor today to discuss Sathankulam deaths and COVID-19 in state,"Tamil Nadu Chennai Coronavirus (COVID-19) Latest News Live Updates Today, Chennai Lockdown Guidelines, TN Corona Virus Cases News Updates: Tamil ...",The Indian Express,https://www.news.google.com/./articles/CAIiEDXF6SqWaGHdgrsxn7Lc6jAqGAgEKg8IACoHCAow3rvTBDD89X4w8YzmBQ?hl=en-PK&gl=PK&ceid=PK%3Aen
Pakistan hospitals struggle as coronavirus cases explode,Country sees multiple consecutive days of record cases and deaths as overworked doctors plead for 'breathing space'.,Al Jazeera English,https://www.news.google.com/./articles/CAIiEFuOCYeq7vIl0fV87oR3E7wqFAgEKgwIACoFCAowhgIwkDgw87UI?hl=en-PK&gl=PK&ceid=PK%3Aen
"Coronavirus India live updates: cases, deaths and news, today","Live coverage of the Covid-19 pandemic in India: breaking news, updates and latest statistics as they emerge throughout today, Sunday 28 June.",AS English,https://www.news.google.com/./articles/CBMiQmh0dHBzOi8vZW4uYXMuY29tL2VuLzIwMjAvMDYvMjgvbGF0ZXN0X25ld3MvMTU5MzMyNjI3MV84NjQ0MDguaHRtbNIBRmh0dHBzOi8vZW4uYXMuY29tL2VuLzIwMjAvMDYvMjgvbGF0ZXN0X25ld3MvMTU5MzMyNjI3MV84NjQ0MDguYW1wLmh0bWw?hl=en-PK&gl=PK&ceid=PK%3Aen
"Telangana, Andhra Pradesh Coronavirus Live Updates: Telangana govt accuses private labs of not adhering to testing norms","Telangana, Andhra Pradesh, Hyderabad Coronavirus Lockdown News Live Updates Today, Covid-19 Cases Tracker, Corona Cases News Update: For the last ...",The Indian Express,https://www.news.google.com/./articles/CBMiqwFodHRwczovL2luZGlhbmV4cHJlc3MuY29tL2FydGljbGUvaW5kaWEvYW5kaHJhLXByYWRlc2gtdGVsYW5nYW5hLWh5ZGVyYWJhZC1jb3JvbmF2aXJ1cy1sb2NrZG93bi1uZXdzLWxpdmUtdXBkYXRlcy1jb3ZpZC0xOS1jb3JvbmEtY2FzZXMta3Vybm9vbC1yYW5nYS1yZWRkeS11cGRhdGUtNjQ5MDQ5OS_SAbABaHR0cHM6Ly9pbmRpYW5leHByZXNzLmNvbS9hcnRpY2xlL2luZGlhL2FuZGhyYS1wcmFkZXNoLXRlbGFuZ2FuYS1oeWRlcmFiYWQtY29yb25hdmlydXMtbG9ja2Rvd24tbmV3cy1saXZlLXVwZGF0ZXMtY292aWQtMTktY29yb25hLWNhc2VzLWt1cm5vb2wtcmFuZ2EtcmVkZHktdXBkYXRlLTY0OTA0OTkvbGl0ZS8?hl=en-PK&gl=PK&ceid=PK%3Aen
"Coronavirus daily news updates, July 3: What to know today about COVID-19 in the Seattle area, Washington state and the world","Throughout Friday, on this page, we'll post updates from Seattle Times journalists and others on the pandemic and its effects on the Seattle area, the Pacific ...",Seattle Times,https://www.news.google.com/./articles/CBMirAFodHRwczovL3d3dy5zZWF0dGxldGltZXMuY29tL3NlYXR0bGUtbmV3cy9oZWFsdGgvY29yb25hdmlydXMtZGFpbHktbmV3cy11cGRhdGVzLWp1bHktMy13aGF0LXRvLWtub3ctdG9kYXktYWJvdXQtY292aWQtMTktaW4tdGhlLXNlYXR0bGUtYXJlYS13YXNoaW5ndG9uLXN0YXRlLWFuZC10aGUtd29ybGQv0gGyAWh0dHBzOi8vd3d3LnNlYXR0bGV0aW1lcy5jb20vc2VhdHRsZS1uZXdzL2hlYWx0aC9jb3JvbmF2aXJ1cy1kYWlseS1uZXdzLXVwZGF0ZXMtanVseS0zLXdoYXQtdG8ta25vdy10b2RheS1hYm91dC1jb3ZpZC0xOS1pbi10aGUtc2VhdHRsZS1hcmVhLXdhc2hpbmd0b24tc3RhdGUtYW5kLXRoZS13b3JsZC8_YW1wPTE?hl=en-PK&gl=PK&ceid=PK%3Aen
"As Coronavirus Slams Houston Hospitals, It’s Like New York ‘All Over Again’","HOUSTON — Over the past week, Dr. Aric Bakshy, an emergency physician at Houston Methodist, had to decide which coronavirus patients he should admit to ...",The New York Times,https://www.news.google.com/./articles/CAIiED-q5BlflBECvkXoCJTosaQqFwgEKg8IACoHCAowjuuKAzCWrzwwt4QY?hl=en-PK&gl=PK&ceid=PK%3Aen
"Coronavirus (COVID-19) Update: Daily Roundup July 2, 2020",The U.S. Food and Drug Administration today announced the following actions taken in its ongoing response effort to the COVID-19 pandemic: The U.S. Food ...,FDA.gov,https://www.news.google.com/./articles/CBMiaWh0dHBzOi8vd3d3LmZkYS5nb3YvbmV3cy1ldmVudHMvcHJlc3MtYW5ub3VuY2VtZW50cy9jb3JvbmF2aXJ1cy1jb3ZpZC0xOS11cGRhdGUtZGFpbHktcm91bmR1cC1qdWx5LTItMjAyMNIBAA?hl=en-PK&gl=PK&ceid=PK%3Aen
Coronavirus updates: Surgeon General cautions that 'deaths lag at least two weeks' as cases rise in 40 states; 31 MLB players test positive,"Dr. Jerome Adams urging Americans to wear face masks, socially distance. Forty states have seen cases increase last two weeks. Latest on coronavirus.",USA TODAY,https://www.news.google.com/./articles/CAIiEHmqZGsv1jOcl-V1G5TEBoIqGQgEKhAIACoHCAowjsP7CjCSpPQCMKCK0wU?hl=en-PK&gl=PK&ceid=PK%3Aen
Lack of leadership 'greatest threat' in coronavirus fight: Live,"WHO warns pandemic accelerating as it reports record daily global case rise while outbreak surges in Brazil, India.",Al Jazeera English,https://www.news.google.com/./articles/CAIiEIxBFUGtCkSAJpJnS1Hb4x0qFAgEKgwIACoFCAowhgIwkDgw0O8B?hl=en-PK&gl=PK&ceid=PK%3Aen
239 Experts With 1 Big Claim: The Coronavirus Is Airborne,"The coronavirus is finding new victims worldwide, in bars and restaurants, offices, markets and casinos, giving rise to frightening clusters of infection that ...",The New York Times,https://www.news.google.com/./articles/CAIiEGp18wGfU12v7GbG2xMqcBUqFwgEKg8IACoHCAowjuuKAzCWrzwwqIQY?hl=en-PK&gl=PK&ceid=PK%3Aen
"US coronavirus deaths top 110,000: Live updates",Number of cases approach two million as nationwide protests against racial injustice spark fears of resurgence of virus.,Al Jazeera English,https://www.news.google.com/./articles/CAIiEFYk8sricYhxcYgCkPObCEMqFAgEKgwIACoFCAowhgIwkDgw0O8B?hl=en-PK&gl=PK&ceid=PK%3Aen
Coronavirus Today - July 2,"As the Fourth of July holiday weekend nears, public health leaders worry about celebrating crowds and further coronavirus spread.",North Carolina Health News,https://www.news.google.com/./articles/CBMiTGh0dHBzOi8vd3d3Lm5vcnRoY2Fyb2xpbmFoZWFsdGhuZXdzLm9yZy8yMDIwLzA3LzAyL2Nvcm9uYXZpcnVzLXRvZGF5LWp1bHktMi_SAQA?hl=en-PK&gl=PK&ceid=PK%3Aen
'No time to take foot off pedal' - WHO: Coronavirus live updates,WHO urges countries to keep up with efforts to contain coronavirus as global situation worsens.,Al Jazeera English,https://www.news.google.com/./articles/CAIiEHMGd6xosHCLkS4wIYAI8iIqFAgEKgwIACoFCAowhgIwkDgw0O8B?hl=en-PK&gl=PK&ceid=PK%3Aen
"Coronavirus daily news updates, July 2: What to know today about COVID-19 in the Seattle area, Washington state and the world","Editor's note: This is a live account of COVID-19 updates from Thursday, July 2, as the day unfolded. It is no longer being updated. Click here to see all the most ...",Seattle Times,https://www.news.google.com/./articles/CBMirAFodHRwczovL3d3dy5zZWF0dGxldGltZXMuY29tL3NlYXR0bGUtbmV3cy9oZWFsdGgvY29yb25hdmlydXMtZGFpbHktbmV3cy11cGRhdGVzLWp1bHktMi13aGF0LXRvLWtub3ctdG9kYXktYWJvdXQtY292aWQtMTktaW4tdGhlLXNlYXR0bGUtYXJlYS13YXNoaW5ndG9uLXN0YXRlLWFuZC10aGUtd29ybGQv0gGyAWh0dHBzOi8vd3d3LnNlYXR0bGV0aW1lcy5jb20vc2VhdHRsZS1uZXdzL2hlYWx0aC9jb3JvbmF2aXJ1cy1kYWlseS1uZXdzLXVwZGF0ZXMtanVseS0yLXdoYXQtdG8ta25vdy10b2RheS1hYm91dC1jb3ZpZC0xOS1pbi10aGUtc2VhdHRsZS1hcmVhLXdhc2hpbmd0b24tc3RhdGUtYW5kLXRoZS13b3JsZC8_YW1wPTE?hl=en-PK&gl=PK&ceid=PK%3Aen
Live: WHO reports largest 24-hour increase in coronavirus cases,"The UN health agency recorded 183000 new cases, with Brazil and the US reporting the most new infections.",Al Jazeera English,https://www.news.google.com/./articles/CAIiEIB7nMsvc__ICee0HKKMZ8gqFAgEKgwIACoFCAowhgIwkDgw0O8B?hl=en-PK&gl=PK&ceid=PK%3Aen
Coronavirus: John Magufuli declares Tanzania free of Covid-19,"Tanzania's President John Magufuli has declared the country ""coronavirus-free"" thanks to prayers by citizens. ""The corona disease has been eliminated thanks ...",BBC News,https://www.news.google.com/./articles/CBMiLmh0dHBzOi8vd3d3LmJiYy5jb20vbmV3cy93b3JsZC1hZnJpY2EtNTI5NjYwMTbSATJodHRwczovL3d3dy5iYmMuY29tL25ld3MvYW1wL3dvcmxkLWFmcmljYS01Mjk2NjAxNg?hl=en-PK&gl=PK&ceid=PK%3Aen
Coronavirus: Beijing spike continues with 36 new cases,"Beijing has recorded 36 new locally-transmitted coronavirus cases, amid fears of a second wave in the Chinese capital. Another 36 cases were also recorded on ...",BBC News,https://www.news.google.com/./articles/CBMiMmh0dHBzOi8vd3d3LmJiYy5jb20vbmV3cy93b3JsZC1hc2lhLWNoaW5hLTUzMDQ2NDU00gE2aHR0cHM6Ly93d3cuYmJjLmNvbS9uZXdzL2FtcC93b3JsZC1hc2lhLWNoaW5hLTUzMDQ2NDU0?hl=en-PK&gl=PK&ceid=PK%3Aen
"What you need to know about coronavirus on Friday, July 3",A version of this story appeared in the July 3 edition of CNN's Coronavirus: Fact vs. Fiction newsletter. Sign up here to receive the need-to-know headlines every ...,CNN,https://www.news.google.com/./articles/CAIiEOh2wdO3bSlvoleaFYJHmjoqGQgEKhAIACoHCAowocv1CjCSptoCMPrTpgU?hl=en-PK&gl=PK&ceid=PK%3Aen
"Coronavirus pandemic accelerating, warns WHO head: Live","The global coronavirus pandemic is accelerating, with Thursday's 150,000 new cases the highest in a single day, World Health Organization (WHO) director ...",Al Jazeera English,https://www.news.google.com/./articles/CAIiEKHN1X0twWhxX4tsVwBRFjsqFAgEKgwIACoFCAowhgIwkDgw0O8B?hl=en-PK&gl=PK&ceid=PK%3Aen
"Coronavirus: California records almost 4,000 new cases as some counties pause reporting","California reported almost 4000 new coronavirus cases on Friday, but several counties, including Los Angeles, did not report new data.",The Mercury News,https://www.news.google.com/./articles/CAIiEAfkWR1BPYCWmWoFuL4PY3QqGAgEKg8IACoHCAowh7LTATCV2zUwx5SsBQ?hl=en-PK&gl=PK&ceid=PK%3Aen
"Coronavirus in Brevard, July 3: County records 186 new cases, one new death","Here are updates about coronavirus cases in Brevard, according to the Florida Department of Health, as of July 3, 2020.",Florida Today,https://www.news.google.com/./articles/CAIiELnf3pHMx7RRhM-7vU_Vj00qGQgEKhAIACoHCAowjsP_CjD2kPkCMNzt5wU?hl=en-PK&gl=PK&ceid=PK%3Aen
Governor Cuomo Updates New Yorkers on State's Progress During COVID-19 Pandemic,1.38 Percent of Yesterday's COVID-19 Tests were Positive. 9 COVID-19 Deaths in New York State Yesterday. Confirms 918 Additional Coronavirus Cases in ...,ny.gov,https://www.news.google.com/./articles/CBMibmh0dHBzOi8vd3d3LmdvdmVybm9yLm55Lmdvdi9uZXdzL2dvdmVybm9yLWN1b21vLXVwZGF0ZXMtbmV3LXlvcmtlcnMtc3RhdGVzLXByb2dyZXNzLWR1cmluZy1jb3ZpZC0xOS1wYW5kZW1pYy0y0gEA?hl=en-PK&gl=PK&ceid=PK%3Aen
"France reports over 1,500 new coronavirus cases: Live updates","Number of new cases is highest since May 30, way above daily average of 498 seen over the last seven days.",Al Jazeera English,https://www.news.google.com/./articles/CAIiEJU_G0M7W_LNVOGwIhHcdfQqFAgEKgwIACoFCAowhgIwkDgw0O8B?hl=en-PK&gl=PK&ceid=PK%3Aen
"Today's coronavirus news: Ontario's regional health units report 164 new cases of COVID-19; Toronto accounted for 80 new cases, Peel Region 21 cases and York Region 20.",Ford says Emergency Management Ontario teams have been dispatched to Essex County to help migrant farm workers; Blue Jays not guaranteed exemption to .,Toronto Star,https://www.news.google.com/./articles/CAIiEL9wJLDVS3Ib9e0RshTE4JwqFwgEKg4IACoGCAow6bV4MPfJDDDB1MUF?hl=en-PK&gl=PK&ceid=PK%3Aen
"Coronavirus in Brevard, July 4: County adds 87 cases, one new death","Here are updates about coronavirus cases in Brevard, according to the Florida Department of Health, as of July 4, 2020.",Florida Today,https://www.news.google.com/./articles/CAIiELIZmiRcCaAo3PqQIxVH0p8qGQgEKhAIACoHCAowjsP_CjD2kPkCMNzt5wU?hl=en-PK&gl=PK&ceid=PK%3Aen
"In North Korea, Coronavirus Hurts More Than Any Sanctions Could","Closing the border with China crippled the regime's few remaining methods, legal and otherwise, for bringing in much-needed foreign currency.",The New York Times,https://www.news.google.com/./articles/CAIiEA5a-nE5ihwS857Y-WmMqAwqFwgEKg8IACoHCAowjuuKAzCWrzww9oAY?hl=en-PK&gl=PK&ceid=PK%3Aen
Coronavirus Today - July 1,"As North Carolina sees troubling increases in COVID-19 cases and hospitalizations, the decision on what the next school year looks like has been postponed.",North Carolina Health News,https://www.news.google.com/./articles/CBMiTGh0dHBzOi8vd3d3Lm5vcnRoY2Fyb2xpbmFoZWFsdGhuZXdzLm9yZy8yMDIwLzA3LzAxL2Nvcm9uYXZpcnVzLXRvZGF5LWp1bHktMS_SAQA?hl=en-PK&gl=PK&ceid=PK%3Aen
"Utah's coronavirus surge continues with a record-tying 676 new cases, but no new deaths reported","Editor's note: The Salt Lake Tribune is providing free access to critical stories about the coronavirus. Sign up for our Top Stories newsletter, sent to your inbox ...",Salt Lake Tribune,https://www.news.google.com/./articles/CBMiP2h0dHBzOi8vd3d3LnNsdHJpYi5jb20vbmV3cy8yMDIwLzA3LzA0L3V0YWhzLWNvcm9uYXZpcnVzLXN1cmdlL9IBAA?hl=en-PK&gl=PK&ceid=PK%3Aen
Texas Governor Says 'No Reason Today To Be Alarmed' As Coronavirus Cases Set Record,"Gov. Greg Abbott said Texas hospitals have ""abundant"" capacity. Mayors from the state's largest cities asked Abbott for the authority to require face masks amid ...",NPR,https://www.news.google.com/./articles/CAIiEP0_wRkF2tnY6tH6_dxqb8wqFggEKg4IACoGCAow9vBNMK3UCDCvpUk?hl=en-PK&gl=PK&ceid=PK%3Aen
Beijing shuts schools over new coronavirus outbreak: Live updates,Officials in Chinese capital urge residents not to leave the city after new infections are detected.,Al Jazeera English,https://www.news.google.com/./articles/CAIiEC31lU6Bb_8ZIBglwo7yfo8qFAgEKgwIACoFCAowhgIwkDgw0O8B?hl=en-PK&gl=PK&ceid=PK%3Aen
Trump Uses Mount Rushmore Speech to Deliver Divisive Culture War Message,"WASHINGTON — Standing in a packed amphitheater in front of Mount Rushmore for an Independence Day celebration, President Trump delivered a dark and ...",The New York Times,https://www.news.google.com/./articles/CAIiENHTQ_GwvM4N1lVKqagkK9UqFwgEKg8IACoHCAowjuuKAzCWrzwwqIQY?hl=en-PK&gl=PK&ceid=PK%3Aen
Brazil and the U.S. Drive New Coronavirus Infections,Japan's workers have remained employed in large numbers despite a recession amid the pandemic. And President Trump said at a rally that he wanted to slow ...,The New York Times,https://www.news.google.com/./articles/CAIiEL0CECnaWnAKNbig_MPG-t8qFwgEKg8IACoHCAowjuuKAzCWrzwwpoEY?hl=en-PK&gl=PK&ceid=PK%3Aen
"Coronavirus's Genetics Not Changing Much, And That Bodes Well For A Vaccine : Shots - Health News","A coronavirus vaccine could become ineffective if the virus were to undergo certain genetic changes. But so far, so good: Scientists see no evidence that's ...",NPR,https://www.news.google.com/./articles/CAIiEJ2W7ewjmKduGs99zD17hvMqFggEKg4IACoGCAow9vBNMK3UCDCvpUk?hl=en-PK&gl=PK&ceid=PK%3Aen
Coronavirus updates: Some Florida beaches open despite record daily case count; fireworks canceled as states fear Fourth of July crowds,"Thanks to rising coronavirus infections in the U.S.,most Americans' Fourth of July celebrations this year won't include a community fireworks display, a trip to a ...",USA TODAY,https://www.news.google.com/./articles/CAIiEN3e0HybkDDVwJvwW7Ri6h8qGQgEKhAIACoHCAowjsP7CjCSpPQCMM_b5QU?hl=en-PK&gl=PK&ceid=PK%3Aen
WHO: Coronavirus currently hitting the Americas the hardest,"The current situation in Brazil, now a global hotspot for the virus, is of increasing concern, especially in cities.",Al Jazeera English,https://www.news.google.com/./articles/CAIiEERLu7iuYcurrknlAOlJ5vIqFAgEKgwIACoFCAowhgIwkDgw0O8B?hl=en-PK&gl=PK&ceid=PK%3Aen
Coronavirus: Commission unveils EU vaccines strategy,"Today, to help protect people everywhere, the European Commission is presenting a European strategy to accelerate the development, manufacturing and ...",EU News,https://www.news.google.com/./articles/CBMiQGh0dHBzOi8vZWMuZXVyb3BhLmV1L2NvbW1pc3Npb24vcHJlc3Njb3JuZXIvZGV0YWlsL2VuL2lwXzIwXzExMDPSAQA?hl=en-PK&gl=PK&ceid=PK%3Aen
"Coronavirus update: Mass graves dug in Bolivia to cope with rising death toll, pubs reopen in England","Authorities are digging mass graves at cemeteries across Bolivia to cope with a new wave of victims from COVID-19, meanwhile patrons are allowed their first ...",ABC News,https://www.news.google.com/./articles/CAIiEMX1deuqxUHYXF8du7TzUVAqFggEKg4IACoGCAow3vI9MPeaCDDciw4?hl=en-PK&gl=PK&ceid=PK%3Aen
"Data reveals coronavirus hotspots in Bradford, Barnsley and Rochdale",Exclusive: figures reveal locations with highest levels of new infections after Leicester.,The Guardian,https://www.news.google.com/./articles/CAIiENZZCkcVqPKmGxgc2iZ7t1kqFggEKg4IACoGCAowl6p7MN-zCTDlkko?hl=en-PK&gl=PK&ceid=PK%3Aen
"Coronavirus prediction model says NY, NJ currently on track for ‘controlled disease growth'",Only three states are still currently listed as on track to contain COVID-19.,SILive.com,https://www.news.google.com/./articles/CAIiEFTvvBPjmnagngunUsRJiRoqGQgEKhAIACoHCAowrqX_CjD2tPgCMM26ngY?hl=en-PK&gl=PK&ceid=PK%3Aen
'The risk remains': Sydney hotel guards under microscope as NSW records 14 new cases,"The use of private security guards in Sydney's quarantine hotels is now under the microscope, with failures in monitoring guest movements being blamed for the ...",Sydney Morning Herald,https://www.news.google.com/./articles/CAIiEDpS7xkuivYBEPWB_rHo9PcqGQgEKhAIACoHCAowxqmICzDg_IYDMM6lmwY?hl=en-PK&gl=PK&ceid=PK%3Aen
Covid 19 coronavirus: No new cases again today,"There are no new cases of Covid-19 again today. The number of active cases in New Zealand remains at 18, all of which are in managed isolation or quarantine ...",New Zealand Herald,https://www.news.google.com/./articles/CBMiR2h0dHBzOi8vd3d3Lm56aGVyYWxkLmNvLm56L256L25ld3MvYXJ0aWNsZS5jZm0_Y19pZD0xJm9iamVjdGlkPTEyMzQ1NDk30gEA?hl=en-PK&gl=PK&ceid=PK%3Aen
"As the coronavirus spread, two social media communities drifted apart",Researchers are exploring the tale of two online communities and their response to COVID-19: the r/Coronavirus and r/China_flu discussion boards on the ...,CU Boulder Today,https://www.news.google.com/./articles/CBMiZ2h0dHBzOi8vd3d3LmNvbG9yYWRvLmVkdS90b2RheS8yMDIwLzA3LzAyL2Nvcm9uYXZpcnVzLXNwcmVhZC10d28tc29jaWFsLW1lZGlhLWNvbW11bml0aWVzLWRyaWZ0ZWQtYXBhcnTSAQA?hl=en-PK&gl=PK&ceid=PK%3Aen
"Coronavirus US summary: cases, deaths and news - 19 June","Coverage of the Covid-19 pandemic in the United States: breaking news, updates and statistics as they emerged throughout 19 June 2020.",AS English,https://www.news.google.com/./articles/CBMiQmh0dHBzOi8vZW4uYXMuY29tL2VuLzIwMjAvMDYvMTkvbGF0ZXN0X25ld3MvMTU5MjUyMDI5MF85MDg2MTMuaHRtbNIBRmh0dHBzOi8vZW4uYXMuY29tL2VuLzIwMjAvMDYvMTkvbGF0ZXN0X25ld3MvMTU5MjUyMDI5MF85MDg2MTMuYW1wLmh0bWw?hl=en-PK&gl=PK&ceid=PK%3Aen
24 new coronavirus cases brings Hawaii's statewide total to 999,Hawaii health officials reported 24 new coronavirus cases today as the statewide total number of infections since the start of the outbreak rose to 999. Today's ...,Honolulu Star-Advertiser,https://www.news.google.com/./articles/CBMid2h0dHBzOi8vd3d3LnN0YXJhZHZlcnRpc2VyLmNvbS8yMDIwLzA3LzA0L2JyZWFraW5nLW5ld3MvMjQtbmV3LWNvcm9uYXZpcnVzLWNhc2VzLWJyaW5ncy1oYXdhaWlzLXN0YXRld2lkZS10b3RhbC10by05OTkv0gEA?hl=en-PK&gl=PK&ceid=PK%3Aen
June 26 coronavirus news,"More than half of US states are seeing an increase in Covid-19 cases. In Texas, some bars have been ordered to close as officials fear ""apocalyptic"" surges if ...",CNN,https://www.news.google.com/./articles/CBMiUWh0dHBzOi8vd3d3LmNubi5jb20vd29ybGQvbGl2ZS1uZXdzL2Nvcm9uYXZpcnVzLXBhbmRlbWljLTA2LTI2LTIwLWludGwvaW5kZXguaHRtbNIBVWh0dHBzOi8vYW1wLmNubi5jb20vY25uL3dvcmxkL2xpdmUtbmV3cy9jb3JvbmF2aXJ1cy1wYW5kZW1pYy0wNi0yNi0yMC1pbnRsL2luZGV4Lmh0bWw?hl=en-PK&gl=PK&ceid=PK%3Aen
Florida Smashes Coronavirus Case Record: Nearly 9000 Positive Cases On Thursday,Florida suspends consumption of alcohol at bars as the state's daily count of coronavirus infections reaches nearly 9000 — smashing the earlier record set on ...,NPR,https://www.news.google.com/./articles/CAIiEIzmuvjLz97l76rzawFL59cqFggEKg4IACoGCAow9vBNMK3UCDCvpUk?hl=en-PK&gl=PK&ceid=PK%3Aen
Coronavirus: US reports record jump in new coronavirus cases — as it happened,Today's top stories: Pace of US jobless claims continues to slow. France to extend unemployment scheme for two years. Academics say antibody tests offer 'no ...,Financial Times,https://www.news.google.com/./articles/CAIiEDliRFHPA_96b7a6IURmGVoqFwgEKg8IACoHCAow-4fWBzD4z0gw8tp6?hl=en-PK&gl=PK&ceid=PK%3Aen
