title,text,link,source
Today's coronavirus numbers – July 4,What's new today: Tests administered pass the 1 million mark.,The Outer Banks Voice,https://www.news.google.com/./articles/CBMiTWh0dHBzOi8vd3d3Lm91dGVyYmFua3N2b2ljZS5jb20vMjAyMC8wNy8wNC90b2RheXMtY29yb25hdmlydXMtbnVtYmVycy1qdWx5LTQv0gEA?hl=en-PK&gl=PK&ceid=PK%3Aen
Coronavirus: Commission unveils EU vaccines strategy,"Today, to help protect people everywhere, the European Commission is presenting a European strategy to accelerate the development, manufacturing and ...",EU News,https://www.news.google.com/./articles/CBMiQGh0dHBzOi8vZWMuZXVyb3BhLmV1L2NvbW1pc3Npb24vcHJlc3Njb3JuZXIvZGV0YWlsL2VuL2lwXzIwXzExMDPSAQA?hl=en-PK&gl=PK&ceid=PK%3Aen
"In North Korea, Coronavirus Hurts More Than Any Sanctions Could","Closing the border with China crippled the regime's few remaining methods, legal and otherwise, for bringing in much-needed foreign currency.",The New York Times,https://www.news.google.com/./articles/CAIiEA5a-nE5ihwS857Y-WmMqAwqFwgEKg8IACoHCAowjuuKAzCWrzww9oAY?hl=en-PK&gl=PK&ceid=PK%3Aen
Coronavirus Today - July 1,"As North Carolina sees troubling increases in COVID-19 cases and hospitalizations, the decision on what the next school year looks like has been postponed.",North Carolina Health News,https://www.news.google.com/./articles/CBMiTGh0dHBzOi8vd3d3Lm5vcnRoY2Fyb2xpbmFoZWFsdGhuZXdzLm9yZy8yMDIwLzA3LzAxL2Nvcm9uYXZpcnVzLXRvZGF5LWp1bHktMS_SAQA?hl=en-PK&gl=PK&ceid=PK%3Aen
"Coronavirus US summary: cases, deaths and news - 19 June","Coverage of the Covid-19 pandemic in the United States: breaking news, updates and statistics as they emerged throughout 19 June 2020.",AS English,https://www.news.google.com/./articles/CBMiQmh0dHBzOi8vZW4uYXMuY29tL2VuLzIwMjAvMDYvMTkvbGF0ZXN0X25ld3MvMTU5MjUyMDI5MF85MDg2MTMuaHRtbNIBRmh0dHBzOi8vZW4uYXMuY29tL2VuLzIwMjAvMDYvMTkvbGF0ZXN0X25ld3MvMTU5MjUyMDI5MF85MDg2MTMuYW1wLmh0bWw?hl=en-PK&gl=PK&ceid=PK%3Aen
Governor Cuomo Updates New Yorkers on State's Progress During COVID-19 Pandemic,1.16 Percent of Yesterday's COVID-19 Tests were Positive. 11 COVID-19 Deaths in New York State Yesterday. Confirms 726 Additional Coronavirus Cases in ...,ny.gov,https://www.news.google.com/./articles/CBMibmh0dHBzOi8vd3d3LmdvdmVybm9yLm55Lmdvdi9uZXdzL2dvdmVybm9yLWN1b21vLXVwZGF0ZXMtbmV3LXlvcmtlcnMtc3RhdGVzLXByb2dyZXNzLWR1cmluZy1jb3ZpZC0xOS1wYW5kZW1pYy0z0gEA?hl=en-PK&gl=PK&ceid=PK%3Aen
Coronavirus: New cases in US top 25000 for fifth straight day — as it happened,Today's top stories: The spread of Covid-19 has gathered pace with the situation deteriorating markedly in Latin America. China bans shipments from US Tyson ...,Financial Times,https://www.news.google.com/./articles/CAIiEKiZIyu8YbvJzKqdforedTAqFwgEKg8IACoHCAow-4fWBzD4z0gw8tp6?hl=en-PK&gl=PK&ceid=PK%3Aen
Coronavirus question: Is a mask effective when you wear it just below your nose?,"NJ Advance Media has launched a daily coronavirus question, a *service* in which our reporters provide answers to commonly asked questions about the ...",NJ.com,https://www.news.google.com/./articles/CAIiEJt556k6quJhMUA273ZtTLcqGQgEKhAIACoHCAowr6T_CjD1tPgCMNKcpAY?hl=en-PK&gl=PK&ceid=PK%3Aen
"Tom Hanks on surviving coronavirus: 'I had crippling body aches, fatigue and couldn't concentrate'","The world's most relatable megastar talks about his Covid-19 experience, his fears for the future, and whether he's really just so gosh darned nice.",The Guardian,https://www.news.google.com/./articles/CAIiEHML15BPwNMS97oVQY9y9DcqFggEKg4IACoGCAowl6p7MN-zCTDlkko?hl=en-PK&gl=PK&ceid=PK%3Aen
Coronavirus: US reports record jump in new coronavirus cases — as it happened,Today's top stories: Pace of US jobless claims continues to slow. France to extend unemployment scheme for two years. Academics say antibody tests offer 'no ...,Financial Times,https://www.news.google.com/./articles/CAIiEDliRFHPA_96b7a6IURmGVoqFwgEKg8IACoHCAow-4fWBzD4z0gw8tp6?hl=en-PK&gl=PK&ceid=PK%3Aen
Florida and South Carolina Again Set Records as U.S. Coronavirus Cases Surge,"Southern officials warn of new clusters linked to bars and frat parties. Health officials feared the Trump campaign rally in Tulsa, Okla., could be a “superspreader” ...",The New York Times,https://www.news.google.com/./articles/CAIiEH74mtGSv39r7qHZKTxWQmAqFwgEKg8IACoHCAowjuuKAzCWrzwwpoEY?hl=en-PK&gl=PK&ceid=PK%3Aen
"As the coronavirus spread, two social media communities drifted apart",Researchers are exploring the tale of two online communities and their response to COVID-19: the r/Coronavirus and r/China_flu discussion boards on the ...,CU Boulder Today,https://www.news.google.com/./articles/CBMiZ2h0dHBzOi8vd3d3LmNvbG9yYWRvLmVkdS90b2RheS8yMDIwLzA3LzAyL2Nvcm9uYXZpcnVzLXNwcmVhZC10d28tc29jaWFsLW1lZGlhLWNvbW11bml0aWVzLWRyaWZ0ZWQtYXBhcnTSAQA?hl=en-PK&gl=PK&ceid=PK%3Aen
"Austin ICUs could be overrun in 10 days amid Texas coronavirus spike, mayor says","AUSTIN, Texas – Austin-area intensive-care units are in danger of being overrun in the next 10 days to two weeks if the number of people admitted to the ...",USA TODAY,https://www.news.google.com/./articles/CBMigwFodHRwczovL3d3dy51c2F0b2RheS5jb20vc3RvcnkvbmV3cy9uYXRpb24vMjAyMC8wNy8wNS9hdXN0aW4tdGV4YXMtY29yb25hdmlydXMtbWF5b3ItYWRsZXItc2F5cy1pY3VzLWNvdWxkLW92ZXJydW4tc29vbi81MzgxNDAyMDAyL9IBJ2h0dHBzOi8vYW1wLnVzYXRvZGF5LmNvbS9hbXAvNTM4MTQwMjAwMg?hl=en-PK&gl=PK&ceid=PK%3Aen
"DNA Linked to Covid-19 Was Inherited From Neanderthals, Study Finds",The stretch of six genes seems to increase the risk of severe illness from the coronavirus.,The New York Times,https://www.news.google.com/./articles/CAIiEONY-4RBNPsPTmhPvOzZ5igqFwgEKg8IACoHCAowjuuKAzCWrzwwqIQY?hl=en-PK&gl=PK&ceid=PK%3Aen
‘People aren’t stupid’: Mike Pence’s U.S. coronavirus spin tests his credibility,It's not the first time Pence has been forced to put his own credibility on the line as he serves as Trump's most loyal soldier. It may be the most consequential.,Global News,https://www.news.google.com/./articles/CAIiEBta3KZdNoB4vU6Sxpy1PTkqGQgEKhAIACoHCAowqeP_CjDdg_oCMNTh6QU?hl=en-PK&gl=PK&ceid=PK%3Aen
"LIVE: Global coronavirus death toll exceeds 450,000",Over 8.4 million have been confirmed to have coronavirus around the world and more than 4.1 million have recovered.,Al Jazeera English,https://www.news.google.com/./articles/CAIiEDGWtcJiO0igchznyrQ_lAoqFAgEKgwIACoFCAowhgIwkDgw0O8B?hl=en-PK&gl=PK&ceid=PK%3Aen
"Coronavirus (COVID-19) Update: Daily Roundup June 19, 2020",The U.S. Food and Drug Administration today announced the following actions taken in its ongoing response effort to the COVID-19 pandemic: The FDA issued ...,FDA.gov,https://www.news.google.com/./articles/CBMiamh0dHBzOi8vd3d3LmZkYS5nb3YvbmV3cy1ldmVudHMvcHJlc3MtYW5ub3VuY2VtZW50cy9jb3JvbmF2aXJ1cy1jb3ZpZC0xOS11cGRhdGUtZGFpbHktcm91bmR1cC1qdW5lLTE5LTIwMjDSAQA?hl=en-PK&gl=PK&ceid=PK%3Aen
"House Speaker, lawmakers test positive for the coronavirus",House Speaker Philip Gunn confirmed he is the latest member of the Mississippi Legislature to contract COVID-19.,Mississippi Today,https://www.news.google.com/./articles/CBMiYmh0dHBzOi8vbWlzc2lzc2lwcGl0b2RheS5vcmcvMjAyMC8wNy8wNS9ob3VzZS1zcGVha2VyLWxhd21ha2Vycy10ZXN0LXBvc2l0aXZlLWZvci10aGUtY29yb25hdmlydXMv0gEA?hl=en-PK&gl=PK&ceid=PK%3Aen
Update: Seaside the new local coronavirus hotspot in Monterey County,"Editor's note: The following is a collection of breaking news updates, helpful informational sites and links to appropriate local institutions during the coronavirus ...",Voices of Monterey Bay,https://www.news.google.com/./articles/CBMic2h0dHBzOi8vdm9pY2Vzb2Ztb250ZXJleWJheS5vcmcvMjAyMC8wNy8wNS9tb250ZXJleS1jb3VudHktcmVwb3J0cy1zcGlrZS1vZi1uZXctY2FzZXMtYnV0LWZldy1uZXctaG9zcGl0YWxpemF0aW9ucy_SAQA?hl=en-PK&gl=PK&ceid=PK%3Aen
July 5 update: The latest on coronavirus and Maine,Here's a roundup of the latest news on the coronavirus and its impact in Maine: - State.,Bangor Daily News,https://www.news.google.com/./articles/CBMiZGh0dHBzOi8vYmFuZ29yZGFpbHluZXdzLmNvbS8yMDIwLzA3LzA1L25ld3Mvc3RhdGUvanVseS01LXVwZGF0ZS10aGUtbGF0ZXN0LW9uLWNvcm9uYXZpcnVzLWFuZC1tYWluZS_SAQA?hl=en-PK&gl=PK&ceid=PK%3Aen
Coronavirus: People visiting Wales urged to behave respectfully as five-mile travel rule ends,"The Welsh government had imposed a ""stay local"" requirement which advised people to remain within five miles of their home.",Sky News,https://www.news.google.com/./articles/CBMid2h0dHBzOi8vbmV3cy5za3kuY29tL3N0b3J5L2Nvcm9uYXZpcnVzLXBlb3BsZS12aXNpdGluZy13YWxlcy11cmdlZC10by1iZWhhdmUtc2FmZWx5LWFzLXJlc3RyaWN0aW9ucy1hcmUtbGlmdGVkLTEyMDIyMTEy0gF7aHR0cHM6Ly9uZXdzLnNreS5jb20vc3RvcnkvYW1wL2Nvcm9uYXZpcnVzLXBlb3BsZS12aXNpdGluZy13YWxlcy11cmdlZC10by1iZWhhdmUtc2FmZWx5LWFzLXJlc3RyaWN0aW9ucy1hcmUtbGlmdGVkLTEyMDIyMTEy?hl=en-PK&gl=PK&ceid=PK%3Aen
Seven new Berks coronavirus cases reported today | Coronavirus,"Seven new coronavirus cases in Berks County were reported Sunday by the state Department of Health, bringing the outbreak total to 4,578. The state recorded ...",Reading Eagle,https://www.news.google.com/./articles/CBMiiwFodHRwczovL3d3dy5yZWFkaW5nZWFnbGUuY29tL2Nvcm9uYXZpcnVzL3NldmVuLW5ldy1iZXJrcy1jb3JvbmF2aXJ1cy1jYXNlcy1yZXBvcnRlZC10b2RheS9hcnRpY2xlXzc3OWI5YzUwLWJlZDctMTFlYS05ZWQzLWUzMmMzNWEyNzFlMS5odG1s0gEA?hl=en-PK&gl=PK&ceid=PK%3Aen
U.S. Sets Record for Daily New Cases as Virus Surges in South and West,"Governments are scrambling to stop outbreaks before they become new waves of infection. In impoverished nations, many critically ill patients cannot get ...",The New York Times,https://www.news.google.com/./articles/CAIiEE4lRKD32_vAw-Pj8TW20VgqFwgEKg8IACoHCAowjuuKAzCWrzwwxoIY?hl=en-PK&gl=PK&ceid=PK%3Aen
'The risk remains': Sydney hotel guards under microscope as NSW records 14 new cases,"The use of private security guards in Sydney's quarantine hotels is now under the microscope, with failures in monitoring guest movements being blamed for the ...",Sydney Morning Herald,https://www.news.google.com/./articles/CAIiEDpS7xkuivYBEPWB_rHo9PcqGQgEKhAIACoHCAowxqmICzDg_IYDMM6lmwY?hl=en-PK&gl=PK&ceid=PK%3Aen
L.A. County coronavirus cases hit one-day high over July 4th weekend,The number of hospital patients with confirmed coronavirus infections jumped 41% in the last three weeks in Los Angeles County.,Los Angeles Times,https://www.news.google.com/./articles/CAIiEBxOh35xpKrGU_3WVGsW30YqFwgEKg4IACoGCAowjKxcMOvhCzCU9KQB?hl=en-PK&gl=PK&ceid=PK%3Aen
Coronavirus Live News and Updates,Federal health officials will answer questions about the government's pandemic response. Further lockdowns have been announced in Germany after an ...,The New York Times,https://www.news.google.com/./articles/CAIiEKsblDn5cny2TtbJ49ofxbYqFwgEKg8IACoHCAowjuuKAzCWrzww5oEY?hl=en-PK&gl=PK&ceid=PK%3Aen
U.S. sets another single-day record for new coronavirus cases,"Across the United States, 39,327 new coronavirus infections were reported by state health departments on Thursday — surpassing the previous single-day ...",The Washington Post,https://www.news.google.com/./articles/CAIiELECO2DboooQM6lZ02fZKOcqGAgEKg8IACoHCAowjtSUCjC30XQwzqe5AQ?hl=en-PK&gl=PK&ceid=PK%3Aen
China Defends Its Coronavirus Response,Government officials denied they had suppressed information about the outbreak and said China had set a strong example for how to combat it.,The New York Times,https://www.news.google.com/./articles/CAIiECcJz3MNYQzx_JASqLWDiIMqFwgEKg8IACoHCAowjuuKAzCWrzwwxoIY?hl=en-PK&gl=PK&ceid=PK%3Aen
Chile health minister resigns amid coronavirus row: Live updates,The health ministry had been accused of tallying deaths using a method that did not reflect the scale of the toll.,Al Jazeera English,https://www.news.google.com/./articles/CAIiEBtjwIvvg0BrycoLxOWmblUqFAgEKgwIACoFCAowhgIwkDgw0O8B?hl=en-PK&gl=PK&ceid=PK%3Aen
Covid 19 coronavirus: One new case of virus - A man in his 20s from London,"New Zealand has one new case of Covid-19 today. The case is a man in his 20s who arrived from London on July 4, via Doha and Sydney. The man was taken ...",New Zealand Herald,https://www.news.google.com/./articles/CBMiR2h0dHBzOi8vd3d3Lm56aGVyYWxkLmNvLm56L256L25ld3MvYXJ0aWNsZS5jZm0_Y19pZD0xJm9iamVjdGlkPTEyMzQ1ODMw0gEA?hl=en-PK&gl=PK&ceid=PK%3Aen
Coronavirus Today - June 24- mask mandate,Face masks will be required as North Carolina remains in the Safer-At-Home Phase 2 for several more weeks thanks to the coronavirus pandemic.,North Carolina Health News,https://www.news.google.com/./articles/CBMiTWh0dHBzOi8vd3d3Lm5vcnRoY2Fyb2xpbmFoZWFsdGhuZXdzLm9yZy8yMDIwLzA2LzI0L2Nvcm9uYXZpcnVzLXRvZGF5LWp1bmUtMjQv0gEA?hl=en-PK&gl=PK&ceid=PK%3Aen
Coronavirus (COVID-19) Update: FDA Revokes Emergency Use Authorization for Chloroquine and Hydroxychloroquine,"Today, the U.S. Food and Drug Administration (FDA) revoked the emergency use authorization (EUA) that allowed for chloroquine phosphate and ...",FDA.gov,https://www.news.google.com/./articles/CBMihwFodHRwczovL3d3dy5mZGEuZ292L25ld3MtZXZlbnRzL3ByZXNzLWFubm91bmNlbWVudHMvY29yb25hdmlydXMtY292aWQtMTktdXBkYXRlLWZkYS1yZXZva2VzLWVtZXJnZW5jeS11c2UtYXV0aG9yaXphdGlvbi1jaGxvcm9xdWluZS1hbmTSAQA?hl=en-PK&gl=PK&ceid=PK%3Aen
"Coronavirus LIVE: India beats Russia in cases, becomes third most affected",Read more about Coronavirus LIVE: WHO team to visit China next week to probe corona origin on Business-standard. Coronavirus latest news: The global ...,Business Standard,https://www.news.google.com/./articles/CAIiEGKRSr6wOG0yuevOk0BS7OwqGQgEKhAIACoHCAowsLXdCjCm3dEBMOThpAM?hl=en-PK&gl=PK&ceid=PK%3Aen
Coronavirus News Latest Updates | India's tally tops 6.97 lakh; cases rise in Delhi and Maharashtra,The highly contagious infection which originated in China s Wuhan has affected more than 6 73 lakh people and claimed over 19 000 lives in India so far.,Jagran English,https://www.news.google.com/./articles/CBMitwFodHRwczovL2VuZ2xpc2guamFncmFuLmNvbS9pbmRpYS9jb3JvbmF2aXJ1cy1wYW5kZW1pYy1qdWx5LTYtbGl2ZS1uZXdzLXVwZGF0ZXMtaW5kaWEtY292aWQxOS12YWNjaW5lLWxvY2tkb3duLXVubG9jay0yMC1wYXRpZW50LWNvdW50LWRlYXRoLXRvbGwtcmVjb3ZlcnktcmF0ZS1oZWFsdGgtbWluaXN0cnktMTAwMTM2MTHSAbwBaHR0cHM6Ly9lbmdsaXNoLmphZ3Jhbi5jb20vbGl0ZS9pbmRpYS9jb3JvbmF2aXJ1cy1wYW5kZW1pYy1qdWx5LTYtbGl2ZS1uZXdzLXVwZGF0ZXMtaW5kaWEtY292aWQxOS12YWNjaW5lLWxvY2tkb3duLXVubG9jay0yMC1wYXRpZW50LWNvdW50LWRlYXRoLXRvbGwtcmVjb3ZlcnktcmF0ZS1oZWFsdGgtbWluaXN0cnktMTAwMTM2MTE?hl=en-PK&gl=PK&ceid=PK%3Aen
Victoria coronavirus cases rise by 108 as Daniel Andrews strengthens lockdown at nine public housing estates,Police will be stationed on every floor of nine public housing estates in inner Melbourne to ensure residents do not leave their units due to a coronavirus ...,ABC News,https://www.news.google.com/./articles/CAIiEMaWuPCJv5lZxTaQhhTjR0MqFwgEKg4IACoGCAow3vI9MPeaCDDEvrgG?hl=en-PK&gl=PK&ceid=PK%3Aen
"Coronavirus prediction model says NY, NJ currently on track for ‘controlled disease growth'",Only three states are still currently listed as on track to contain COVID-19.,SILive.com,https://www.news.google.com/./articles/CAIiEFTvvBPjmnagngunUsRJiRoqGQgEKhAIACoHCAowrqX_CjD2tPgCMM26ngY?hl=en-PK&gl=PK&ceid=PK%3Aen
Coronavirus: Before and after portraits of haircuts as hairdressers reopen,Before and after portraits as the people of Coventry visit the salon for the first time in three months.,BBC News,https://www.news.google.com/./articles/CBMiL2h0dHBzOi8vd3d3LmJiYy5jby51ay9uZXdzL2luLXBpY3R1cmVzLTUzMjkwNzQ20gEzaHR0cHM6Ly93d3cuYmJjLmNvLnVrL25ld3MvYW1wL2luLXBpY3R1cmVzLTUzMjkwNzQ2?hl=en-PK&gl=PK&ceid=PK%3Aen
Live Stock Market News During the Coronavirus Pandemic,The latest on stock market and business news during the coronavirus outbreak.,The New York Times,https://www.news.google.com/./articles/CAIiEIgCbWVnUDmcCnTxSc_5vHkqFwgEKg8IACoHCAowjuuKAzCWrzwwloEY?hl=en-PK&gl=PK&ceid=PK%3Aen
June 14 coronavirus news,"More than 7.8 million cases of the novel coronavirus have been confirmed worldwide, including at least 430,000 deaths, according to Johns Hopkins University.",CNN,https://www.news.google.com/./articles/CBMiUWh0dHBzOi8vd3d3LmNubi5jb20vd29ybGQvbGl2ZS1uZXdzL2Nvcm9uYXZpcnVzLXBhbmRlbWljLTA2LTE0LTIwLWludGwvaW5kZXguaHRtbNIBVWh0dHBzOi8vYW1wLmNubi5jb20vY25uL3dvcmxkL2xpdmUtbmV3cy9jb3JvbmF2aXJ1cy1wYW5kZW1pYy0wNi0xNC0yMC1pbnRsL2luZGV4Lmh0bWw?hl=en-PK&gl=PK&ceid=PK%3Aen
Coronavirus: US daily infections jump the most in seven weeks — as it happened,Today's top stories: Apple will close some US stores as Covid-19 cases rise. UK medical officers report a steady decrease in new cases of the virus and ...,Financial Times,https://www.news.google.com/./articles/CAIiEDliRFHPA_96b7a6IURmGVoqFwgEKg8IACoHCAow-4fWBzD4z0gwwtp6?hl=en-PK&gl=PK&ceid=PK%3Aen
Coronavirus latest: Five new cases confirmed in Luton,"Five new instances of coronavirus have been confirmed in Luton over the past 24 hours, according to Public Health England.",Luton Today,https://www.news.google.com/./articles/CBMiaWh0dHBzOi8vd3d3Lmx1dG9udG9kYXkuY28udWsvaGVhbHRoL2Nvcm9uYXZpcnVzL2Nvcm9uYXZpcnVzLWxhdGVzdC1maXZlLW5ldy1jYXNlcy1jb25maXJtZWQtbHV0b24tMjkwNDIzOdIBbWh0dHBzOi8vd3d3Lmx1dG9udG9kYXkuY28udWsvaGVhbHRoL2Nvcm9uYXZpcnVzL2Nvcm9uYXZpcnVzLWxhdGVzdC1maXZlLW5ldy1jYXNlcy1jb25maXJtZWQtbHV0b24tMjkwNDIzOT9hbXA?hl=en-PK&gl=PK&ceid=PK%3Aen
"Coronavirus LIVE:Come forward and donate plasma, urges Delhi CM Arvind Kejriwal","New Delhi, July 06: India reports a spike of 24,248 new COVID-19 cases and 425 deaths in the last 24 hours. Positive cases stand at 6,97,413 including 2 ...",Oneindia,https://www.news.google.com/./articles/CBMigAFodHRwczovL3d3dy5vbmVpbmRpYS5jb20vaW5kaWEvY29yb25hdmlydXMtbGl2ZS1pbmRpYS1yZXBvcnRzLTI0LTI0OC1uZXctY292aWQtMTktY2FzZXMtNDI1LWRlYXRocy1pbi1sYXN0LTI0LWhvdXJzLTMwNDM1MDQuaHRtbNIBAA?hl=en-PK&gl=PK&ceid=PK%3Aen
Surging Coronavirus Cases Push Latin America ‘to the Limit’,"The U.S. caseload, already the world's highest, is approaching two million. A book about the fall of France in 1940 has become a hit during the pandemic.",The New York Times,https://www.news.google.com/./articles/CAIiEPfZAKV3ipIjPvds8Sn-TOMqFwgEKg8IACoHCAowjuuKAzCWrzww5oEY?hl=en-PK&gl=PK&ceid=PK%3Aen
Today's latest updates on the coronavirus pandemic,Hotline. • Lima hospitals established a Community Call Center at 419-226-9000. Residents are urged to call that number before visiting a health care provider or ...,LimaOhio.com,https://www.news.google.com/./articles/CBMiWmh0dHBzOi8vd3d3LmxpbWFvaGlvLmNvbS9uZXdzLzQxNzE1MC90b2RheXMtbGF0ZXN0LXVwZGF0ZXMtb24tdGhlLWNvcm9uYXZpcnVzLXBhbmRlbWljLTExNNIBAA?hl=en-PK&gl=PK&ceid=PK%3Aen
Coronavirus updates: Some Florida beaches open despite record daily case count; fireworks canceled as states fear Fourth of July crowds,"Thanks to rising coronavirus infections in the U.S.,most Americans' Fourth of July celebrations this year won't include a community fireworks display, a trip to a ...",USA TODAY,https://www.news.google.com/./articles/CAIiEN3e0HybkDDVwJvwW7Ri6h8qGQgEKhAIACoHCAowjsP7CjCSpPQCMM_b5QU?hl=en-PK&gl=PK&ceid=PK%3Aen
Several Coronavirus Treatments Besides Remdesivir Show Promise : Shots - Health News,"Right now, there is only one drug shown by rigorous scientific testing to be helpful for treating COVID-19. That drug is the antiviral medication called remdesivir, ...",NPR,https://www.news.google.com/./articles/CAIiEPs9HazybnuRZylx9Pd-xIsqFggEKg4IACoGCAow9vBNMK3UCDCvpUk?hl=en-PK&gl=PK&ceid=PK%3Aen
Honduran President Tests Positive,Scientists at the University of Oxford say they have identified a drug that can reduce coronavirus-related deaths. The virus flares in Beijing. Officials in Tulsa ...,The New York Times,https://www.news.google.com/./articles/CAIiEKbBjX6c4qkBqebig_gIomAqFwgEKg8IACoHCAowjuuKAzCWrzwwxoIY?hl=en-PK&gl=PK&ceid=PK%3Aen
Dane County adds 79 coronavirus cases; cases in age 20-29 pass 1000,"Dane County confirmed 79 new coronavirus cases this morning, bringing the total to 2381 cases since the pandemic began in March. Today's increase once ...",madison365.com,https://www.news.google.com/./articles/CBMiWmh0dHBzOi8vbWFkaXNvbjM2NS5jb20vZGFuZS1jb3VudHktYWRkcy03OS1jb3JvbmF2aXJ1cy1jYXNlcy1jYXNlcy1pbi1hZ2UtMjAtMjktcGFzcy0xMDAwL9IBAA?hl=en-PK&gl=PK&ceid=PK%3Aen
Today's coronavirus news: New cases worldwide hit record high; Canadian troops en route to Latvia forced to turn around after infection scare; two Americans charged in Ontario for Quarantine Act viola,The latest coronavirus news from Canada and around the world Sunday. This file will be updated throughout the day. Web links to longer stories if available.,Caledon Enterprise,https://www.news.google.com/./articles/CBMi_AFodHRwczovL3d3dy5jYWxlZG9uZW50ZXJwcmlzZS5jb20vbmV3cy1zdG9yeS8xMDA1ODczNC10b2RheS1zLWNvcm9uYXZpcnVzLW5ld3MtbmV3LWNhc2VzLXdvcmxkd2lkZS1oaXQtcmVjb3JkLWhpZ2gtY2FuYWRpYW4tdHJvb3BzLWVuLXJvdXRlLXRvLWxhdHZpYS1mb3JjZWQtdG8tdHVybi1hcm91bmQtYWZ0ZXItaW5mZWN0aW9uLXNjYXJlLXR3by1hbWVyaWNhbnMtY2hhcmdlZC1pbi1vbnRhcmlvLWZvci1xdWFyYW50aW5lLWFjdC12aW9sYS_SAQA?hl=en-PK&gl=PK&ceid=PK%3Aen
Live updates: Elected officials blame rush to reopen as coronavirus cases hit record for 27th day,"With the number of coronavirus cases soaring in the United States, many elected officials are beginning to acknowledge that rushing to reopen was a mistake.",The Washington Post,https://www.news.google.com/./articles/CAIiEDBNXfaT4bx0N1yCpMe-Fk8qGAgEKg8IACoHCAowjtSUCjC30XQw1o3TBg?hl=en-PK&gl=PK&ceid=PK%3Aen
Coronavirus Vaccine Tracker,"Researchers around the world are developing more than 145 vaccines against the coronavirus, and 21 vaccines are in human trials. Vaccines typically require ...",The New York Times,https://www.news.google.com/./articles/CBMiUWh0dHBzOi8vd3d3Lm55dGltZXMuY29tL2ludGVyYWN0aXZlLzIwMjAvc2NpZW5jZS9jb3JvbmF2aXJ1cy12YWNjaW5lLXRyYWNrZXIuaHRtbNIBVWh0dHBzOi8vd3d3Lm55dGltZXMuY29tL2ludGVyYWN0aXZlLzIwMjAvc2NpZW5jZS9jb3JvbmF2aXJ1cy12YWNjaW5lLXRyYWNrZXIuYW1wLmh0bWw?hl=en-PK&gl=PK&ceid=PK%3Aen
China Shuts Vast Beijing Market as It Hunts Coronavirus Cluster,The C.D.C. projects up to 140000 deaths in the U.S. by early July. A bat expert navigates a political minefield. Dozens of members of the Guatemalan president's ...,The New York Times,https://www.news.google.com/./articles/CAIiEOmsN9sP_aNw2nqygumvmKcqFwgEKg8IACoHCAowjuuKAzCWrzwwxoIY?hl=en-PK&gl=PK&ceid=PK%3Aen
"Coronavirus India live updates: cases, deaths and news, today","Live coverage of the Covid-19 pandemic in India: breaking news, latest updates and statistics as they emerge throughout today, Sunday, 5 July.",AS English,https://www.news.google.com/./articles/CBMiQmh0dHBzOi8vZW4uYXMuY29tL2VuLzIwMjAvMDcvMDUvbGF0ZXN0X25ld3MvMTU5MzkzMDE1M182MTIzMTkuaHRtbNIBRmh0dHBzOi8vZW4uYXMuY29tL2VuLzIwMjAvMDcvMDUvbGF0ZXN0X25ld3MvMTU5MzkzMDE1M182MTIzMTkuYW1wLmh0bWw?hl=en-PK&gl=PK&ceid=PK%3Aen
"Coronavirus daily news updates, July 5: What to know today about COVID-19 in the Seattle area, Washington state and the world","The Puget Sound area and the nation celebrated a quiet Fourth of July holiday on Saturday — no Mariners baseball, no big party in Gas Works Park — as rising ...",Seattle Times,https://www.news.google.com/./articles/CBMirAFodHRwczovL3d3dy5zZWF0dGxldGltZXMuY29tL3NlYXR0bGUtbmV3cy9oZWFsdGgvY29yb25hdmlydXMtZGFpbHktbmV3cy11cGRhdGVzLWp1bHktNS13aGF0LXRvLWtub3ctdG9kYXktYWJvdXQtY292aWQtMTktaW4tdGhlLXNlYXR0bGUtYXJlYS13YXNoaW5ndG9uLXN0YXRlLWFuZC10aGUtd29ybGQv0gGyAWh0dHBzOi8vd3d3LnNlYXR0bGV0aW1lcy5jb20vc2VhdHRsZS1uZXdzL2hlYWx0aC9jb3JvbmF2aXJ1cy1kYWlseS1uZXdzLXVwZGF0ZXMtanVseS01LXdoYXQtdG8ta25vdy10b2RheS1hYm91dC1jb3ZpZC0xOS1pbi10aGUtc2VhdHRsZS1hcmVhLXdhc2hpbmd0b24tc3RhdGUtYW5kLXRoZS13b3JsZC8_YW1wPTE?hl=en-PK&gl=PK&ceid=PK%3Aen
India coronavirus numbers explained: Cases in four states growing faster than national average,"India Coronavirus, Covid-19 Cases Tracker Today Latest News Update: Tamil Nadu, Karnataka, Telangana, and Andhra Pradesh are now in the top ten list of ...",The Indian Express,https://www.news.google.com/./articles/CAIiEP9Aw8GEwRsrC4A2Ec4NBqoqGAgEKg8IACoHCAow3rvTBDD89X4wwLbmBQ?hl=en-PK&gl=PK&ceid=PK%3Aen
Karnataka Bengaluru Coronavirus Live Updates: Vidhana Soudha to be sanitised today after policeman tests positive,Karnataka Bengaluru Coronavirus (Covid-19) Latest News Live Updates: The government has granted leave to the employees who are aged above 50 years to ...,The Indian Express,https://www.news.google.com/./articles/CAIiECUbLBAQUSsuyKyhtHeYdMwqGAgEKg8IACoHCAow3rvTBDD89X4w8YzmBQ?hl=en-PK&gl=PK&ceid=PK%3Aen
Coronavirus updates: Seven-day average case total in the U.S. sets record for 27th straight day,Officials in states with surging coronavirus cases issued dire warnings and blamed outbreaks on early reopenings Sunday as the seven-day average for daily ...,The Washington Post,https://www.news.google.com/./articles/CAIiEJ_UQE0cSS04aNJ2hO8P-5sqGAgEKg8IACoHCAowjtSUCjC30XQwzqe5AQ?hl=en-PK&gl=PK&ceid=PK%3Aen
"Coronavirus (COVID-19) Update: Daily Roundup July 1, 2020","The U.S. Food and Drug Administration today announced the following actions taken in its ongoing response effort to the COVID-19 pandemic: Today, the U.S. ...",FDA.gov,https://www.news.google.com/./articles/CBMiaWh0dHBzOi8vd3d3LmZkYS5nb3YvbmV3cy1ldmVudHMvcHJlc3MtYW5ub3VuY2VtZW50cy9jb3JvbmF2aXJ1cy1jb3ZpZC0xOS11cGRhdGUtZGFpbHktcm91bmR1cC1qdWx5LTEtMjAyMNIBAA?hl=en-PK&gl=PK&ceid=PK%3Aen
WHO says Pakistan should reimpose lockdown to curb coronavirus,"Cases increased exponentially since the lockdown was lifted in late May, with record-high cases registered on Tuesday.",Al Jazeera English,https://www.news.google.com/./articles/CAIiEDqnVi1rh3adLYZRPgc8fywqFAgEKgwIACoFCAowhgIwkDgw0O8B?hl=en-PK&gl=PK&ceid=PK%3Aen
"Today's coronavirus news: Hamilton native and Broadway star Nick Cordero dies of COVID-19; NHL, players strike deal to resume; 124 new cases in Ontario, in Star's tally",The latest coronavirus news from Canada and around the world Sunday. This file will be updated throughout the day. Web links to longer stories if available.,Toronto Star,https://www.news.google.com/./articles/CAIiEJ-JONFblCYGHf5A3f3p7oUqFwgEKg4IACoGCAow6bV4MPfJDDDB1MUF?hl=en-PK&gl=PK&ceid=PK%3Aen
