title,text,link,source
"After Asking Americans to Sacrifice in Shutdown, Leaders Failed to Control Virus","WASHINGTON — More than four months into fighting the coronavirus in the United States, the shared sacrifice of millions of Americans suspending their lives ...",The New York Times,https://www.news.google.com/./articles/CAIiEAljLFOD_TYmEIO2tqEn584qFwgEKg8IACoHCAowjuuKAzCWrzwwt4QY?hl=en-PK&gl=PK&ceid=PK%3Aen
"Boulder County reports 18 new coronavirus cases Saturday, no new deaths","Boulder County reported 18 new coronavirus cases Saturday, but no new deaths.",The Daily Camera,https://www.news.google.com/./articles/CBMibmh0dHBzOi8vd3d3LmRhaWx5Y2FtZXJhLmNvbS8yMDIwLzA2LzI3L2JvdWxkZXItY291bnR5LXJlcG9ydHMtMTgtbmV3LWNvcm9uYXZpcnVzLWNhc2VzLXNhdHVyZGF5LW5vLW5ldy1kZWF0aHMv0gFyaHR0cHM6Ly93d3cuZGFpbHljYW1lcmEuY29tLzIwMjAvMDYvMjcvYm91bGRlci1jb3VudHktcmVwb3J0cy0xOC1uZXctY29yb25hdmlydXMtY2FzZXMtc2F0dXJkYXktbm8tbmV3LWRlYXRocy9hbXAv?hl=en-PK&gl=PK&ceid=PK%3Aen
"Dallas County records new single-day high of 561 coronavirus cases, 7 deaths","Dallas County closed the last full week of June with 561 new COVID-19 cases reported on Saturday, a new daily record. There were seven deaths. The county...",The Dallas Morning News,https://www.news.google.com/./articles/CBMihQFodHRwczovL3d3dy5kYWxsYXNuZXdzLmNvbS9uZXdzL3B1YmxpYy1oZWFsdGgvMjAyMC8wNi8yNy9kYWxsYXMtY291bnR5LXJlY29yZHMtbmV3LXNpbmdsZS1kYXktaGlnaC1vZi01NjEtY29yb25hdmlydXMtY2FzZXMtNy1kZWF0aHMv0gGUAWh0dHBzOi8vd3d3LmRhbGxhc25ld3MuY29tL25ld3MvcHVibGljLWhlYWx0aC8yMDIwLzA2LzI3L2RhbGxhcy1jb3VudHktcmVjb3Jkcy1uZXctc2luZ2xlLWRheS1oaWdoLW9mLTU2MS1jb3JvbmF2aXJ1cy1jYXNlcy03LWRlYXRocy8_b3V0cHV0VHlwZT1hbXA?hl=en-PK&gl=PK&ceid=PK%3Aen
New Porsche Taycan vs Tesla Model S,New electric Porsche is a four-seat sports car with up to 751bhp. But is it better than the bonkers-fast Tesla that made electric cars desirable in the first place?,What Car?,https://www.news.google.com/./articles/CBMiR2h0dHBzOi8vd3d3LndoYXRjYXIuY29tL25ld3MvbmV3LXBvcnNjaGUtdGF5Y2FuLXZzLXRlc2xhLW1vZGVsLXMvbjIxNjA20gEA?hl=en-PK&gl=PK&ceid=PK%3Aen
Texas Governor Greg Abbott Pauses Reopening,"A growing number of states are pausing plans to reopen, amid rising case counts. But Gov. Greg Abbott of Texas said shutting back down was the “last thing we ...",The New York Times,https://www.news.google.com/./articles/CAIiEEX2MB49x8PGje3F9mVfKYoqFwgEKg8IACoHCAowjuuKAzCWrzwwloEY?hl=en-PK&gl=PK&ceid=PK%3Aen
How Michael Flynn’s Defense Team Found Powerful Allies,"A lawyer for the former national security adviser turned to the attorney general for help, and he delivered, months before a pair of appellate judges handed Mr.",The New York Times,https://www.news.google.com/./articles/CAIiEERQsb90vXkWeOT7odHeokkqFwgEKg8IACoHCAowjuuKAzCWrzwwt4QY?hl=en-PK&gl=PK&ceid=PK%3Aen
"Mass. reports 28 new COVID-19 deaths, 373 new cases Saturday","As cases of the novel coronavirus across the US surpassed 2.5 million Saturday, with more than 125,000 deaths, public health officials in Massachusetts ...",The Boston Globe,https://www.news.google.com/./articles/CBMiaGh0dHBzOi8vd3d3LmJvc3Rvbmdsb2JlLmNvbS8yMDIwLzA2LzI3L21ldHJvL21hc3MtcmVwb3J0cy0yOC1uZXctY292aWQtMTktZGVhdGhzLTM3My1uZXctY2FzZXMtc2F0dXJkYXkv0gF3aHR0cHM6Ly93d3cuYm9zdG9uZ2xvYmUuY29tLzIwMjAvMDYvMjcvbWV0cm8vbWFzcy1yZXBvcnRzLTI4LW5ldy1jb3ZpZC0xOS1kZWF0aHMtMzczLW5ldy1jYXNlcy1zYXR1cmRheS8_b3V0cHV0VHlwZT1hbXA?hl=en-PK&gl=PK&ceid=PK%3Aen
Illinois reports 786 new COVID-19 cases and 26 new deaths,SPRINGFIELD (WREX) — The Illinois Department of Public Health (IDPH) is reporting 786 new confirmed cases of coronavirus in the past 24 hours. According ...,WREX-TV,https://www.news.google.com/./articles/CBMiVmh0dHBzOi8vd3JleC5jb20vMjAyMC8wNi8yNy9pbGxpbm9pcy1yZXBvcnRzLTc4Ni1uZXctY292aWQtMTktY2FzZXMtYW5kLTI2LW5ldy1kZWF0aHMv0gEA?hl=en-PK&gl=PK&ceid=PK%3Aen
"Taney Co. Health Dept. announces 11 new COVID-19 cases, possible exposures",The Taney County Health Department has released a timeline of potential exposures Saturday after announcing 11 new cases of COVID-19.,KY3,https://www.news.google.com/./articles/CBMid2h0dHBzOi8vd3d3Lmt5My5jb20vY29udGVudC9uZXdzL1RhbmV5LUNvLUhlYWx0aC1EZXB0LWFubm91bmNlcy0xMS1uZXctQ09WSUQtMTktY2FzZXMtcG9zc2libGUtZXhwb3N1cmVzLTU3MTUyNDIxMS5odG1s0gEA?hl=en-PK&gl=PK&ceid=PK%3Aen
What's really going to happen with New Zealand's house prices?,10% fall? 5% fall? Something completely different? We asked the experts.,Stuff.co.nz,https://www.news.google.com/./articles/CBMiemh0dHBzOi8vd3d3LnN0dWZmLmNvLm56L2xpZmUtc3R5bGUvaG9tZWQvcmVhbC1lc3RhdGUvMzAwMDQxMzI5L3doYXRzLXJlYWxseS1nb2luZy10by1oYXBwZW4td2l0aC1uZXctemVhbGFuZHMtaG91c2UtcHJpY2Vz0gEA?hl=en-PK&gl=PK&ceid=PK%3Aen
A Devastating New Stage of the Pandemic,"Editor's Note: The Atlantic is making vital coverage of the coronavirus available to all readers. Find the collection here. Updated at 9:30 a.m. ET on June 26, 2020 ...",The Atlantic,https://www.news.google.com/./articles/CAIiELHerbQaKa0y4erF1OCdI24qFggEKg0IACoGCAowm_EEMKAiMOfsywM?hl=en-PK&gl=PK&ceid=PK%3Aen
Ontario reports 160 new cases of COVID-19 on a record number of tests,Ontario is reporting fewer than 200 new cases of COVID-19 for the fourth day in a row and it comes after the province's labs ran a record 33492 tests.,CP24 Toronto's Breaking News,https://www.news.google.com/./articles/CBMiaWh0dHBzOi8vd3d3LmNwMjQuY29tL25ld3Mvb250YXJpby1yZXBvcnRzLTE2MC1uZXctY2FzZXMtb2YtY292aWQtMTktb24tYS1yZWNvcmQtbnVtYmVyLW9mLXRlc3RzLTEuNTAwMjY0NNIBAA?hl=en-PK&gl=PK&ceid=PK%3Aen
Migrant worker stabbed to death in New Taipei,"New Taipei, June 28 (CNA) A Vietnamese migrant worker was stabbed to death in New Taipei on Saturday evening after a revenge attack over a prior ...",Focus Taiwan News Channel,https://www.news.google.com/./articles/CBMiK2h0dHBzOi8vZm9jdXN0YWl3YW4udHcvc29jaWV0eS8yMDIwMDYyODAwMDTSAQA?hl=en-PK&gl=PK&ceid=PK%3Aen
Kangy Angy facility to be home for 55 new trains,"The arrival of the State Government's New Intercity Fleet on the Coast is on track for later this year, with testing now underway on the Central Coast and.",Central Coast Community News,https://www.news.google.com/./articles/CBMibmh0dHBzOi8vY29hc3Rjb21tdW5pdHluZXdzLmNvbS5hdS9jZW50cmFsLWNvYXN0L25ld3MvMjAyMC8wNi9rYW5neS1hbmd5LWZhY2lsaXR5LXRvLWJlLWhvbWUtZm9yLTU1LW5ldy10cmFpbnMv0gEA?hl=en-PK&gl=PK&ceid=PK%3Aen
New Allentown school to be named for 1st female Armed Forces general,"Brig. Gen. Anna Mae Hays spent her teenage years in Allentown, graduating from William Allen High School and Allentown General Hospital School of Nursing ...",lehighvalleylive.com,https://www.news.google.com/./articles/CAIiEHT5W1QeHmYFBY38Zsupi50qGQgEKhAIACoHCAowgKH_CjC2sfgCMJHGpAY?hl=en-PK&gl=PK&ceid=PK%3Aen
City of Cleveland reports 30 new cases of coronavirus: Saturday update,The total number of cases is now at XX and the number of deaths is at xx.,cleveland.com,https://www.news.google.com/./articles/CAIiEGp4F1FagvvZGNVwjCtxIyYqGQgEKhAIACoHCAow3qT_CjC1tPgCMLS-nwY?hl=en-PK&gl=PK&ceid=PK%3Aen
Netherlands: No new Covid-19 deaths since June 24,"The number of people in the Netherlands known to have died from respiratory illness Covid-19 herald at 6105, public health agency RIVM said on Sunday. It.",NL Times,https://www.news.google.com/./articles/CBMiS2h0dHBzOi8vbmx0aW1lcy5ubC8yMDIwLzA2LzI4L25ldGhlcmxhbmRzLW5ldy1jb3ZpZC0xOS1kZWF0aHMtc2luY2UtanVuZS0yNNIBAA?hl=en-PK&gl=PK&ceid=PK%3Aen
"L.A. County at ‘critical moment’ with 2,169 new coronavirus cases confirmed in 1 day and hospitalizations increasing","Los Angeles County recorded 2169 new coronavirus cases Saturday as hospitalizations for the respiratory illness increased significantly, officials said. “We are ...",KTLA Los Angeles,https://www.news.google.com/./articles/CAIiEDY-FUTf8J5gsjhoGLQIlxAqGQgEKhAIACoHCAowsIv_CjCag_gCMN-15QU?hl=en-PK&gl=PK&ceid=PK%3Aen
Apple reveals new developer technologies to foster the next generation of apps,"Xcode 12 is at the center of all development on Apple's platforms and features a *fresh* new look. Cupertino, California — Apple today announced a robust line-up ...",Apple Newsroom,https://www.news.google.com/./articles/CBMidmh0dHBzOi8vd3d3LmFwcGxlLmNvbS9uZXdzcm9vbS8yMDIwLzA2L2FwcGxlLXJldmVhbHMtbmV3LWRldmVsb3Blci10ZWNobm9sb2dpZXMtdG8tZm9zdGVyLXRoZS1uZXh0LWdlbmVyYXRpb24tb2YtYXBwcy_SAQA?hl=en-PK&gl=PK&ceid=PK%3Aen
Johnson & Johnson Will Stop Selling Skin-Whitening Lotions,The consumer-products giant Johnson & Johnson said on Friday that it would no longer sell certain products that are advertised as dark-spot reducers but have ...,The New York Times,https://www.news.google.com/./articles/CAIiEMO5g11jnAt0c-OzaiynalgqFwgEKg8IACoHCAowjuuKAzCWrzwwt4QY?hl=en-PK&gl=PK&ceid=PK%3Aen
"New Zealand lifts all Covid restrictions, declaring the nation virus-free","New Zealand has lifted almost all of its coronavirus restrictions after reporting no active cases in the country. At midnight local time (12:00 GMT), all of New ...",BBC News,https://www.news.google.com/./articles/CBMiLGh0dHBzOi8vd3d3LmJiYy5jb20vbmV3cy93b3JsZC1hc2lhLTUyOTYxNTM50gEwaHR0cHM6Ly93d3cuYmJjLmNvbS9uZXdzL2FtcC93b3JsZC1hc2lhLTUyOTYxNTM5?hl=en-PK&gl=PK&ceid=PK%3Aen
New-Onset Diabetes in Covid-19 | NEJM,"There is a bidirectional relationship between Covid-19 and diabetes. On the one hand, diabetes is associated with an increased risk of severe Covid-19. On the ...",nejm.org,https://www.news.google.com/./articles/CBMiMmh0dHBzOi8vd3d3Lm5lam0ub3JnL2RvaS9mdWxsLzEwLjEwNTYvTkVKTWMyMDE4Njg40gEA?hl=en-PK&gl=PK&ceid=PK%3Aen
Worst Clash in Decades on Disputed India-China Border Kills 20 Indian Troops,"NEW DELHI — The worst border clash between India and China in more than 40 years left 20 Indian soldiers dead and dozens believed captured, Indian ...",The New York Times,https://www.news.google.com/./articles/CAIiEKLr6Wqm-ywRSOktMzMTDYcqFwgEKg8IACoHCAowjuuKAzCWrzww5oEY?hl=en-PK&gl=PK&ceid=PK%3Aen
Roosevelt Statue to Be Removed From Museum of Natural History,"The bronze statue of Theodore Roosevelt, on horseback and flanked by a Native American man and an African man, which has presided over the entrance to ...",The New York Times,https://www.news.google.com/./articles/CAIiENg_EFvlra_qfyEhyl0fJfwqFwgEKg8IACoHCAowjuuKAzCWrzwwhoEY?hl=en-PK&gl=PK&ceid=PK%3Aen
New Ebola outbreak detected in northwest Democratic Republic of the Congo; WHO surge team supporting the response,"The Government of the Democratic Republic of the Congo announced today that a new outbreak of Ebola virus disease is occurring in Wangata health zone, ...",World Health Organization,https://www.news.google.com/./articles/CBMioAFodHRwczovL3d3dy53aG8uaW50L25ld3Mtcm9vbS9kZXRhaWwvMDEtMDYtMjAyMC1uZXctZWJvbGEtb3V0YnJlYWstZGV0ZWN0ZWQtaW4tbm9ydGh3ZXN0LWRlbW9jcmF0aWMtcmVwdWJsaWMtb2YtdGhlLWNvbmdvLXdoby1zdXJnZS10ZWFtLXN1cHBvcnRpbmctdGhlLXJlc3BvbnNl0gEA?hl=en-PK&gl=PK&ceid=PK%3Aen
New Horizons Conducts the First Interstellar Parallax Experiment,"For the first time, a spacecraft has sent back pictures of the sky from so far away that some stars appear to be in different positions than we'd see from Earth.",NASA,https://www.news.google.com/./articles/CBMiZGh0dHBzOi8vd3d3Lm5hc2EuZ292L2ZlYXR1cmUvbmFzYS1zLW5ldy1ob3Jpem9ucy1jb25kdWN0cy10aGUtZmlyc3QtaW50ZXJzdGVsbGFyLXBhcmFsbGF4LWV4cGVyaW1lbnTSAQA?hl=en-PK&gl=PK&ceid=PK%3Aen
Trump’s Tulsa Rally Fizzles as Seats Go Empty,"TULSA, Okla. — President Trump's attempt to revive his re-election campaign sputtered badly on Saturday night as he traveled to Tulsa for his first mass rally in ...",The New York Times,https://www.news.google.com/./articles/CAIiEJtaiCqlSUBgc88r94vf_IsqFwgEKg8IACoHCAowjuuKAzCWrzww9oEY?hl=en-PK&gl=PK&ceid=PK%3Aen
"After Video Shows Apparent Chokehold, N.Y.P.D. Suspends Officer","The New York Police Department on Sunday suspended a police officer who was involved in the arrest of a black man in Queens, after cellphone video of the ...",The New York Times,https://www.news.google.com/./articles/CAIiEGT6IVlR5bzeZgG729xlUcsqFwgEKg8IACoHCAowjuuKAzCWrzwwloIY?hl=en-PK&gl=PK&ceid=PK%3Aen
Genomewide Association Study of Severe Covid-19 with Respiratory Failure,"There is considerable variation in disease behavior among patients infected with severe acute respiratory syndrome coronavirus 2 (SARS-CoV-2), the virus that ...",nejm.org,https://www.news.google.com/./articles/CBMiM2h0dHBzOi8vd3d3Lm5lam0ub3JnL2RvaS9mdWxsLzEwLjEwNTYvTkVKTW9hMjAyMDI4M9IBAA?hl=en-PK&gl=PK&ceid=PK%3Aen
Pakistan: Locals erect statue of Ertugrul Gazi,"LAHORE, Pakistan. In remembrance of the grandeur of the Ottoman Empire, residents of northeastern Pakistan have put up a statue of Ertugrul Gazi, the Muslim ...",Anadolu Agency,https://www.news.google.com/./articles/CBMiW2h0dHBzOi8vd3d3LmFhLmNvbS50ci9lbi9hc2lhLXBhY2lmaWMvcGFraXN0YW4tbG9jYWxzLWVyZWN0LXN0YXR1ZS1vZi1lcnR1Z3J1bC1nYXppLzE4OTAyNzDSAQA?hl=en-PK&gl=PK&ceid=PK%3Aen
Turkish state television waived royalties for Ertugrul Ghazi,"Turkish state television waived royalties for ""Dirilis:Ertugrul"" , which Pakistan Television is airing with Urdu dubbing, according to Reuters news agency.",The News International,https://www.news.google.com/./articles/CAIiEJcZ2vY3n1Ni5cce3Pf4J5QqGQgEKhAIACoHCAowu5CGCzDM4IMDMPXiyQY?hl=en-PK&gl=PK&ceid=PK%3Aen
Ertugrul: The Turkish TV drama enthralling Pakistan,The Turkish historical TV drama Dirilis Ertugrul (Ertugrul's Resurrection) has been all the rage in Pakistan since the state broadcaster began airing a dubbed ...,BBC News,https://www.news.google.com/./articles/CBMiLGh0dHBzOi8vd3d3LmJiYy5jb20vbmV3cy93b3JsZC1hc2lhLTUzMDI0NDc50gEwaHR0cHM6Ly93d3cuYmJjLmNvbS9uZXdzL2FtcC93b3JsZC1hc2lhLTUzMDI0NDc5?hl=en-PK&gl=PK&ceid=PK%3Aen
Have you seen the Ertugrul Ghazi statue in Lahore?,"The Turkish epic on Ertugrul Ghazi, Dirilis: Ertugrul, has many fans all over the country. In Lahore, residents of a private housing society have put up a statue of ...",SAMAA,https://www.news.google.com/./articles/CAIiEEypG3uIHL-vbyXQBDUL9JYqGQgEKhAIACoHCAowwpSUCzCv06kDMMCO2wY?hl=en-PK&gl=PK&ceid=PK%3Aen
Different genre main reason behind success of action thriller drama ‘Ertugrul Ghazi’,"... * The drama, presented on PTV as well as social media became immensely popular when Prime Minister Imran Khan stated that 'it should be shown to our ...",Daily Times,https://www.news.google.com/./articles/CBMidGh0dHBzOi8vZGFpbHl0aW1lcy5jb20ucGsvNjI0NzUzL2RpZmZlcmVudC1nZW5yZS1tYWluLXJlYXNvbi1iZWhpbmQtc3VjY2Vzcy1vZi1hY3Rpb24tdGhyaWxsZXItZHJhbWEtZXJ0dWdydWwtZ2hhemkv0gF4aHR0cHM6Ly9kYWlseXRpbWVzLmNvbS5way82MjQ3NTMvZGlmZmVyZW50LWdlbnJlLW1haW4tcmVhc29uLWJlaGluZC1zdWNjZXNzLW9mLWFjdGlvbi10aHJpbGxlci1kcmFtYS1lcnR1Z3J1bC1naGF6aS9hbXAv?hl=en-PK&gl=PK&ceid=PK%3Aen
The craze of Ertugrul,UK: The dramatisation of the medieval period and the account of the life and times of Ertugrul Ghazi has taken Pakistan by storm. Apart from the Ertugrul ...,The Express Tribune,https://www.news.google.com/./articles/CBMiPWh0dHBzOi8vdHJpYnVuZS5jb20ucGsvc3RvcnkvMjI1MTEwMy82LXRoZS1jcmF6ZS1vZi1lcnR1Z3J1bC_SAQA?hl=en-PK&gl=PK&ceid=PK%3Aen
Straight Outta Ottoman: Kashmiri Parents Name Newborns After Turkish Series Ertugrul,"Popular Turkish serial Dirilis Ertugrul has had such effect on its viewers in Kashmir that parents are naming their children after its protagonist, Ertugrul.",Outlook India,https://www.news.google.com/./articles/CBMikgFodHRwczovL3d3dy5vdXRsb29raW5kaWEuY29tL3dlYnNpdGUvc3RvcnkvaW5kaWEtbmV3cy1zdHJhaWdodC1vdXR0YS1vdHRvbWFuLWthc2htaXJpLXBhcmVudHMtbmFtaW5nLW5ld2Jvcm5zLWFmdGVyLXR1cmtpc2gtc2VyaWVzLWVydHVncnVsLzM1NDAzNtIBkAFodHRwczovL3d3dy5vdXRsb29raW5kaWEuY29tL3dlYnNpdGUvYW1wL2luZGlhLW5ld3Mtc3RyYWlnaHQtb3V0dGEtb3R0b21hbi1rYXNobWlyaS1wYXJlbnRzLW5hbWluZy1uZXdib3Jucy1hZnRlci10dXJraXNoLXNlcmllcy1lcnR1Z3J1bC8zNTQwMzY?hl=en-PK&gl=PK&ceid=PK%3Aen
‘Ertugrul Ghazi’ and keyboard mujahids of Pakistan,"For a few weeks there has been this sudden upsurge in the toxicity of Pakistani people where zealots, obsessed with the personal lives of several actors, have ...",Daily Times,https://www.news.google.com/./articles/CBMiUmh0dHBzOi8vZGFpbHl0aW1lcy5jb20ucGsvNjIwNTk4L2VydHVncnVsLWdoYXppLWFuZC1rZXlib2FyZC1tdWphaGlkcy1vZi1wYWtpc3Rhbi_SAVZodHRwczovL2RhaWx5dGltZXMuY29tLnBrLzYyMDU5OC9lcnR1Z3J1bC1naGF6aS1hbmQta2V5Ym9hcmQtbXVqYWhpZHMtb2YtcGFraXN0YW4vYW1wLw?hl=en-PK&gl=PK&ceid=PK%3Aen
SPOTLIGHT: PAKISTAN’S TURKISH SWEETHEART,"Pakistanis are totally smitten with Princess Halime and Esra Bilgic, who plays the iconic character in Ertugrul: Ghazi.",DAWN.com,https://www.news.google.com/./articles/CBMiIWh0dHBzOi8vd3d3LmRhd24uY29tL25ld3MvMTU2NTU2NtIBJWh0dHBzOi8vd3d3LmRhd24uY29tL25ld3MvYW1wLzE1NjU1NjY?hl=en-PK&gl=PK&ceid=PK%3Aen
Heres what Imran Abbas thinks of Ertugrul Ghazi,Imran Abbas expressed his views about the Turkish series on Instagram.,Geo News,https://www.news.google.com/./articles/CAIiEO9cSTztCHPiIIgoANp_8y0qMwgEKioIACIQueFm35xOZipy-QOS9ivtJCoUCAoiELnhZt-cTmYqcvkDkvYr7SQw6tjJBg?hl=en-PK&gl=PK&ceid=PK%3Aen
Five unseen photos of ‘Halime Sultan and ‘Ertugrul from sets of ‘Dirilis: Ertugrul,Esra Bilgic and Engin Altan Duzyatan have won the hearts of millions of fans across the world with their outstanding performance in Turkish historic drama series ...,Geo News,https://www.news.google.com/./articles/CAIiEH0PM4Wo1oUFPDTIZSsoEwAqMwgEKioIACIQueFm35xOZipy-QOS9ivtJCoUCAoiELnhZt-cTmYqcvkDkvYr7SQw6tjJBg?hl=en-PK&gl=PK&ceid=PK%3Aen
Ertugrul Ghazis bust removed for bearing resemblance to actor Engin Altan,Authorities in Turkish province of Ordu have removed the statue of Ertugrul Ghazi after social media users said the bust resembles actor Engin Atlan Duzyatan.,Geo News,https://www.news.google.com/./articles/CAIiELSLMe50UJ-QEqYCH1Up1u8qMwgEKioIACIQueFm35xOZipy-QOS9ivtJCoUCAoiELnhZt-cTmYqcvkDkvYr7SQw6tjJBg?hl=en-PK&gl=PK&ceid=PK%3Aen
Engin Altan Düzyatan opens up on the success of ‘Ertuğrul in Pakistan,Engin Altan Düzyatan spoke about the immense outpouring of love by Pakistanis.,The News International,https://www.news.google.com/./articles/CAIiEEv-Qi3EC0sv_mNRI017IUMqGQgEKhAIACoHCAowu5CGCzDM4IMDMPXiyQY?hl=en-PK&gl=PK&ceid=PK%3Aen
Ertugruls statue bearing resemblance to Engin Altan removed in Turkey,Engin Altan plays the role of Ertugrul Ghazi in the popular Turkish Television series Dirilis:Ertugrul.,The News International,https://www.news.google.com/./articles/CAIiEClEVLiW1gJfvUuzBDydIqwqGQgEKhAIACoHCAowu5CGCzDM4IMDMPbiyQY?hl=en-PK&gl=PK&ceid=PK%3Aen
‘Ertugrul star Engin Altans photos with wife and friends win the internet,"Previously, Altan celebrated Father's Day with his dad and shared a sweet photo.",Geo News,https://www.news.google.com/./articles/CAIiEFqF4yg3x9QXDUpbq4T1vq4qMwgEKioIACIQueFm35xOZipy-QOS9ivtJCoUCAoiELnhZt-cTmYqcvkDkvYr7SQw6tjJBg?hl=en-PK&gl=PK&ceid=PK%3Aen
Will the State help or hinder Pakistans TV evolution?,"In a recently held conference call with the country's celebrated writers, Prime Minister Imran Khan held Ertugrul Ghazi as an example and urged for scripts that ...",The News International,https://www.news.google.com/./articles/CBMiYWh0dHBzOi8vd3d3LnRoZW5ld3MuY29tLnBrL3Rucy9kZXRhaWwvNjc4NjYzLXdpbGwtdGhlLXN0YXRlLWhlbHAtb3ItaGluZGVyLXBha2lzdGFucy10di1ldm9sdXRpb27SAV5odHRwczovL3d3dy50aGVuZXdzLmNvbS5way90bnMvYW1wLzY3ODY2My13aWxsLXRoZS1zdGF0ZS1oZWxwLW9yLWhpbmRlci1wYWtpc3RhbnMtdHYtZXZvbHV0aW9u?hl=en-PK&gl=PK&ceid=PK%3Aen
‘Ertugrul Ghazi craze: Nida and Yasir Nawaz watching Turkish drama in quarantine,Nida Yasir and Yasir Nawaz along with their daughter have been in self-isolation since the past 13 days.,The News International,https://www.news.google.com/./articles/CAIiED2QmRK4loCbcx6cK644CQsqGQgEKhAIACoHCAowu5CGCzDM4IMDMPbiyQY?hl=en-PK&gl=PK&ceid=PK%3Aen
Ertugrul star Engin Altan says Pakistanis like well-crafted stories,"The star of the Turkish epic on Ertugrul Ghazi, Engin Altan, believes that the show has been a big hit in Pakistan because Pakistani and Turkish audience love ...",SAMAA,https://www.news.google.com/./articles/CAIiEA6Z8MgVJfTLnwipuNybtkUqGQgEKhAIACoHCAowwpSUCzCv06kDMMCO2wY?hl=en-PK&gl=PK&ceid=PK%3Aen
Why Did Pakistan's Prime Minister Promote a Turkish TV Show?,"In October 2019, Pakistani Prime Minister Imran Khan reportedly directed the state broadcaster, PTV, to screen the Turkish show Diriliş: Ertuğrul. The series ...",The Diplomat,https://www.news.google.com/./articles/CBMiW2h0dHBzOi8vdGhlZGlwbG9tYXQuY29tLzIwMjAvMDYvd2h5LWRpZC1wYWtpc3RhbnMtcHJpbWUtbWluaXN0ZXItcHJvbW90ZS1hLXR1cmtpc2gtdHYtc2hvdy_SAQA?hl=en-PK&gl=PK&ceid=PK%3Aen
‘Ertugrul lead actress Esra Bilgic stuns in all-black outfit in her latest photo shoot,"Turkish actress Esra Bilgic, who essays the role of Halime Sultan in Turkish drama series Dirilis: Ertugrul, looked stunning in her jaw-dropping all-black outfit in ...",Geo News,https://www.news.google.com/./articles/CAIiEMpVTfLjx2rYB4zU0nhPI3AqMwgEKioIACIQueFm35xOZipy-QOS9ivtJCoUCAoiELnhZt-cTmYqcvkDkvYr7SQw6tjJBg?hl=en-PK&gl=PK&ceid=PK%3Aen
Ayesha Omar becomes Ertugrul fan,Ayesha Omar says she has started watching Ertugrul Ghazi.,Geo News,https://www.news.google.com/./articles/CAIiEAIsnbjsukFcS8wgKNUjVpQqMwgEKioIACIQueFm35xOZipy-QOS9ivtJCoUCAoiELnhZt-cTmYqcvkDkvYr7SQw6tjJBg?hl=en-PK&gl=PK&ceid=PK%3Aen
Shan calls Turkish drama 'Ertugrul Ghazi' classic masterpiece,LAHORE (Dunya News) – Pakistani versatile actor Shan Shahid has called famous Turkish drama 'Ertugrul Ghazi' as a classic masterpiece. Taking to ...,Dunya News,https://www.news.google.com/./articles/CAIiEGS5NHhwK8WGbe6RCEX9HnEqMwgEKioIACIQY2b5ujzciyN0LWhv-9PuKSoUCAoiEGNm-bo83IsjdC1ob_vT7ikwzdrdBg?hl=en-PK&gl=PK&ceid=PK%3Aen
20 Monuments of Ertugrul Ghazi taken down in Turkey,"20 statues of Ertugrul Ghazi were recently taken down in Turkey for resembling actor Engin Altan Duzyatan, who played the main lead role.",BOL News,https://www.news.google.com/./articles/CAIiEH9jvIxVlp5ciuXQfvQPkXgqMwgEKioIACIQy9cYBp_vQmjNv9f9XtDXWioUCAoiEMvXGAaf70Jozb_X_V7Q11owyOLHBg?hl=en-PK&gl=PK&ceid=PK%3Aen
"‘Ertugrul stars Esra Bilgic, Hulya Darcans adorable photo wins the internet",Another photo of Turkish stars Esra Bilgic aka Halime Sultan and Hulya Darcan aka Hayme Ana is making rounds on the internet and has won the hearts of their ...,The News International,https://www.news.google.com/./articles/CAIiEHX8644TkkhJadv9lAoKYKsqGQgEKhAIACoHCAowu5CGCzDM4IMDMPXiyQY?hl=en-PK&gl=PK&ceid=PK%3Aen
Ertugrul Ghazi statue Erected in Lahore,"Near Thokar Niaz Baig towards Multan road, a statue of popular character “Ertugrul” from renowned Turkish TV series, “Dirilis Ertugrul” ( Ertugrul Ghazi) has ...",Independent News Coverage Pakistan,https://www.news.google.com/./articles/CBMiTWh0dHBzOi8vd3d3LmluY3Bhay5jb20vZW50ZXJ0YWlubWVudC9lcnR1Z3J1bC1naGF6aS1zdGF0dWUtZXJlY3RlZC1pbi1sYWhvcmUv0gEA?hl=en-PK&gl=PK&ceid=PK%3Aen
‘Ertugrul star Engin Altan Duzyatan shares sweet photo with dad on Fathers Day,Turkish actor Engin Altan Duzyatan aka Ertugrul shared a sweet photo with his father to wish him on Father's Day. Engin Altan turned to Instagram and shared a ...,The News International,https://www.news.google.com/./articles/CAIiELt2izSexvwUM-4KR73A-dQqGQgEKhAIACoHCAowu5CGCzDM4IMDMPbiyQY?hl=en-PK&gl=PK&ceid=PK%3Aen
"Engin Altan Duzyatan aka Ertugrul, wife Neslisahs loved-up photo breaks the internet","Turkish actor Engin Altan Duzyatan, who essays the lead role of Ertugrul in historic drama serial Dirilis: Ertugrul, and his wife Neslisah Alkoclar's loved-up photo ...",The News International,https://www.news.google.com/./articles/CAIiELAWcmjgBPZgCY3rcFMePGQqGQgEKhAIACoHCAowu5CGCzDM4IMDMPbiyQY?hl=en-PK&gl=PK&ceid=PK%3Aen
Another Ertugrul Ghazi actress wishes to visit Pakistan,"LAHORE (Dunya News) – Burcu Kiratli, who played the role of Gokce Hatun in famous Turkish drama Ertugrul Ghazi, has expressed her wish to visit Pakistan ...",Dunya News,https://www.news.google.com/./articles/CBMiYmh0dHBzOi8vZHVueWFuZXdzLnR2L2VuL0VudGVydGFpbm1lbnQvNTQ5MTkxLUFub3RoZXItRXJ0dWdydWwtR2hhemktYWN0cmVzcy13aXNoZXMtdmlzaXQtUGFraXN0YW4t0gEraHR0cHM6Ly9kdW55YW5ld3MudHYvYW1wL2VuZ2xpc2gvNTQ5MTkxLnBocA?hl=en-PK&gl=PK&ceid=PK%3Aen
‘Ertugrul star Esra Bilgic shows solidarity with the Black Lives Matter movement,Turkish actress Esra Bilgic of Ertugrul fame has expressed her solidarity towards the Black Lives Matter movement that has intensified following the death of ...,The News International,https://www.news.google.com/./articles/CAIiEFdMTx8SVgc9zNHwLwstIFgqGQgEKhAIACoHCAowu5CGCzDM4IMDMPXiyQY?hl=en-PK&gl=PK&ceid=PK%3Aen
What’s going on with PTV’s YouTube channel?,Viewers of the state-run PTV's official YouTube channel were put in an awkward spot when they found that the channel had been shut down due to repeated ...,SAMAA,https://www.news.google.com/./articles/CAIiELNIP3UvTDxK9Rgt9UX0YvMqGQgEKhAIACoHCAowwpSUCzCv06kDMMCO2wY?hl=en-PK&gl=PK&ceid=PK%3Aen
‘Ertugrul’ is a classic masterpiece: Shaan Shahid,"... * Shahid gave a shout out to the producers and cast of the Turkish series and thanked Netflix as well. 0. Shares. News Desk. June 16, 2020. unnamed-3.",Daily Times,https://www.news.google.com/./articles/CBMiUGh0dHBzOi8vZGFpbHl0aW1lcy5jb20ucGsvNjI3MjMzL2VydHVncnVsLWlzLWEtY2xhc3NpYy1tYXN0ZXJwaWVjZS1zaGFhbi1zaGFoaWQv0gFUaHR0cHM6Ly9kYWlseXRpbWVzLmNvbS5way82MjcyMzMvZXJ0dWdydWwtaXMtYS1jbGFzc2ljLW1hc3RlcnBpZWNlLXNoYWFuLXNoYWhpZC9hbXAv?hl=en-PK&gl=PK&ceid=PK%3Aen
‘Ertugrul lead actress Esra Bilgic speaks out against racism,"Turkish actress Esra Bilgic, who has won the hearts of millions of fans for her role of Halime Sultan in historic drama series Diriliş: Ertuğrul or Ertugrul Ghazi, has ...",The News International,https://www.news.google.com/./articles/CAIiEGz8gTXREMV3nus-y1qN6WYqGQgEKhAIACoHCAowu5CGCzDM4IMDMPXiyQY?hl=en-PK&gl=PK&ceid=PK%3Aen
