title,text,link,source
"Over 7,000 members in a Bakersfield Facebook group spread positivity through tough times","Bakersfield, Calif. (KBAK/KBFX)- It's no secret that times are tough these days, but joining a group on Facebook and virtually connecting with people can help.",Bakersfield Now,https://www.news.google.com/./articles/CBMifGh0dHA6Ly9iYWtlcnNmaWVsZG5vdy5jb20vbmV3cy9sb2NhbC9vdmVyLTcwMDAtbWVtYmVycy1pbi1hLWJha2Vyc2ZpZWxkLWZhY2Vib29rLWdyb3VwLXNwcmVhZC1wb3NpdGl2aXR5LXRocm91Z2gtdG91Z2gtdGltZXPSAYEBaHR0cHM6Ly9iYWtlcnNmaWVsZG5vdy5jb20vYW1wL25ld3MvbG9jYWwvb3Zlci03MDAwLW1lbWJlcnMtaW4tYS1iYWtlcnNmaWVsZC1mYWNlYm9vay1ncm91cC1zcHJlYWQtcG9zaXRpdml0eS10aHJvdWdoLXRvdWdoLXRpbWVz?hl=en-PK&gl=PK&ceid=PK%3Aen
Hoover police officer fired over Facebook photo of protester in crosshairs,"Hoover Police Chief Nick Derzis said department officials were made aware of the “disturbing” post Wednesday morning. “When I saw the post and the image, ...",AL.com,https://www.news.google.com/./articles/CAIiEGOtfQZPccaDep9ovzovTG4qGQgEKhAIACoHCAowzqT_CjCltPgCMIG_ngY?hl=en-PK&gl=PK&ceid=PK%3Aen
Five Texas Republican county leaders share racist Facebook posts,Gov. Greg Abbott called on two Republican county chairs in Bexar and Nueces counties to resign after they shared a racist conspiracy theory about George ...,The Texas Tribune,https://www.news.google.com/./articles/CAIiEHOVWpBPeljLQ_tXSUh7Ux0qFwgEKg4IACoGCAow28c3MKzqBzD-0ZsD?hl=en-PK&gl=PK&ceid=PK%3Aen
Lord of the Rings TV series issues New Zealand casting call for 'funky-looking' people,"Talent agency job ad lists long skinny limbs, acne scars, facial lines, missing bones and large eyes as desirable features.",The Guardian,https://www.news.google.com/./articles/CAIiEJQ3x_YLXa7G50qVeKVzhmcqFggEKg4IACoGCAowl6p7MN-zCTCOvRU?hl=en-PK&gl=PK&ceid=PK%3Aen
Retired police captain shot to death at St. Louis pawn shop in slaying caught on Facebook Live,"David Dorn, 77, had worked for the St. Louis police force for 38 years before retiring and becoming the police chief in Moline Acres.",St. Louis Post-Dispatch,https://www.news.google.com/./articles/CAIiEEq9yrYjuuTLvOLsbw4Qi1UqGQgEKhAIACoHCAowgcT1CjD1u9wCMMbb0wM?hl=en-PK&gl=PK&ceid=PK%3Aen
Black Lives Matter protests: where to donate and how to help effectively,Movement for Black Lives and Color of Change are some of the highest-impact groups recommended by criminal justice expert Chloe Cockburn.,Vox.com,https://www.news.google.com/./articles/CAIiENJ5h3_3kZ-nXbC2o6nhpE4qFwgEKg8IACoHCAowlOzSATCaiDUwo9dy?hl=en-PK&gl=PK&ceid=PK%3Aen
Keller Williams’ social equality task force addresses unconscious bias after Facebook group controversy,Controversy erupted in a Keller Williams Facebook group this week related to the use of the terms 'monkey' and 'monkey mind' in Keller Williams' BOLD Pivot ...,HousingWire,https://www.news.google.com/./articles/CAIiEPQg-QPoTKwL9pWfI8eOBfgqGQgEKhAIACoHCAow2qSUCzDd36kDMKCUwgY?hl=en-PK&gl=PK&ceid=PK%3Aen
"Facebook, Instagram join Twitter in removing Trump campaign videos over copyright complaints","Facebook and Instagram took down video tributes to George Floyd posted by the Trump campaign over copyright complaints on Friday, following a similar ...",POLITICO,https://www.news.google.com/./articles/CAIiEJ0gf8tZkBmSIJ2fq1-4jZMqGQgEKhAIACoHCAow4Zn5CjCu8uACMLTRlgY?hl=en-PK&gl=PK&ceid=PK%3Aen
Jailed for a Facebook post: garment workers' rights at risk during Covid-19,Global fashion brands urged to speak out after arrest of factory employee fuels fears that rights are eroded during pandemic.,The Guardian,https://www.news.google.com/./articles/CBMihAFodHRwczovL3d3dy50aGVndWFyZGlhbi5jb20vZ2xvYmFsLWRldmVsb3BtZW50LzIwMjAvanVuLzE2L2phaWxlZC1mb3ItYS1mYWNlYm9vay1wb3N0LWdhcm1lbnQtd29ya2Vycy1yaWdodHMtYXQtcmlzay1kdXJpbmctY292aWQtMTnSAYQBaHR0cHM6Ly9hbXAudGhlZ3VhcmRpYW4uY29tL2dsb2JhbC1kZXZlbG9wbWVudC8yMDIwL2p1bi8xNi9qYWlsZWQtZm9yLWEtZmFjZWJvb2stcG9zdC1nYXJtZW50LXdvcmtlcnMtcmlnaHRzLWF0LXJpc2stZHVyaW5nLWNvdmlkLTE5?hl=en-PK&gl=PK&ceid=PK%3Aen
Facebook will now show you exactly how it stalks you — even when you’re not using Facebook,"The new 'Off-Facebook Activity' tool, available around the world Tuesday, reminds us we're living in a reality TV program where we forget the cameras are ...",The Washington Post,https://www.news.google.com/./articles/CAIiEK32r3yXKzx3NeC0TH1ZhP4qGAgEKg8IACoHCAowjtSUCjC30XQw78SzBg?hl=en-PK&gl=PK&ceid=PK%3Aen
Facebook adds a ‘care’ reaction to the like button,"Facebook is expanding its like reactions with a ""care"" reaction to help people show support. The face hugging a heart is meant to help people feel ""a bit more ...",The Verge,https://www.news.google.com/./articles/CAIiEIDV-yJB8nUScP0gjfRfoxcqFwgEKg4IACoGCAow3O8nMMqOBjDe2egF?hl=en-PK&gl=PK&ceid=PK%3Aen
"Facebook usage is surging, but the company warns it may be temporary","Facebook's Q1 2020 earnings were released on April 29th, showing that the social network's business is booming, thanks to shelter-in-place orders imposed ...",The Verge,https://www.news.google.com/./articles/CAIiEP1IDHKM588odJlSZKOHTKQqFwgEKg4IACoGCAow3O8nMMqOBjDe2egF?hl=en-PK&gl=PK&ceid=PK%3Aen
Nokia 5310 (2020) launched in Kenya and Bahrain | Nokiamob,"Nokia Mobile announced the all-new Nokia 5310, or the new dubbed version of Nokia 5310 XpressMusic from the past in two more markets. The newest ...",Nokiamob,https://www.news.google.com/./articles/CBMiTmh0dHBzOi8vbm9raWFtb2IubmV0LzIwMjAvMDYvMjYvbm9raWEtNTMxMC0yMDIwLWxhdW5jaGVkLWluLWtlbnlhLWFuZC1iYWhyYWluL9IBAA?hl=en-PK&gl=PK&ceid=PK%3Aen
Nokia 150 (2020) launched in Pakistan for PKR 4999 | Nokiamob,"Nokia Mobile's newest feature phone, Nokia 150 (2020) is now available in Pakistan. Nokia 150 is an ultra-affordable device, which comes with wireless FM ...",Nokiamob,https://www.news.google.com/./articles/CBMiUWh0dHBzOi8vbm9raWFtb2IubmV0LzIwMjAvMDYvMjQvbm9raWEtMTUwLTIwMjAtbGF1bmNoZWQtaW4tcGFraXN0YW4tZm9yLXBrci00OTk5L9IBAA?hl=en-PK&gl=PK&ceid=PK%3Aen
"Nokia 5310 launched in Nepal for NRs 5,449.00 | Nokiamob",Nokia 5310 is now available in Nepal for NRs 5449.00.,Nokiamob,https://www.news.google.com/./articles/CBMiTWh0dHBzOi8vbm9raWFtb2IubmV0LzIwMjAvMDYvMjMvbm9raWEtNTMxMC1sYXVuY2hlZC1pbi1uZXBhbC1mb3ItbnJzLTU0NDktMDAv0gEA?hl=en-PK&gl=PK&ceid=PK%3Aen
Nokia 5.3 for the Indian market will be made in India,"The communism, the virus, the cheap smartphones, all of those things that people don't understand but do hate are coming from China, and it is perfectly ...",Nokiamob,https://www.news.google.com/./articles/CBMiVmh0dHBzOi8vbm9raWFtb2IubmV0LzIwMjAvMDYvMjQvbm9raWEtNS0zLWZvci10aGUtaW5kaWFuLW1hcmtldC13aWxsLWJlLW1hZGUtaW4taW5kaWEv0gEA?hl=en-PK&gl=PK&ceid=PK%3Aen
Pakistan Telecommunication Company Limited deploys Nokia software products to enhance customer experience and service,Press Release Pakistan Telecommunication Company Limited deploys Nokia software products to enhance customer experience and *service* 10 June 2020 ...,GlobeNewswire,https://www.news.google.com/./articles/CAIiEPMLMNi_97eT5F8ZOdZA5DgqMwgEKioIACIQQrm4wrRfaVTiY_by5KwsfyoUCAoiEEK5uMK0X2lU4mP28uSsLH8wh_HIBg?hl=en-PK&gl=PK&ceid=PK%3Aen
Nokia selected by TOYOTA Production Engineering for 5G private wireless network,Press Release Nokia selected by TOYOTA Production Engineering for 5G private wireless network Initiative to assess potential of private wireless in...,GlobeNewswire,https://www.news.google.com/./articles/CAIiEKU_f-lyTccuMIYYniro-DcqMwgEKioIACIQQrm4wrRfaVTiY_by5KwsfyoUCAoiEEK5uMK0X2lU4mP28uSsLH8wh_HIBg?hl=en-PK&gl=PK&ceid=PK%3Aen
"Nokia 5310 review: Meant for music-lovers, but it’s got something for budding gamers too","The Nokia 5310, doesn't look as good as the OG XpressMusic phone, but the new design is compact, lightweight, and fits in pockets of all shapes and sizes.",Firstpost,https://www.news.google.com/./articles/CAIiEDz8c9r3MZoSE9R0GOXUHxsqFwgEKg8IACoHCAow5v6PATDrwA8wruge?hl=en-PK&gl=PK&ceid=PK%3Aen
The year 2020 might look hard but Nokia is doing well,"The year 2020 is taking toll on the global economy, but Nokia is doing well by launching some new technologies and winning great 5G deals.",Nokiamob,https://www.news.google.com/./articles/CBMiVmh0dHBzOi8vbm9raWFtb2IubmV0LzIwMjAvMDYvMjcvdGhlLXllYXItMjAyMC1taWdodC1sb29rLWhhcmQtYnV0LW5va2lhLWlzLWRvaW5nLXdlbGwv0gEA?hl=en-PK&gl=PK&ceid=PK%3Aen
"Nokia 5.3 launched in Spain, Italy, Kenya, and Bahrain","After the massive shutdown due to the COVID-19 pandemic, the industries are now on their way to get back on track. As a result, the products that were getting ...",Nokiamob,https://www.news.google.com/./articles/CBMiVGh0dHBzOi8vbm9raWFtb2IubmV0LzIwMjAvMDYvMjQvbm9raWEtNS0zLWxhdW5jaGVkLWluLXNwYWluLWl0YWx5LWtlbnlhLWFuZC1iYWhyYWluL9IBAA?hl=en-PK&gl=PK&ceid=PK%3Aen
Nokia lands a few much-needed wins,"Nokia's rollercoaster ride continues with an up day, following the launch of its latest 5G Cloud RAN and a couple of handy deal wins.",Telecoms.com,https://www.news.google.com/./articles/CBMiP2h0dHBzOi8vdGVsZWNvbXMuY29tLzUwNTEyNS9ub2tpYS1sYW5kcy1hLWZldy1tdWNoLW5lZWRlZC13aW5zL9IBAA?hl=en-PK&gl=PK&ceid=PK%3Aen
Nokia 1.3 is an ideal entry AndroidGO smartphone? (ExpertReviews),"It is always tricky to bring the full smartphone features on a super affordable segment, but somehow Nokia Mobile is doing a good job there. Nokia 1.3 is a nice ...",Nokiamob,https://www.news.google.com/./articles/CBMiX2h0dHBzOi8vbm9raWFtb2IubmV0LzIwMjAvMDYvMTYvbm9raWEtMS0zLWlzLWFuLWlkZWFsLWVudHJ5LWFuZHJvaWRnby1zbWFydHBob25lLWV4cGVydHJldmlld3Mv0gEA?hl=en-PK&gl=PK&ceid=PK%3Aen
Nokia 5.3 (4GB/64GB) is now available on Amazon in the US,Nokia Mobile launched the Nokia 5.3 (4GB/64GB) in the US. Sale starts today on Amazon.,Nokiamob,https://www.news.google.com/./articles/CBMiWGh0dHBzOi8vbm9raWFtb2IubmV0LzIwMjAvMDYvMjIvbm9raWEtNS0zLTRnYi02NGdiLWlzLW5vdy1hdmFpbGFibGUtb24tYW1hem9uLWluLXRoZS11cy_SAQA?hl=en-PK&gl=PK&ceid=PK%3Aen
Does the world need a new Nokia 3310?,"Concept creator did the concept of Nokia 3310, or his idea of how should a new 3310 look like.",Nokiamob,https://www.news.google.com/./articles/CBMiRWh0dHBzOi8vbm9raWFtb2IubmV0LzIwMjAvMDYvMDQvZG9lcy10aGUtd29ybGQtbmVlZC1hLW5ldy1ub2tpYS0zMzEwL9IBAA?hl=en-PK&gl=PK&ceid=PK%3Aen
Nokia Mobile ready to launch a new smartphone with Snapdragon 690 5G,Qualcomm announced Snapdragon 690 that is bringing the support for 5G networks on a lower price range smartphones. The SD 690 is the third Qualcomm ...,Nokiamob,https://www.news.google.com/./articles/CBMiZWh0dHBzOi8vbm9raWFtb2IubmV0LzIwMjAvMDYvMTcvbm9raWEtbW9iaWxlLXJlYWR5LXRvLWxhdW5jaC1hLW5ldy1zbWFydHBob25lLXdpdGgtc25hcGRyYWdvbi02OTAtNWcv0gEA?hl=en-PK&gl=PK&ceid=PK%3Aen
Nokia Mobile donating 50 smartphones to at risk community members in Australia to stay in touch during lockdown,"Nokia Mobile did a nice gesture in Australia partnering with CCNB, a not-for-profit community-based ogranization that provides guidance and help for elderly ...",Nokiamob,https://www.news.google.com/./articles/CBMikAFodHRwczovL25va2lhbW9iLm5ldC8yMDIwLzA2LzI1L25va2lhLW1vYmlsZS1kb25hdGluZy01MC1zbWFydHBob25lcy10by1hdC1yaXNrLWNvbW11bml0eS1tZW1iZXJzLWluLWF1c3RyYWxpYS10by1zdGF5LWluLXRvdWNoLWR1cmluZy1sb2NrZG93bi_SAQA?hl=en-PK&gl=PK&ceid=PK%3Aen
Nokia 43″ 4K LED Smart Android TV flash sale on June 26. User ratings inside,"Flipkart to hold the next flash sale of Nokia 43 inch UHD 4K LED Smart Android TV on June 26, 2020.",Nokiamob,https://www.news.google.com/./articles/CBMiaGh0dHBzOi8vbm9raWFtb2IubmV0LzIwMjAvMDYvMjUvbm9raWEtNDMtNGstbGVkLXNtYXJ0LWFuZHJvaWQtdHYtbmV3LWZsYXNoLXNhbGUtb24tanVuZS0yNi11c2VyLXJhdGluZ3Mv0gEA?hl=en-PK&gl=PK&ceid=PK%3Aen
Nokia N9 video,The Nokia N9 was the first and only Nokia phone to run on the revolutionary MeeGo Harmattan operating system. This video explains its story.,Nokiamob,https://www.news.google.com/./articles/CBMiTWh0dHBzOi8vbm9raWFtb2IubmV0LzIwMjAvMDYvMjMvdmlkZW8tdGhlLW5va2lhLW45LXdhcy13YXktYWhlYWQtb2YtaXRzLXRpbWUv0gEA?hl=en-PK&gl=PK&ceid=PK%3Aen
Nokia Mobile announced Nokia 150 and Nokia 125 in China,"Today, Nokia Mobile announced the new Nokia 125 and Nokia 150 in China. Both of the phones are on pre-sale until June 8 (9:30 PM, China Standard Time).",Nokiamob,https://www.news.google.com/./articles/CBMiWGh0dHBzOi8vbm9raWFtb2IubmV0LzIwMjAvMDYvMDUvbm9raWEtbW9iaWxlLWFubm91bmNlZC1ub2tpYS0xNTAtYW5kLW5va2lhLTEyNS1pbi1jaGluYS_SAQA?hl=en-PK&gl=PK&ceid=PK%3Aen
Nokia 2.3 gets new Android 10 build. Nokia 9 PureView and Nokia 2.2 get June update,"Nokia Mobile is now rolling out the June 2020 security update for Nokia 9 PureView, Nokia 2.3 (new Android 10 build), and Nokia 2.2.",Nokiamob,https://www.news.google.com/./articles/CBMibWh0dHBzOi8vbm9raWFtb2IubmV0LzIwMjAvMDYvMjQvbm9raWEtOS1wdXJldmlldy1ub2tpYS0yLTMtYW5kLW5va2lhLTItMi1yZWNlaXZpbmctanVuZS0yMDIwLXNlY3VyaXR5LXVwZGF0ZS_SAQA?hl=en-PK&gl=PK&ceid=PK%3Aen
HMD Global teases new Nokia 5G smartphone powered by Snapdragon 690,"Qualcomm recently announced its new Snapdragon 600-series processors with the launch of Snapdragon 690 SoC. Now, Finland-based HMD Global has ...",gizmochina,https://www.news.google.com/./articles/CBMiSmh0dHBzOi8vd3d3Lmdpem1vY2hpbmEuY29tLzIwMjAvMDYvMTgvaG1kLWdsb2JhbC10ZWFzZXMtbm9raWEtc2Q2OTAtcGhvbmUv0gEA?hl=en-PK&gl=PK&ceid=PK%3Aen
Nokia 5310 XpressMusic review,"Pinching myself to reality, I had to force myself to come to terms with the existence of a phone like the Nokia 5310 in the year 2020. But, HMD (parent company of ...",Stuff,https://www.news.google.com/./articles/CBMiNWh0dHBzOi8vd3d3LnN0dWZmLnR2L2luL25va2lhLzUzMTAteHByZXNzbXVzaWMvcmV2aWV30gFBaHR0cHM6Ly93d3cuc3R1ZmYudHYvaW4vbm9raWEvNTMxMC14cHJlc3NtdXNpYy9yZXZpZXc_X2Zvcm1hdD1hbXA?hl=en-PK&gl=PK&ceid=PK%3Aen
Nokia Kataya UI reborn on Nokia 2 | Nokiamob,"After Nokia Z Launcher, the fans of Nokia are trying to recreate a new Nokia UI that was running on Nokia Kataya prototype device.",Nokiamob,https://www.news.google.com/./articles/CBMiQmh0dHBzOi8vbm9raWFtb2IubmV0LzIwMjAvMDYvMjIvbm9raWEta2F0YXlhLXVpLXJlYm9ybi1vbi1ub2tpYS0yL9IBAA?hl=en-PK&gl=PK&ceid=PK%3Aen
Nokia to supply around 10% of China Unicom's 5G core network,"Finnish telecom equipment maker Nokia said on Monday that China Unicom had selected it to supply around 10% share of its 5G core network, confirming an ...",The Express Tribune,https://www.news.google.com/./articles/CBMiXGh0dHBzOi8vdHJpYnVuZS5jb20ucGsvc3RvcnkvMjI0MzE0MS84LW5va2lhLXN1cHBseS1hcm91bmQtMTAtY2hpbmEtdW5pY29tcy01Zy1jb3JlLW5ldHdvcmsv0gEA?hl=en-PK&gl=PK&ceid=PK%3Aen
"Nokia 7.2 gets new Android 10 build, 3.2 gets June security update",Nokia Mobile is rolling out a new Android 10 build for Nokia 7.2 and June 2020 security patch for Nokia 3.2.,Nokiamob,https://www.news.google.com/./articles/CBMiYmh0dHBzOi8vbm9raWFtb2IubmV0LzIwMjAvMDYvMTcvbm9raWEtNy0yLWdldHMtbmV3LWFuZHJvaWQtMTAtYnVpbGQtMy0yLWdldHMtanVuZS1zZWN1cml0eS11cGRhdGUv0gEA?hl=en-PK&gl=PK&ceid=PK%3Aen
Nokia C2 announced in Nigeria. Nokia 5.3 coming soon,Nokia Mobile announced Nokia C2 in Nigeria. Nokia 5.3 is probably coming soon as the starting price has been revealed.,Nokiamob,https://www.news.google.com/./articles/CBMiVGh0dHBzOi8vbm9raWFtb2IubmV0LzIwMjAvMDYvMTMvbm9raWEtYzItYW5ub3VuY2VkLWluLW5pZ2VyaWEtbm9raWEtNS0zLWNvbWluZy1zb29uL9IBAA?hl=en-PK&gl=PK&ceid=PK%3Aen
Nokia 5.3 receiving June security patch | Nokiamob,Nokia 5.3 is relatively new smartphone and receiving the latest security Google patch for June.,Nokiamob,https://www.news.google.com/./articles/CBMiSGh0dHBzOi8vbm9raWFtb2IubmV0LzIwMjAvMDYvMTUvbm9raWEtNS0zLXJlY2VpdmluZy1qdW5lLXNlY3VyaXR5LXBhdGNoL9IBAA?hl=en-PK&gl=PK&ceid=PK%3Aen
Nokia Solution to Boost Pakistan Telecom Customer Service,"Continuing its quest to establish streamlined networking infrastructure, Nokia Corporation (NOK – Free Report) recently collaborated with Pakistan ...",Technology Times Pakistan,https://www.news.google.com/./articles/CBMiMGh0dHBzOi8vd3d3LnRlY2hub2xvZ3l0aW1lcy5way8yMDIwLzA2LzEyL25va2lhL9IBAA?hl=en-PK&gl=PK&ceid=PK%3Aen
Nokia announced as key supplier to Ireland's National Broadband Plan (NBP),Press Release National Broadband Ireland (NBI) has selected Nokia to deploy fiber broadband solution for 540000 rural premises in the Republic of Ireland...,GlobeNewswire,https://www.news.google.com/./articles/CAIiELxJMUQPAaXYhvoX23lWW8MqMwgEKioIACIQQrm4wrRfaVTiY_by5KwsfyoUCAoiEEK5uMK0X2lU4mP28uSsLH8wh_HIBg?hl=en-PK&gl=PK&ceid=PK%3Aen
"Nokia takes things back to 2007 with the US$45 Nokia 5310: 2.4in QVGA display, 8MB RAM, 0.3MP camera and no Android in sight","Nokia recently launched the Nokia 5310, a spiritual successor to its 2007-era XpressMusic 5310. The new, 2020 variant features a lightly updated design while ...",Notebookcheck.net,https://www.news.google.com/./articles/CBMipQFodHRwczovL3d3dy5ub3RlYm9va2NoZWNrLm5ldC9Ob2tpYS10YWtlcy10aGluZ3MtYmFjay10by0yMDA3LXdpdGgtdGhlLVVTLTQ1LU5va2lhLTUzMTAtMi00aW4tUVZHQS1kaXNwbGF5LThNQi1SQU0tMC0zTVAtY2FtZXJhLWFuZC1uby1BbmRyb2lkLWluLXNpZ2h0LjQ3NjY2OC4wLmh0bWzSAQA?hl=en-PK&gl=PK&ceid=PK%3Aen
Nokia's new CEO will step in his role one month earlier than announced,Nokia announced this morning that the company will accelerate its leadership change that was announced three months ago. The new CEO Pekka Lundmark ...,Nokiamob,https://www.news.google.com/./articles/CBMiZmh0dHBzOi8vbm9raWFtb2IubmV0LzIwMjAvMDYvMjQvbm9raWFzLW5ldy1jZW8td2lsbC1zdGVwLWluLWhpcy1yb2xlLW9uZS1tb250aC1lYXJsaWVyLXRoYW4tYW5ub3VuY2VkL9IBAA?hl=en-PK&gl=PK&ceid=PK%3Aen
Nokia Mobile did a nice Nokia 4.2 promo pack in France,Nokia Mobile in France bundled Nokia 4.2 with JBL TUNE 205BT Bluetooth earphones to boost the sales of this nice budget smartphone.,Nokiamob,https://www.news.google.com/./articles/CBMiV2h0dHBzOi8vbm9raWFtb2IubmV0LzIwMjAvMDYvMDgvbm9raWEtbW9iaWxlLWRpZC1hLW5pY2Utbm9raWEtNC0yLXByb21vLXBhY2staW4tZnJhbmNlL9IBAA?hl=en-PK&gl=PK&ceid=PK%3Aen
"Light, the designer of the Nokia 9 PureView camera, leaves the smartphone market - GSMArena.com news","The Nokia 9.3 PureView will not use a kooky camera setup from Light. In fact, no other phone will either as the company behind the penta-camera of the ...",GSMArena.com,https://www.news.google.com/./articles/CBMidWh0dHBzOi8vd3d3LmdzbWFyZW5hLmNvbS9saWdodF93aGljaF9kZXNpZ25lZF90aGVfbm9raWFfOV9wdXJldmlld19jYW1lcmFfbGVhdmVzX3RoZV9zbWFydHBob25lX21hcmtldC1uZXdzLTQzNzE3LnBocNIBcmh0dHBzOi8vbS5nc21hcmVuYS5jb20vbGlnaHRfd2hpY2hfZGVzaWduZWRfdGhlX25va2lhXzlfcHVyZXZpZXdfY2FtZXJhX2xlYXZlc190aGVfc21hcnRwaG9uZV9tYXJrZXQtYW1wLTQzNzE3LnBocA?hl=en-PK&gl=PK&ceid=PK%3Aen
"Nokia 8.3 5G to launch soon, appears in Amazon Germany listing - GSMArena.com news","Nokia's first 5G phone was announced back in March following MWC's cancellation. However, it wasn't clear when Nokia would begin selling the new handset.",GSMArena.com,https://www.news.google.com/./articles/CBMiZGh0dHBzOi8vd3d3LmdzbWFyZW5hLmNvbS9ub2tpYV84M181Z190b19sYXVuY2hfc29vbl9hcHBlYXJzX2luX2FtYXpvbl9nZXJtYW55X2xpc3RpbmctbmV3cy00MzgwNi5waHDSAWFodHRwczovL20uZ3NtYXJlbmEuY29tL25va2lhXzgzXzVnX3RvX2xhdW5jaF9zb29uX2FwcGVhcnNfaW5fYW1hem9uX2dlcm1hbnlfbGlzdGluZy1hbXAtNDM4MDYucGhw?hl=en-PK&gl=PK&ceid=PK%3Aen
Nokia launches cloud-native Digital Operations Center software to drive 5G monetization,Press Release Nokia launches cloud-native Digital Operations Center software to drive 5G monetization Digital Operations Center is Nokia's first...,GlobeNewswire,https://www.news.google.com/./articles/CAIiEC6dlsty4PtbaGH66gnrqwIqMwgEKioIACIQQrm4wrRfaVTiY_by5KwsfyoUCAoiEEK5uMK0X2lU4mP28uSsLH8wh_HIBg?hl=en-PK&gl=PK&ceid=PK%3Aen
"Buy Nokia 7.2 in Philippines and get a case, hoodie and Nokia C1 for free","Nokia Mobile kicked off a great promotion in Philippines bundling the Nokia 7.2 with merchandise, a case and a smartphone. The Nokia 7.2 with 6GB of RAM ...",Nokiamob,https://www.news.google.com/./articles/CBMiaWh0dHBzOi8vbm9raWFtb2IubmV0LzIwMjAvMDYvMjEvYnV5LW5va2lhLTctMi1pbi1waGlsaXBwaW5lcy1hbmQtZ2V0LWEtY2FzZS1ob29kaWUtYW5kLW5va2lhLWMxLWZvci1mcmVlL9IBAA?hl=en-PK&gl=PK&ceid=PK%3Aen
Nokia foldable phone project is still alive,Nokia Mobile is still working of a Nokia foldable smartphone according to Nokia Anew's sources.,Nokiamob,https://www.news.google.com/./articles/CBMiTGh0dHBzOi8vbm9raWFtb2IubmV0LzIwMjAvMDUvMjkvbm9raWEtZm9sZGFibGUtcGhvbmUtcHJvamVjdC1pcy1zdGlsbC1hbGl2ZS_SAQA?hl=en-PK&gl=PK&ceid=PK%3Aen
"Nokia to cut more than 1,200 jobs in France","Finland's Nokia Oyj plans to cut 1233 jobs at its French subsidiary Alcatel-Lucent International, equivalent to a third of the unit's workforce, the group said on ...",FRANCE 24 English,https://www.news.google.com/./articles/CAIiEDWxZvE-amRGOuU4i3OHyrwqGQgEKhAIACoHCAowwrSiCTCFgpgCMPjU3wM?hl=en-PK&gl=PK&ceid=PK%3Aen
Nokia: new research highlights 5G Fixed Wireless Access opportunity for mobile operators,Press Release Nokia: new research highlights 5G Fixed Wireless Access opportunity for mobile operators Fixed wireless access (FWA) is the top-ranked...,GlobeNewswire,https://www.news.google.com/./articles/CAIiEE3JGO6j1s1rtlFvFRqY_2MqMwgEKioIACIQQrm4wrRfaVTiY_by5KwsfyoUCAoiEEK5uMK0X2lU4mP28uSsLH8wh_HIBg?hl=en-PK&gl=PK&ceid=PK%3Aen
Nokia's independent software business is heading in the right direction,"For quite some time, Nokia has been pointing out the importance of their independent software business the company has been developing for years in quarterly ...",Nokiamob,https://www.news.google.com/./articles/CBMiZ2h0dHBzOi8vbm9raWFtb2IubmV0LzIwMjAvMDUvMzAvbm9raWFzLWluZGVwZW5kZW50LXNvZnR3YXJlLWJ1c2luZXNzLWlzLWhlYWRpbmctaW4tdGhlLXJpZ2h0LWRpcmVjdGlvbi_SAQA?hl=en-PK&gl=PK&ceid=PK%3Aen
Two New Affordable Nokia Smartphones Revealed,Those who were waiting for the affordable smartphones of Nokia brand will be happy to know that HMD has quietly launched two new entry-level smartphones.,PhoneWorld Magazine,https://www.news.google.com/./articles/CAIiEJkHPqhh-tuYL8mb33x8zNMqGQgEKhAIACoHCAowi8qUCzDqkaoDMMiPwwY?hl=en-PK&gl=PK&ceid=PK%3Aen
"Rumors: Nokia 9.3 could arrive this year, but display technology complexity might delay launch",Flagship smartphones have always been the best representatives of a smartphone company. Smartphone manufacturers pack only their finest technologies and ...,Nokiamob,https://www.news.google.com/./articles/CBMifWh0dHBzOi8vbm9raWFtb2IubmV0LzIwMjAvMDYvMDYvcnVtb3JzLW5va2lhLTktMy1jb3VsZC1hcnJpdmUtdGhpcy15ZWFyLWJ1dC1kaXNwbGF5LXRlY2hub2xvZ3ktY29tcGxleGl0eS1taWdodC1kZWxheS1sYXVuY2gv0gEA?hl=en-PK&gl=PK&ceid=PK%3Aen
Nokia Corporation - Managers' transactions Helsinki Stock Exchange:NOKIA,"Nokia Corporation - Managers' transactions. Nokia Corporation Managers' transactions. June 2, 2020 at 14:00 (CET +1) Nokia Corporation - Managers' ...",GlobeNewswire,https://www.news.google.com/./articles/CAIiELCH7NM9cRILATgexRtpX-QqMwgEKioIACIQQrm4wrRfaVTiY_by5KwsfyoUCAoiEEK5uMK0X2lU4mP28uSsLH8wh_HIBg?hl=en-PK&gl=PK&ceid=PK%3Aen
Nokia first to demonstrate live C-Band network in the U.S.,"Press Release Nokia first to demonstrate live C-Band network in the U.S. Nokia completes first successful U.S. based 5G trial in C-band spectrum,...",GlobeNewswire,https://www.news.google.com/./articles/CAIiEAv2ZNSjVDhOUSo862gxuZkqMwgEKioIACIQQrm4wrRfaVTiY_by5KwsfyoUCAoiEEK5uMK0X2lU4mP28uSsLH8wh_HIBg?hl=en-PK&gl=PK&ceid=PK%3Aen
Nokia 43-inch 4K LED Smart TV launched in India - GSMArena.com news,Nokia today announced a new 43-inch 4K LED Smart TV in India. It runs Android Pie and has a CA53 quad-core processor at the helm clocked at 1.0 GHz.,GSMArena.com,https://www.news.google.com/./articles/CBMiUWh0dHBzOi8vd3d3LmdzbWFyZW5hLmNvbS9ub2tpYV80M19pbmNoXzRrX2xlZF9zbWFydF90dl9pbmRpYV9wcmljZS1uZXdzLTQzNTczLnBocNIBTmh0dHBzOi8vbS5nc21hcmVuYS5jb20vbm9raWFfNDNfaW5jaF80a19sZWRfc21hcnRfdHZfaW5kaWFfcHJpY2UtYW1wLTQzNTczLnBocA?hl=en-PK&gl=PK&ceid=PK%3Aen
Nokia and AT&T run successful trial of the RAN Intelligent Controller over commercial 5G,Press Release Nokia and AT&T run successful trial of the RAN Intelligent Controller over commercial 5G AT&T and Nokia are...,GlobeNewswire,https://www.news.google.com/./articles/CAIiEMNeSw-a31fqJa10fGSgDkkqMwgEKioIACIQQrm4wrRfaVTiY_by5KwsfyoUCAoiEEK5uMK0X2lU4mP28uSsLH8wh_HIBg?hl=en-PK&gl=PK&ceid=PK%3Aen
Preorder Nokia 5.3 in Indonesia and get a free JBL Bluetooth Headphone,"Following the rest of its markets, Nokia Mobile now starts the preorder for the Nokia 5.3 in Indonesia. The device was launched earlier this March, but logistical ...",Nokiamob,https://www.news.google.com/./articles/CBMiZ2h0dHBzOi8vbm9raWFtb2IubmV0LzIwMjAvMDYvMjIvcHJlb3JkZXItbm9raWEtNS0zLWluLWluZG9uZXNpYS1hbmQtZ2V0LWEtZnJlZS1qYmwtYmx1ZXRvb3RoLWhlYWRwaG9uZS_SAQA?hl=en-PK&gl=PK&ceid=PK%3Aen
The Android 11-Ready Nokia 5.3 Smartphone,Nokia's latest smartphone – the Android 11-ready Nokia 5.3 has plenty of the bells and whistles and comes at an incredibly low price point. Just like others such ...,Women Love Tech,https://www.news.google.com/./articles/CBMiRGh0dHBzOi8vd29tZW5sb3ZldGVjaC5jb20vdGhlLWFuZHJvaWQtMTEtcmVhZHktbm9raWEtNS0zLXNtYXJ0cGhvbmUv0gFIaHR0cHM6Ly93b21lbmxvdmV0ZWNoLmNvbS90aGUtYW5kcm9pZC0xMS1yZWFkeS1ub2tpYS01LTMtc21hcnRwaG9uZS9hbXAv?hl=en-PK&gl=PK&ceid=PK%3Aen
"SIMLEY trademark officially registered, hinting at eSIM gadgets from Nokia Mobile",What is SIMLEY? The marker of Nokia phones received approval for a new trademark by the European Union Intellectual Property Office which might suggest ...,Nokiamob,https://www.news.google.com/./articles/CBMicWh0dHBzOi8vbm9raWFtb2IubmV0LzIwMjAvMDYvMjUvc2ltbGV5LXRyYWRlbWFyay1vZmZpY2lhbGx5LXJlZ2lzdGVyZWQtaGludGluZy1hdC1lc2ltLWdhZGdldHMtZnJvbS1ub2tpYS1tb2JpbGUv0gEA?hl=en-PK&gl=PK&ceid=PK%3Aen
"Nokia, Samsung, Ericsson start salivating over 5G sales for C-band","Nokia, Samsung and Ericsson are beginning to preen and posture for operators' attention ahead of a C-band auction poised to generate billions of dollars in ...",Light Reading,https://www.news.google.com/./articles/CBMibmh0dHBzOi8vd3d3LmxpZ2h0cmVhZGluZy5jb20vNWcvbm9raWEtc2Ftc3VuZy1lcmljc3Nvbi1zdGFydC1zYWxpdmF0aW5nLW92ZXItNWctc2FsZXMtZm9yLWMtYmFuZC9kL2QtaWQvNzYxODc00gEA?hl=en-PK&gl=PK&ceid=PK%3Aen
