title,text,link,source
"PIA plane crash in Karachi was due to human error, report says","Dubai: Human error caused the tragic crash of a Pakistan International Airlines (PIA) passenger plane in Karachi last month, says the provisional investigation ...",Gulf News,https://www.news.google.com/./articles/CBMicWh0dHBzOi8vZ3VsZm5ld3MuY29tL3dvcmxkL2FzaWEvcGFraXN0YW4vcGlhLXBsYW5lLWNyYXNoLWluLWthcmFjaGktd2FzLWR1ZS10by1odW1hbi1lcnJvci1yZXBvcnQtc2F5cy0xLjcyMjAxNDAw0gEA?hl=en-PK&gl=PK&ceid=PK%3Aen
Three PIA flights to bring back Pakistanis stranded in Kuwait,"ISLAMABAD: In order to alleviate the situation of stranded Pakistanis in Kuwait, National Assembly NA Speaker Asad Qaiser had recently directed the Ministry of ...",The News International,https://www.news.google.com/./articles/CBMiZWh0dHBzOi8vd3d3LnRoZW5ld3MuY29tLnBrL3ByaW50LzY3NjY2NS10aHJlZS1waWEtZmxpZ2h0cy10by1icmluZy1iYWNrLXBha2lzdGFuaXMtc3RyYW5kZWQtaW4ta3V3YWl00gFjaHR0cHM6Ly93d3cudGhlbmV3cy5jb20ucGsvYW1wLzY3NjY2NS10aHJlZS1waWEtZmxpZ2h0cy10by1icmluZy1iYWNrLXBha2lzdGFuaXMtc3RyYW5kZWQtaW4ta3V3YWl0?hl=en-PK&gl=PK&ceid=PK%3Aen
Pakistan prime minister receives 'detailed roadmap' on PIA reform,"Pakistan International Airlines, which in May suffered a fatal crash in Karachi, must undergo reforms including increasing revenue and upgrading its aircraft, ...",Flightglobal,https://www.news.google.com/./articles/CBMidGh0dHBzOi8vd3d3LmZsaWdodGdsb2JhbC5jb20vYWlybGluZXMvcGFraXN0YW4tcHJpbWUtbWluaXN0ZXItcmVjZWl2ZXMtZGV0YWlsZWQtcm9hZG1hcC1vbi1waWEtcmVmb3JtLzEzODc4OS5hcnRpY2xl0gEA?hl=en-PK&gl=PK&ceid=PK%3Aen
"ATC, overconfident pilot blamed for crash of PIA Flight 8303: Report",An overconfident pilot and an ATC that did not give adequate instructions have been faulted in an initial probe into the crash of Pakistan International Airlines ...,India Today,https://www.news.google.com/./articles/CAIiEAQF11EqTHC7E-nFBgUODIgqGQgEKhAIACoHCAowot7cCjD8xM4BMMfHhgI?hl=en-PK&gl=PK&ceid=PK%3Aen
Pakistan investigates PIA plane crash that killed 97 in Karachi,Investigators remove wreckage from site of Friday's crash as pilots' union objects to lack of representation in probe.,Al Jazeera English,https://www.news.google.com/./articles/CAIiEPJNu2Fn4tH7NWUAPSRAV6kqFAgEKgwIACoFCAowhgIwkDgw0O8B?hl=en-PK&gl=PK&ceid=PK%3Aen
Pakistan government forms joint investigation team to probe PIA plane crash,The Pakistan government has formed a joint investigation team to step up the pace of the probe into last month's crash of a PIA aircraft in Karachi that killed 98 ...,WION,https://www.news.google.com/./articles/CAIiEG0g_hwnn2JQZscOa_63W-4qGQgEKhAIACoHCAowvr39CjDhj_UCMM_gqwY?hl=en-PK&gl=PK&ceid=PK%3Aen
Passenger plane crash hits plans to revive Pakistan airlines (PIA),"A deadly Pakistan International Airlines Corp. crash that killed 97 people in May has put a plan to revive the company, which has more accumulated losses than ...",Gulf News,https://www.news.google.com/./articles/CAIiEHIF8jtXVsv8gydWChc69hkqGAgEKg8IACoHCAowqbqfCTDvjG8wkJGxBg?hl=en-PK&gl=PK&ceid=PK%3Aen
Noises on PIA flight to Pakistan scare passengers,"Panic gripped passengers when a Pakistan International Airlines plane made unusual noises while returning to Pakistan from Saudi Arabia, but the aircraft ...",Daily Times,https://www.news.google.com/./articles/CBMiU2h0dHBzOi8vZGFpbHl0aW1lcy5jb20ucGsvNjI1MjgzL25vaXNlcy1vbi1waWEtZmxpZ2h0LXRvLXBha2lzdGFuLXNjYXJlLXBhc3NlbmdlcnMv0gFXaHR0cHM6Ly9kYWlseXRpbWVzLmNvbS5way82MjUyODMvbm9pc2VzLW9uLXBpYS1mbGlnaHQtdG8tcGFraXN0YW4tc2NhcmUtcGFzc2VuZ2Vycy9hbXAv?hl=en-PK&gl=PK&ceid=PK%3Aen
PIA CEO apprises PM Imran on plane crash probe,ISLAMABAD: Pakistan International Airlines Chief Executive Officer (CEO) Arshad Malik on Monday apprised Prime Minister Imran Khan on progress regarding ...,Geo News,https://www.news.google.com/./articles/CAIiEJVIf5jxvdjB_J0plUECeZ4qMwgEKioIACIQueFm35xOZipy-QOS9ivtJCoUCAoiELnhZt-cTmYqcvkDkvYr7SQwqpvFBg?hl=en-PK&gl=PK&ceid=PK%3Aen
Officials: Noises on PIA Flight to Pakistan Scare Passengers,"Panic gripped passengers when a Pakistan International Airlines plane made unusual noises while returning to Pakistan from Saudi Arabia, but the aircraft ...",The New York Times,https://www.news.google.com/./articles/CBMiVmh0dHBzOi8vd3d3Lm55dGltZXMuY29tL2Fwb25saW5lLzIwMjAvMDYvMTEvd29ybGQvYXNpYS9hcC1hcy1wYWtpc3Rhbi1wbGFuZS1zY2FyZS5odG1s0gEA?hl=en-PK&gl=PK&ceid=PK%3Aen
PIA to operate two flights to Kyrgyzstan to bring back stranded Pakistanis,RAWALPINDI: The Pakistan International Airlines will operate two special flights on June 17 (Wednesday) to bring back Pakistanis stranded in Kyrgyzstan ...,DAWN.com,https://www.news.google.com/./articles/CBMibGh0dHBzOi8vd3d3LmRhd24uY29tL25ld3MvMTU2MzU0OC9waWEtdG8tb3BlcmF0ZS10d28tZmxpZ2h0cy10by1reXJneXpzdGFuLXRvLWJyaW5nLWJhY2stc3RyYW5kZWQtcGFraXN0YW5pc9IBJWh0dHBzOi8vd3d3LmRhd24uY29tL25ld3MvYW1wLzE1NjM1NDg?hl=en-PK&gl=PK&ceid=PK%3Aen
Pakistan resumes international flight operations,ISLAMABAD / KARACHI: All the national and foreign airlines have been allowed to resume their flight operations between Pakistan and the rest of the world as ...,The Express Tribune,https://www.news.google.com/./articles/CBMiZWh0dHBzOi8vdHJpYnVuZS5jb20ucGsvc3RvcnkvMjIzMTEwOS8xLXBha2lzdGFuLXJlc3VtZXMtaW50ZXJuYXRpb25hbC1mbGlnaHQtb3BlcmF0aW9ucy1tYXktMzAvP2FtcD0x0gFlaHR0cHM6Ly90cmlidW5lLmNvbS5way9zdG9yeS8yMjMxMTA5LzEtcGFraXN0YW4tcmVzdW1lcy1pbnRlcm5hdGlvbmFsLWZsaWdodC1vcGVyYXRpb25zLW1heS0zMC8_YW1wPTE?hl=en-PK&gl=PK&ceid=PK%3Aen
Danger in the air: On PIA flight crash,The PIA crash is a reminder that the aviation industry provides little margin for error.,The Hindu,https://www.news.google.com/./articles/CBMiUGh0dHBzOi8vd3d3LnRoZWhpbmR1LmNvbS9vcGluaW9uL2VkaXRvcmlhbC9kYW5nZXItaW4tdGhlLWFpci9hcnRpY2xlMzE2NjU5NDUuZWNl0gFVaHR0cHM6Ly93d3cudGhlaGluZHUuY29tL29waW5pb24vZWRpdG9yaWFsL2Rhbmdlci1pbi10aGUtYWlyL2FydGljbGUzMTY2NTk0NS5lY2UvYW1wLw?hl=en-PK&gl=PK&ceid=PK%3Aen
PIA Flight #8303: Prayers for All,The devastating crash of PIA Flight #8303 has been that one thing has left us all greatly traumatized as a country. The news has left us with so much sadness ...,Daily Times,https://www.news.google.com/./articles/CBMiQWh0dHBzOi8vZGFpbHl0aW1lcy5jb20ucGsvNjE4NDkyL3BpYS1mbGlnaHQtODMwMy1wcmF5ZXJzLWZvci1hbGwv0gFFaHR0cHM6Ly9kYWlseXRpbWVzLmNvbS5way82MTg0OTIvcGlhLWZsaWdodC04MzAzLXByYXllcnMtZm9yLWFsbC9hbXAv?hl=en-PK&gl=PK&ceid=PK%3Aen
Noises on PIA flight from Saudi Arabia to Pakistan scare passengers,PIA in a statement rejected local media reports that flight PK-8726 made an emergency landing on Wednesday night on its return from Riyadh. It said a part on ...,Gulf Today,https://www.news.google.com/./articles/CBMibGh0dHBzOi8vd3d3Lmd1bGZ0b2RheS5hZS9uZXdzLzIwMjAvMDYvMTEvbm9pc2VzLW9uLXBpYS1mbGlnaHQtZnJvbS1zYXVkaS1hcmFiaWEtdG8tcGFraXN0YW4tc2NhcmUtcGFzc2VuZ2Vyc9IBAA?hl=en-PK&gl=PK&ceid=PK%3Aen
The time for quick fixes at PIA is over,"There is much about the crash of Flight PK-8308 that we do not know, including the precise cause of the crash. But there is one thing we do know and can say ...",Profit by Pakistan Today,https://www.news.google.com/./articles/CBMiV2h0dHBzOi8vcHJvZml0LnBha2lzdGFudG9kYXkuY29tLnBrLzIwMjAvMDYvMDEvdGhlLXRpbWUtZm9yLXF1aWNrLWZpeGVzLWF0LXBpYS1pcy1vdmVyL9IBAA?hl=en-PK&gl=PK&ceid=PK%3Aen
PIA offers concessional fares to enhance mango exports,MULTAN-Muhammad Nawaz Sharif University of Agriculture's initiative to promote mango export amid COVID-19 won laurel as Pakistan International Airline ...,The Nation,https://www.news.google.com/./articles/CBMiWGh0dHBzOi8vbmF0aW9uLmNvbS5way8yMi1KdW4tMjAyMC9waWEtb2ZmZXJzLWNvbmNlc3Npb25hbC1mYXJlcy10by1lbmhhbmNlLW1hbmdvLWV4cG9ydHPSAWRodHRwczovL25hdGlvbi5jb20ucGsvMjItSnVuLTIwMjAvcGlhLW9mZmVycy1jb25jZXNzaW9uYWwtZmFyZXMtdG8tZW5oYW5jZS1tYW5nby1leHBvcnRzP3ZlcnNpb249YW1w?hl=en-PK&gl=PK&ceid=PK%3Aen
PIA’s last special US flight takes off from Chicago,"The last of six special flights operated from the US to Pakistan took off from Chicago's O'Hare International Airport on Sunday. The tickets cost around Rs250,000 ...",SAMAA,https://www.news.google.com/./articles/CAIiEOYuGtbICb0xdTyyf4ZC14MqGQgEKhAIACoHCAowwpSUCzCv06kDMPv2xQY?hl=en-PK&gl=PK&ceid=PK%3Aen
PIA plane crash: Was it a human error or technical fault or combination of both,Dubai: It's been 11 days since Pakistan International Airlines (PIA) Flight PK-8303 crashed in Karachi. But there are questions galore that still remain ...,Gulf News,https://www.news.google.com/./articles/CAIiEDqLeOU9Hyi2n2m6v-_BK5QqGAgEKg8IACoHCAowqbqfCTDvjG8wkJGxBg?hl=en-PK&gl=PK&ceid=PK%3Aen
Currency worth Rs30m found in PIA plane’s debris,"In a shocking development on Thursday, a spokesperson of the Pakistan International Airlines (PIA) has claimed that local and foreign currency amounting to ...",Pakistan Today,https://www.news.google.com/./articles/CBMiXGh0dHBzOi8vd3d3LnBha2lzdGFudG9kYXkuY29tLnBrLzIwMjAvMDUvMjgvY3VycmVuY3ktd29ydGgtcnMzMG0tZm91bmQtaW4tcGlhLXBsYW5lcy1kZWJyaXMv0gFgaHR0cHM6Ly93d3cucGFraXN0YW50b2RheS5jb20ucGsvMjAyMC8wNS8yOC9jdXJyZW5jeS13b3J0aC1yczMwbS1mb3VuZC1pbi1waWEtcGxhbmVzLWRlYnJpcy9hbXAv?hl=en-PK&gl=PK&ceid=PK%3Aen
Pakistan International Airlines : Sixth PIA flight with stranded Pakistanis in US aboard departs for Islamabad,A specially chartered Pakistan International Airlines (PIA) flight left Chicago for Islamabad Sunday carrying Pakistani citizens stranded by the coronavirus ...,marketscreener.com,https://www.news.google.com/./articles/CBMiswFodHRwczovL3d3dy5tYXJrZXRzY3JlZW5lci5jb20vUEFLSVNUQU4tSU5URVJOQVRJT05BTC1BSS0yMDY5OTI1Mi9uZXdzL1Bha2lzdGFuLUludGVybmF0aW9uYWwtQWlybGluZXMtU2l4dGgtUElBLWZsaWdodC13aXRoLXN0cmFuZGVkLVBha2lzdGFuaXMtaW4tVVMtYWJvYXJkLWRlcGFydHMtZm9yLTMwNzc4NjM0L9IBAA?hl=en-PK&gl=PK&ceid=PK%3Aen
‘We bring it to you first’. How Pakistan TV news sensationalised the tragic PIA flight crash,"Journalists could be seen screaming into microphones that they had recorded footage of all injured and dead in the plane crash, so that 'we can bring it to you ...",ThePrint,https://www.news.google.com/./articles/CBMifWh0dHBzOi8vdGhlcHJpbnQuaW4vb3Bpbmlvbi93ZS1icmluZy1pdC10by15b3UtZmlyc3QtaG93LXBha2lzdGFuLXR2LW5ld3Mtc2Vuc2F0aW9uYWxpc2VkLXRoZS10cmFnaWMtcGlhLWZsaWdodC1jcmFzaC80MzA1NDMv0gGBAWh0dHBzOi8vdGhlcHJpbnQuaW4vb3Bpbmlvbi93ZS1icmluZy1pdC10by15b3UtZmlyc3QtaG93LXBha2lzdGFuLXR2LW5ld3Mtc2Vuc2F0aW9uYWxpc2VkLXRoZS10cmFnaWMtcGlhLWZsaWdodC1jcmFzaC80MzA1NDMvP2FtcA?hl=en-PK&gl=PK&ceid=PK%3Aen
Govt to present plane crashes reports in NA tomorrow,"The National Assembly was informed on Monday that the government will present the reports of all plane crashes that took place in the last 10 years, including ...",Daily Times,https://www.news.google.com/./articles/CBMiVmh0dHBzOi8vZGFpbHl0aW1lcy5jb20ucGsvNjMwNTc3L2dvdnQtdG8tcHJlc2VudC1wbGFuZS1jcmFzaGVzLXJlcG9ydHMtaW4tbmEtdG9tb3Jyb3cv0gFaaHR0cHM6Ly9kYWlseXRpbWVzLmNvbS5way82MzA1NzcvZ292dC10by1wcmVzZW50LXBsYW5lLWNyYXNoZXMtcmVwb3J0cy1pbi1uYS10b21vcnJvdy9hbXAv?hl=en-PK&gl=PK&ceid=PK%3Aen
Investigators download data from crashed PIA A320 recorders,Investigators have downloaded information from the two flight recorders retrieved from the Pakistan International Airlines Airbus A320 which crashed in Karachi.,Flightglobal,https://www.news.google.com/./articles/CBMibmh0dHBzOi8vd3d3LmZsaWdodGdsb2JhbC5jb20vc2FmZXR5L2ludmVzdGlnYXRvcnMtZG93bmxvYWQtZGF0YS1mcm9tLWNyYXNoZWQtcGlhLWEzMjAtcmVjb3JkZXJzLzEzODY1OC5hcnRpY2xl0gEA?hl=en-PK&gl=PK&ceid=PK%3Aen
"Remove PIA, CAA heads, aviation minister for transparent plane crash probe: AWP","Expressing grief over the tragic loss of lives in the recent plane crash of the Pakistan International Airlines (PIA), the Awami Workers Party has demanded that a ...",The News International,https://www.news.google.com/./articles/CBMidGh0dHBzOi8vd3d3LnRoZW5ld3MuY29tLnBrL3ByaW50LzY2NjU0OC1yZW1vdmUtcGlhLWNhYS1oZWFkcy1hdmlhdGlvbi1taW5pc3Rlci1mb3ItdHJhbnNwYXJlbnQtcGxhbmUtY3Jhc2gtcHJvYmUtYXdw0gFyaHR0cHM6Ly93d3cudGhlbmV3cy5jb20ucGsvYW1wLzY2NjU0OC1yZW1vdmUtcGlhLWNhYS1oZWFkcy1hdmlhdGlvbi1taW5pc3Rlci1mb3ItdHJhbnNwYXJlbnQtcGxhbmUtY3Jhc2gtcHJvYmUtYXdw?hl=en-PK&gl=PK&ceid=PK%3Aen
Upgrade: PIA to import new flight operations control from Turkey,The PIA aims to upgrade its flight operations control system following last Friday's crash in Karachi that killed 97 people. The.,Daily Times,https://www.news.google.com/./articles/CBMiYWh0dHBzOi8vZGFpbHl0aW1lcy5jb20ucGsvNjE3NjQwL3VwZ3JhZGUtcGlhLXRvLWltcG9ydC1uZXctZmxpZ2h0LW9wZXJhdGlvbnMtY29udHJvbC1mcm9tLXR1cmtleS_SAWVodHRwczovL2RhaWx5dGltZXMuY29tLnBrLzYxNzY0MC91cGdyYWRlLXBpYS10by1pbXBvcnQtbmV3LWZsaWdodC1vcGVyYXRpb25zLWNvbnRyb2wtZnJvbS10dXJrZXkvYW1wLw?hl=en-PK&gl=PK&ceid=PK%3Aen
Former PIA pilot questions control tower’s ‘indecisiveness’ resulting in crash,"Retired senior pilot Adil bin Qamar, who has flown planes of different airlines including PIA, has raised questions on the Air Traffic Control tower's attitude during ...",SAMAA,https://www.news.google.com/./articles/CAIiEFG0BR7EtLWR_P1X87gmm5kqGQgEKhAIACoHCAowwpSUCzCv06kDML6O2wY?hl=en-PK&gl=PK&ceid=PK%3Aen
"Nine days on, Nabeel yet to get body of his wife who perished in PIA plane crash","In the month of March, Nabeel Ahmed Idrees, 27, took his 26-year-old wife, Nosheen Tahir, to her home in Gujranwala for the first time after their wedding in ...",The News International,https://www.news.google.com/./articles/CBMid2h0dHBzOi8vd3d3LnRoZW5ld3MuY29tLnBrL3ByaW50LzY2NTYwMi1uaW5lLWRheXMtb24tbmFiZWVsLXlldC10by1nZXQtYm9keS1vZi1oaXMtd2lmZS13aG8tcGVyaXNoZWQtaW4tcGlhLXBsYW5lLWNyYXNo0gF1aHR0cHM6Ly93d3cudGhlbmV3cy5jb20ucGsvYW1wLzY2NTYwMi1uaW5lLWRheXMtb24tbmFiZWVsLXlldC10by1nZXQtYm9keS1vZi1oaXMtd2lmZS13aG8tcGVyaXNoZWQtaW4tcGlhLXBsYW5lLWNyYXNo?hl=en-PK&gl=PK&ceid=PK%3Aen
COVID19 – Here’s how PIA will bring back Pakistanis stranded in UAE,ISLAMABAD – Pakistan International Airlines on Wednesday released the special flight schedule for UAE to bring back Pakistanis during the coronavirus.,Daily Pakistan Global,https://www.news.google.com/./articles/CBMibWh0dHBzOi8vZW4uZGFpbHlwYWtpc3Rhbi5jb20ucGsvMDMtSnVuLTIwMjAvY292aWQxOS1oZXJlLXMtaG93LXBpYS13aWxsLWJyaW5nLWJhY2stcGFraXN0YW5pcy1zdHJhbmRlZC1pbi11YWXSAXlodHRwczovL2VuLmRhaWx5cGFraXN0YW4uY29tLnBrLzAzLUp1bi0yMDIwL2NvdmlkMTktaGVyZS1zLWhvdy1waWEtd2lsbC1icmluZy1iYWNrLXBha2lzdGFuaXMtc3RyYW5kZWQtaW4tdWFlP3ZlcnNpb249YW1w?hl=en-PK&gl=PK&ceid=PK%3Aen
"Pakistan allows all airlines to operate, passengers can buy tickets directly",Stranded Pakistanis are no more required to wait for special flights ticket as the government has allowed all international airlines to resume their flight operations ...,Khaleej Times,https://www.news.google.com/./articles/CBMieGh0dHBzOi8vd3d3LmtoYWxlZWp0aW1lcy5jb20vd29ybGQvcGFraXN0YW4vcGFraXN0YW4tYWxsb3dzLWFsbC1haXJsaW5lcy10by1vcGVyYXRlLXBhc3NlbmdlcnMtY2FuLWJ1eS10aWNrZXRzLWRpcmVjdGx5LdIBAA?hl=en-PK&gl=PK&ceid=PK%3Aen
Zoheb Hassan says he almost took the doomed PIA flight,Pakistan's famed musician Zoheb Hassan on Saturday said that he nearly took the 'doomed' Pakistan International Airlines (PIA) flight PK 8303 but missed by a ...,Daily Times,https://www.news.google.com/./articles/CBMiWGh0dHBzOi8vZGFpbHl0aW1lcy5jb20ucGsvNjE3NDk4L3pvaGViLWhhc3Nhbi1zYXlzLWhlLWFsbW9zdC10b29rLXRoZS1kb29tZWQtcGlhLWZsaWdodC_SAVxodHRwczovL2RhaWx5dGltZXMuY29tLnBrLzYxNzQ5OC96b2hlYi1oYXNzYW4tc2F5cy1oZS1hbG1vc3QtdG9vay10aGUtZG9vbWVkLXBpYS1mbGlnaHQvYW1wLw?hl=en-PK&gl=PK&ceid=PK%3Aen
Alvi assures PIA plane crash probe report by 22nd,"ISLAMABAD - President Dr Arif Alvi on Monday informed the victim families, who lost their near and dear ones in the tragic PIA plane crash in Karachi last.",The Nation,https://www.news.google.com/./articles/CBMiU2h0dHBzOi8vbmF0aW9uLmNvbS5way8xNi1KdW4tMjAyMC9hbHZpLWFzc3VyZXMtcGlhLXBsYW5lLWNyYXNoLXByb2JlLXJlcG9ydC1ieS0yMm5k0gFfaHR0cHM6Ly9uYXRpb24uY29tLnBrLzE2LUp1bi0yMDIwL2FsdmktYXNzdXJlcy1waWEtcGxhbmUtY3Jhc2gtcHJvYmUtcmVwb3J0LWJ5LTIybmQ_dmVyc2lvbj1hbXA?hl=en-PK&gl=PK&ceid=PK%3Aen
Interior minister assures transparent investigation of PIA plane crash,Interior Minister Ijaz Ahmad Shah on Tuesday assured that a transparent investigation will be conducted into Pakistan International Airlines (PIA) aircraft's crash ...,The Express Tribune,https://www.news.google.com/./articles/CBMia2h0dHBzOi8vdHJpYnVuZS5jb20ucGsvc3RvcnkvMjIyODc4Mi8xLWludGVyaW9yLW1pbmlzdGVyLWFzc3VyZXMtdHJhbnNwYXJlbnQtaW52ZXN0aWdhdGlvbi1waWEtcGxhbmUtY3Jhc2gv0gEA?hl=en-PK&gl=PK&ceid=PK%3Aen
PIA CEO meets families of plane crash victims,"LAHORE: PIA CEO Air Marshal Arshad Malik met with the family members of crash victims and crew. He visited the houses of the crew namely: Capt Sajjad Gul, ...",The News International,https://www.news.google.com/./articles/CBMiVWh0dHBzOi8vd3d3LnRoZW5ld3MuY29tLnBrL3ByaW50LzY2Njc4OS1waWEtY2VvLW1lZXRzLWZhbWlsaWVzLW9mLXBsYW5lLWNyYXNoLXZpY3RpbXPSAVNodHRwczovL3d3dy50aGVuZXdzLmNvbS5way9hbXAvNjY2Nzg5LXBpYS1jZW8tbWVldHMtZmFtaWxpZXMtb2YtcGxhbmUtY3Jhc2gtdmljdGltcw?hl=en-PK&gl=PK&ceid=PK%3Aen
"Ji, Sir ji: Did PIA Flight 8303 crash because of Yes Sir culture?",This is not about the crash. This is about our societies.,DailyO,https://www.news.google.com/./articles/CBMicGh0dHBzOi8vd3d3LmRhaWx5by5pbi92YXJpZXR5L3Bha2lzdGFuLWZsaWdodC1jcmFzaC1waWEtZmxpZ2h0LTgzMDMtcGlhLWZsaWdodC1wYWtpc3Rhbi1jcmFzaC9zdG9yeS8xLzMzMDA4Lmh0bWzSAQA?hl=en-PK&gl=PK&ceid=PK%3Aen
PIA hikes fares for people returning from KSA,LAHORE: The Pakistan International Airlines has increased fares manifold for those travelling from Saudi Arabia to Pakistan.Pakistan Embassy in Riyadh has ...,The News International,https://www.news.google.com/./articles/CBMiVWh0dHBzOi8vd3d3LnRoZW5ld3MuY29tLnBrL3ByaW50LzY3Mjk1Mi1waWEtaGlrZXMtZmFyZXMtZm9yLXBlb3BsZS1yZXR1cm5pbmctZnJvbS1rc2HSAVNodHRwczovL3d3dy50aGVuZXdzLmNvbS5way9hbXAvNjcyOTUyLXBpYS1oaWtlcy1mYXJlcy1mb3ItcGVvcGxlLXJldHVybmluZy1mcm9tLWtzYQ?hl=en-PK&gl=PK&ceid=PK%3Aen
Crashed Pakistan plane 'hit runway three times on first approach',"Minister says plane's engines touched ground three times on the first attempt at landing before it crashed, killing 97.",Al Jazeera English,https://www.news.google.com/./articles/CAIiEPWot46_PECzTvwxK30X1HYqFAgEKgwIACoFCAowhgIwkDgw0O8B?hl=en-PK&gl=PK&ceid=PK%3Aen
SOPs issued for handing over PIA plane crash victims’ bodies,The plane crashed on May 22 with 99 people aboard.,SAMAA,https://www.news.google.com/./articles/CAIiEJEwPvFyogjTXLs_ziI8d7EqGQgEKhAIACoHCAowwpSUCzCv06kDMIjTxwY?hl=en-PK&gl=PK&ceid=PK%3Aen
PAF officer who passed away in PIA plane crash laid to rest,"Funeral prayers for Squadron Leader Zain-ul-Arif Khan, who passed away in the Pakistan International Airlines (PIA) flight PK-8303 plane crash last week, were ...",Geo News,https://www.news.google.com/./articles/CAIiEIX-v_pCEsWqy_38aJpDpYQqMwgEKioIACIQueFm35xOZipy-QOS9ivtJCoUCAoiELnhZt-cTmYqcvkDkvYr7SQwqpvFBg?hl=en-PK&gl=PK&ceid=PK%3Aen
"PIA app to book tickets from UAE to Pakistan, airfares fixed",PIA has introduced new measures for stranded nationals in Abu Dhabi and Al Ain to book tickets in a hassle-free manner.,Khaleej Times,https://www.news.google.com/./articles/CBMibmh0dHBzOi8vd3d3LmtoYWxlZWp0aW1lcy5jb20vY29yb25hdmlydXMtcGFuZGVtaWMvcGlhLWFwcC10by1ib29rLXRpY2tldHMtZnJvbS11YWUtdG8tcGFraXN0YW4tYWlyZmFyZXMtZml4ZWQt0gEA?hl=en-PK&gl=PK&ceid=PK%3Aen
Millions in cash found in PIA PK8303 wreckage,The investigators and rescuers working at the Pakistan International Airlines (PIA) flight PK8303 crash site recovered over 30 million Indian rupees (about ...,AeroTime News Hub,https://www.news.google.com/./articles/CBMiYmh0dHBzOi8vd3d3LmFlcm90aW1lLmFlcm8vY2xlbWVudC5jaGFycGVudHJlYXUvMjUwOTMtbWlsbGlvbnMtaW4tY2FzaC1mb3VuZC1pbi1waWEtcGs4MzAzLXdyZWNrYWdl0gFoaHR0cHM6Ly93d3cuYWVyb3RpbWUuYWVyby9jbGVtZW50LmNoYXJwZW50cmVhdS8yNTA5My1taWxsaW9ucy1pbi1jYXNoLWZvdW5kLWluLXBpYS1wazgzMDMtd3JlY2thZ2U_dj1hbXA?hl=en-PK&gl=PK&ceid=PK%3Aen
Petition filed in LHC seeking judicial inquiry into PIA plane crash,"LAHORE: A writ petition has been filed in the Lahore High Court (LHC), seeking constitution of a judicial commission for a fair investigation into the recent PIA ...",The Express Tribune,https://www.news.google.com/./articles/CBMiY2h0dHBzOi8vdHJpYnVuZS5jb20ucGsvc3RvcnkvMjI0MjI0Mi8xLXBldGl0aW9uLWZpbGVkLWxoYy1zZWVraW5nLWp1ZGljaWFsLWlucXVpcnktcGlhLXBsYW5lLWNyYXNoL9IBAA?hl=en-PK&gl=PK&ceid=PK%3Aen
"Pakistan International Airlines : PIA announces to pay six-month rent, rebuild houses damaged in plane crash","In order to compensate the affected residents of Karachi's Model Colony, where a Pakistan International Airlines plane had crashed on May 22 , the national flag ...",marketscreener.com,https://www.news.google.com/./articles/CBMisgFodHRwczovL3d3dy5tYXJrZXRzY3JlZW5lci5jb20vUEFLSVNUQU4tSU5URVJOQVRJT05BTC1BSS0yMDY5OTI1Mi9uZXdzL1Bha2lzdGFuLUludGVybmF0aW9uYWwtQWlybGluZXMtUElBLWFubm91bmNlcy10by1wYXktc2l4LW1vbnRoLXJlbnQtcmVidWlsZC1ob3VzZXMtZGFtYWdlZC1pbi1wbGEtMzA4MDIzMTAv0gEA?hl=en-PK&gl=PK&ceid=PK%3Aen
Pity the taxpayers,"The chief justice of the Supreme Court expressed his annoyance over the huge number of surplus employees in the Pakistan Railways. A few days ago, ...",The News International,https://www.news.google.com/./articles/CBMiOmh0dHBzOi8vd3d3LnRoZW5ld3MuY29tLnBrL3ByaW50LzY3NTg2Ny1waXR5LXRoZS10YXhwYXllcnPSAThodHRwczovL3d3dy50aGVuZXdzLmNvbS5way9hbXAvNjc1ODY3LXBpdHktdGhlLXRheHBheWVycw?hl=en-PK&gl=PK&ceid=PK%3Aen
PIA flight carrying 253 passengers departed Baghdad for Islamabad,Ambassador Sajid Bilal saw off the passengers at the airport. The Ambassador thanked the government of Iraq for its support in facilitating repatriation of ...,Radio Pakistan,https://www.news.google.com/./articles/CBMiZGh0dHA6Ly93d3cucmFkaW8uZ292LnBrLzA5LTA2LTIwMjAvcGlhLWZsaWdodC1jYXJyeWluZy0yNTMtcGFzc2VuZ2Vycy1kZXBhcnRlZC1iYWdoZGFkLWZvci1pc2xhbWFiYWTSAQA?hl=en-PK&gl=PK&ceid=PK%3Aen
PIA Plane Crash: 84 bodies identified and handed over to families,"Sindh Chief Minister Syed Murad Ali Shah in a statement said on Monday that out of the total, 84 bodies of the Pakistan International Airlines (PIA) plane crash ...",Daily Times,https://www.news.google.com/./articles/CBMiYmh0dHBzOi8vZGFpbHl0aW1lcy5jb20ucGsvNjIwMTYwL3BpYS1wbGFuZS1jcmFzaC04NC1ib2RpZXMtaWRlbnRpZmllZC1hbmQtaGFuZGVkLW92ZXItdG8tZmFtaWxpZXMv0gFmaHR0cHM6Ly9kYWlseXRpbWVzLmNvbS5way82MjAxNjAvcGlhLXBsYW5lLWNyYXNoLTg0LWJvZGllcy1pZGVudGlmaWVkLWFuZC1oYW5kZWQtb3Zlci10by1mYW1pbGllcy9hbXAv?hl=en-PK&gl=PK&ceid=PK%3Aen
Coronavirus: more repatriation flights from UAE to Pakistan announced,"More than 35 flights, destined for a number of Pakistani cities, will depart the Emirates between Tuesday, June 9 and Monday, June 15.",The National,https://www.news.google.com/./articles/CBMiemh0dHBzOi8vd3d3LnRoZW5hdGlvbmFsLmFlL2xpZmVzdHlsZS90cmF2ZWwvY29yb25hdmlydXMtbW9yZS1yZXBhdHJpYXRpb24tZmxpZ2h0cy1mcm9tLXVhZS10by1wYWtpc3Rhbi1hbm5vdW5jZWQtMS4xMDMwOTE00gF6aHR0cHM6Ly9hbXAudGhlbmF0aW9uYWwuYWUvbGlmZXN0eWxlL3RyYXZlbC9jb3JvbmF2aXJ1cy1tb3JlLXJlcGF0cmlhdGlvbi1mbGlnaHRzLWZyb20tdWFlLXRvLXBha2lzdGFuLWFubm91bmNlZC0xLjEwMzA5MTQ?hl=en-PK&gl=PK&ceid=PK%3Aen
COVID-19: No coronavirus tests for 'healthy' overseas Pakistanis flying back home,Dubai: Healthy stranded overseas Pakistanis who are flying back home will no longer have to undergo a mandatory COVID-19 test at the airports across the ...,Gulf News,https://www.news.google.com/./articles/CBMiggFodHRwczovL2d1bGZuZXdzLmNvbS93b3JsZC9hc2lhL3Bha2lzdGFuL2NvdmlkLTE5LW5vLWNvcm9uYXZpcnVzLXRlc3RzLWZvci1oZWFsdGh5LW92ZXJzZWFzLXBha2lzdGFuaXMtZmx5aW5nLWJhY2staG9tZS0xLjcyMTgyNzQw0gEA?hl=en-PK&gl=PK&ceid=PK%3Aen
PIA special flight to Faisalabad repatriates 147,We show you our most important and recent visitors news details PIA special flight to Faisalabad repatriates 147 in the following article. Hind Al Soulia - Riyadh ...,AlKhaleej Today,https://www.news.google.com/./articles/CBMiY2h0dHBzOi8vYWxraGFsZWVqdG9kYXkuY28vc2F1ZGktYXJhYmlhLzEwNDU0OC9QSUEtc3BlY2lhbC1mbGlnaHQtdG8tRmFpc2FsYWJhZC1yZXBhdHJpYXRlcy0xNDcuaHRtbNIBAA?hl=en-PK&gl=PK&ceid=PK%3Aen
"103 PIA flights to repatriate 20,000 by May 9","KARACHI/RAWALPINDI: The Pakistan International Airlines (PIA) has worked out an extraordinary special flights operation to bring back 20,000 stranded ...",The Express Tribune,https://www.news.google.com/./articles/CBMiVGh0dHBzOi8vdHJpYnVuZS5jb20ucGsvc3RvcnkvMjIwNzc3NS8xLTEwMy1waWEtZmxpZ2h0cy1yZXBhdHJpYXRlLTIwMDAwLW1heS05Lz9hbXA9MdIBVGh0dHBzOi8vdHJpYnVuZS5jb20ucGsvc3RvcnkvMjIwNzc3NS8xLTEwMy1waWEtZmxpZ2h0cy1yZXBhdHJpYXRlLTIwMDAwLW1heS05Lz9hbXA9MQ?hl=en-PK&gl=PK&ceid=PK%3Aen
PIA announces schedule for 10 special flights,Spread of pandemic has wrought havoc on schedules of all airlines across the globe.,DAWN.com,https://www.news.google.com/./articles/CBMiIWh0dHBzOi8vd3d3LmRhd24uY29tL25ld3MvMTU0NjAwNdIBJWh0dHBzOi8vd3d3LmRhd24uY29tL25ld3MvYW1wLzE1NDYwMDU?hl=en-PK&gl=PK&ceid=PK%3Aen
PIA flight to bring back Pakistanis from US on 17th,"ISLAMABAD: A special Pakistan International Airlines (PIA) charter flight carrying stranded Pakistanis will depart from Newark, New Jersey for Lahore on May 17 ...",Pakistan Today,https://www.news.google.com/./articles/CBMiVWh0dHBzOi8vd3d3LnBha2lzdGFudG9kYXkuY29tLnBrLzIwMjAvMDUvMTIvcGlhLWZsaWdodC1icmluZy1iYWNrLXBha2lzdGFuaXMtdXMtMTd0aC_SAVlodHRwczovL3d3dy5wYWtpc3RhbnRvZGF5LmNvbS5way8yMDIwLzA1LzEyL3BpYS1mbGlnaHQtYnJpbmctYmFjay1wYWtpc3RhbmlzLXVzLTE3dGgvYW1wLw?hl=en-PK&gl=PK&ceid=PK%3Aen
Following are the top foreign stories at 1700 hours,"FGN31 CHINA-INDIA-LD BORDER Armies of China, India agree to take steps to cool down situation: Chinese official. Beijing: Top Chinese and Indian military ...",THE WEEK,https://www.news.google.com/./articles/CBMiaWh0dHBzOi8vd3d3LnRoZXdlZWsuaW4vd2lyZS11cGRhdGVzL2ludGVybmF0aW9uYWwvMjAyMC8wNi8yMy9mZ24zNi10b3AtZm9yZWlnbi1zdG9yaWVzLWF0LTE3MDAtaG91cnMuaHRtbNIBbWh0dHBzOi8vd3d3LnRoZXdlZWsuaW4vd2lyZS11cGRhdGVzL2ludGVybmF0aW9uYWwvMjAyMC8wNi8yMy9mZ24zNi10b3AtZm9yZWlnbi1zdG9yaWVzLWF0LTE3MDAtaG91cnMuYW1wLmh0bWw?hl=en-PK&gl=PK&ceid=PK%3Aen
