title,description,link,source
"Coronavirus (COVID-19) Update: Daily Roundup June 19, 2020",The U.S. Food and Drug Administration today announced the following actions taken in its ongoing response effort to the COVID-19 pandemic: The FDA issued ...,FDA.gov,https://www.news.google.com/./articles/CBMiamh0dHBzOi8vd3d3LmZkYS5nb3YvbmV3cy1ldmVudHMvcHJlc3MtYW5ub3VuY2VtZW50cy9jb3JvbmF2aXJ1cy1jb3ZpZC0xOS11cGRhdGUtZGFpbHktcm91bmR1cC1qdW5lLTE5LTIwMjDSAQA?hl=en-PK&gl=PK&ceid=PK%3Aen
"House Speaker, lawmakers test positive for the coronavirus",House Speaker Philip Gunn confirmed he is the latest member of the Mississippi Legislature to contract COVID-19.,Mississippi Today,https://www.news.google.com/./articles/CBMiYmh0dHBzOi8vbWlzc2lzc2lwcGl0b2RheS5vcmcvMjAyMC8wNy8wNS9ob3VzZS1zcGVha2VyLWxhd21ha2Vycy10ZXN0LXBvc2l0aXZlLWZvci10aGUtY29yb25hdmlydXMv0gEA?hl=en-PK&gl=PK&ceid=PK%3Aen
Update: Seaside the new local coronavirus hotspot in Monterey County,"Editor's note: The following is a collection of breaking news updates, helpful informational sites and links to appropriate local institutions during the coronavirus ...",Voices of Monterey Bay,https://www.news.google.com/./articles/CBMic2h0dHBzOi8vdm9pY2Vzb2Ztb250ZXJleWJheS5vcmcvMjAyMC8wNy8wNS9tb250ZXJleS1jb3VudHktcmVwb3J0cy1zcGlrZS1vZi1uZXctY2FzZXMtYnV0LWZldy1uZXctaG9zcGl0YWxpemF0aW9ucy_SAQA?hl=en-PK&gl=PK&ceid=PK%3Aen
July 5 update: The latest on coronavirus and Maine,Here's a roundup of the latest news on the coronavirus and its impact in Maine: - State.,Bangor Daily News,https://www.news.google.com/./articles/CBMiZGh0dHBzOi8vYmFuZ29yZGFpbHluZXdzLmNvbS8yMDIwLzA3LzA1L25ld3Mvc3RhdGUvanVseS01LXVwZGF0ZS10aGUtbGF0ZXN0LW9uLWNvcm9uYXZpcnVzLWFuZC1tYWluZS_SAQA?hl=en-PK&gl=PK&ceid=PK%3Aen
Coronavirus: People visiting Wales urged to behave respectfully as five-mile travel rule ends,"The Welsh government had imposed a ""stay local"" requirement which advised people to remain within five miles of their home.",Sky News,https://www.news.google.com/./articles/CBMid2h0dHBzOi8vbmV3cy5za3kuY29tL3N0b3J5L2Nvcm9uYXZpcnVzLXBlb3BsZS12aXNpdGluZy13YWxlcy11cmdlZC10by1iZWhhdmUtc2FmZWx5LWFzLXJlc3RyaWN0aW9ucy1hcmUtbGlmdGVkLTEyMDIyMTEy0gF7aHR0cHM6Ly9uZXdzLnNreS5jb20vc3RvcnkvYW1wL2Nvcm9uYXZpcnVzLXBlb3BsZS12aXNpdGluZy13YWxlcy11cmdlZC10by1iZWhhdmUtc2FmZWx5LWFzLXJlc3RyaWN0aW9ucy1hcmUtbGlmdGVkLTEyMDIyMTEy?hl=en-PK&gl=PK&ceid=PK%3Aen
Seven new Berks coronavirus cases reported today | Coronavirus,"Seven new coronavirus cases in Berks County were reported Sunday by the state Department of Health, bringing the outbreak total to 4,578. The state recorded ...",Reading Eagle,https://www.news.google.com/./articles/CBMiiwFodHRwczovL3d3dy5yZWFkaW5nZWFnbGUuY29tL2Nvcm9uYXZpcnVzL3NldmVuLW5ldy1iZXJrcy1jb3JvbmF2aXJ1cy1jYXNlcy1yZXBvcnRlZC10b2RheS9hcnRpY2xlXzc3OWI5YzUwLWJlZDctMTFlYS05ZWQzLWUzMmMzNWEyNzFlMS5odG1s0gEA?hl=en-PK&gl=PK&ceid=PK%3Aen
U.S. Sets Record for Daily New Cases as Virus Surges in South and West,"Governments are scrambling to stop outbreaks before they become new waves of infection. In impoverished nations, many critically ill patients cannot get ...",The New York Times,https://www.news.google.com/./articles/CAIiEE4lRKD32_vAw-Pj8TW20VgqFwgEKg8IACoHCAowjuuKAzCWrzwwxoIY?hl=en-PK&gl=PK&ceid=PK%3Aen
'The risk remains': Sydney hotel guards under microscope as NSW records 14 new cases,"The use of private security guards in Sydney's quarantine hotels is now under the microscope, with failures in monitoring guest movements being blamed for the ...",Sydney Morning Herald,https://www.news.google.com/./articles/CAIiEDpS7xkuivYBEPWB_rHo9PcqGQgEKhAIACoHCAowxqmICzDg_IYDMM6lmwY?hl=en-PK&gl=PK&ceid=PK%3Aen
L.A. County coronavirus cases hit one-day high over July 4th weekend,The number of hospital patients with confirmed coronavirus infections jumped 41% in the last three weeks in Los Angeles County.,Los Angeles Times,https://www.news.google.com/./articles/CAIiEBxOh35xpKrGU_3WVGsW30YqFwgEKg4IACoGCAowjKxcMOvhCzCU9KQB?hl=en-PK&gl=PK&ceid=PK%3Aen
Coronavirus Live News and Updates,Federal health officials will answer questions about the government's pandemic response. Further lockdowns have been announced in Germany after an ...,The New York Times,https://www.news.google.com/./articles/CAIiEKsblDn5cny2TtbJ49ofxbYqFwgEKg8IACoHCAowjuuKAzCWrzww5oEY?hl=en-PK&gl=PK&ceid=PK%3Aen
U.S. sets another single-day record for new coronavirus cases,"Across the United States, 39,327 new coronavirus infections were reported by state health departments on Thursday — surpassing the previous single-day ...",The Washington Post,https://www.news.google.com/./articles/CAIiELECO2DboooQM6lZ02fZKOcqGAgEKg8IACoHCAowjtSUCjC30XQwzqe5AQ?hl=en-PK&gl=PK&ceid=PK%3Aen
China Defends Its Coronavirus Response,Government officials denied they had suppressed information about the outbreak and said China had set a strong example for how to combat it.,The New York Times,https://www.news.google.com/./articles/CAIiECcJz3MNYQzx_JASqLWDiIMqFwgEKg8IACoHCAowjuuKAzCWrzwwxoIY?hl=en-PK&gl=PK&ceid=PK%3Aen
Chile health minister resigns amid coronavirus row: Live updates,The health ministry had been accused of tallying deaths using a method that did not reflect the scale of the toll.,Al Jazeera English,https://www.news.google.com/./articles/CAIiEBtjwIvvg0BrycoLxOWmblUqFAgEKgwIACoFCAowhgIwkDgw0O8B?hl=en-PK&gl=PK&ceid=PK%3Aen
Covid 19 coronavirus: One new case of virus - A man in his 20s from London,"New Zealand has one new case of Covid-19 today. The case is a man in his 20s who arrived from London on July 4, via Doha and Sydney. The man was taken ...",New Zealand Herald,https://www.news.google.com/./articles/CBMiR2h0dHBzOi8vd3d3Lm56aGVyYWxkLmNvLm56L256L25ld3MvYXJ0aWNsZS5jZm0_Y19pZD0xJm9iamVjdGlkPTEyMzQ1ODMw0gEA?hl=en-PK&gl=PK&ceid=PK%3Aen
Coronavirus Today - June 24- mask mandate,Face masks will be required as North Carolina remains in the Safer-At-Home Phase 2 for several more weeks thanks to the coronavirus pandemic.,North Carolina Health News,https://www.news.google.com/./articles/CBMiTWh0dHBzOi8vd3d3Lm5vcnRoY2Fyb2xpbmFoZWFsdGhuZXdzLm9yZy8yMDIwLzA2LzI0L2Nvcm9uYXZpcnVzLXRvZGF5LWp1bmUtMjQv0gEA?hl=en-PK&gl=PK&ceid=PK%3Aen
Coronavirus (COVID-19) Update: FDA Revokes Emergency Use Authorization for Chloroquine and Hydroxychloroquine,"Today, the U.S. Food and Drug Administration (FDA) revoked the emergency use authorization (EUA) that allowed for chloroquine phosphate and ...",FDA.gov,https://www.news.google.com/./articles/CBMihwFodHRwczovL3d3dy5mZGEuZ292L25ld3MtZXZlbnRzL3ByZXNzLWFubm91bmNlbWVudHMvY29yb25hdmlydXMtY292aWQtMTktdXBkYXRlLWZkYS1yZXZva2VzLWVtZXJnZW5jeS11c2UtYXV0aG9yaXphdGlvbi1jaGxvcm9xdWluZS1hbmTSAQA?hl=en-PK&gl=PK&ceid=PK%3Aen
"Coronavirus LIVE: India beats Russia in cases, becomes third most affected",Read more about Coronavirus LIVE: WHO team to visit China next week to probe corona origin on Business-standard. Coronavirus latest news: The global ...,Business Standard,https://www.news.google.com/./articles/CAIiEGKRSr6wOG0yuevOk0BS7OwqGQgEKhAIACoHCAowsLXdCjCm3dEBMOThpAM?hl=en-PK&gl=PK&ceid=PK%3Aen
Coronavirus News Latest Updates | India's tally tops 6.97 lakh; cases rise in Delhi and Maharashtra,The highly contagious infection which originated in China s Wuhan has affected more than 6 73 lakh people and claimed over 19 000 lives in India so far.,Jagran English,https://www.news.google.com/./articles/CBMitwFodHRwczovL2VuZ2xpc2guamFncmFuLmNvbS9pbmRpYS9jb3JvbmF2aXJ1cy1wYW5kZW1pYy1qdWx5LTYtbGl2ZS1uZXdzLXVwZGF0ZXMtaW5kaWEtY292aWQxOS12YWNjaW5lLWxvY2tkb3duLXVubG9jay0yMC1wYXRpZW50LWNvdW50LWRlYXRoLXRvbGwtcmVjb3ZlcnktcmF0ZS1oZWFsdGgtbWluaXN0cnktMTAwMTM2MTHSAbwBaHR0cHM6Ly9lbmdsaXNoLmphZ3Jhbi5jb20vbGl0ZS9pbmRpYS9jb3JvbmF2aXJ1cy1wYW5kZW1pYy1qdWx5LTYtbGl2ZS1uZXdzLXVwZGF0ZXMtaW5kaWEtY292aWQxOS12YWNjaW5lLWxvY2tkb3duLXVubG9jay0yMC1wYXRpZW50LWNvdW50LWRlYXRoLXRvbGwtcmVjb3ZlcnktcmF0ZS1oZWFsdGgtbWluaXN0cnktMTAwMTM2MTE?hl=en-PK&gl=PK&ceid=PK%3Aen
Victoria coronavirus cases rise by 108 as Daniel Andrews strengthens lockdown at nine public housing estates,Police will be stationed on every floor of nine public housing estates in inner Melbourne to ensure residents do not leave their units due to a coronavirus ...,ABC News,https://www.news.google.com/./articles/CAIiEMaWuPCJv5lZxTaQhhTjR0MqFwgEKg4IACoGCAow3vI9MPeaCDDEvrgG?hl=en-PK&gl=PK&ceid=PK%3Aen
"Coronavirus prediction model says NY, NJ currently on track for ‘controlled disease growth'",Only three states are still currently listed as on track to contain COVID-19.,SILive.com,https://www.news.google.com/./articles/CAIiEFTvvBPjmnagngunUsRJiRoqGQgEKhAIACoHCAowrqX_CjD2tPgCMM26ngY?hl=en-PK&gl=PK&ceid=PK%3Aen
Coronavirus: Before and after portraits of haircuts as hairdressers reopen,Before and after portraits as the people of Coventry visit the salon for the first time in three months.,BBC News,https://www.news.google.com/./articles/CBMiL2h0dHBzOi8vd3d3LmJiYy5jby51ay9uZXdzL2luLXBpY3R1cmVzLTUzMjkwNzQ20gEzaHR0cHM6Ly93d3cuYmJjLmNvLnVrL25ld3MvYW1wL2luLXBpY3R1cmVzLTUzMjkwNzQ2?hl=en-PK&gl=PK&ceid=PK%3Aen
Live Stock Market News During the Coronavirus Pandemic,The latest on stock market and business news during the coronavirus outbreak.,The New York Times,https://www.news.google.com/./articles/CAIiEIgCbWVnUDmcCnTxSc_5vHkqFwgEKg8IACoHCAowjuuKAzCWrzwwloEY?hl=en-PK&gl=PK&ceid=PK%3Aen
June 14 coronavirus news,"More than 7.8 million cases of the novel coronavirus have been confirmed worldwide, including at least 430,000 deaths, according to Johns Hopkins University.",CNN,https://www.news.google.com/./articles/CBMiUWh0dHBzOi8vd3d3LmNubi5jb20vd29ybGQvbGl2ZS1uZXdzL2Nvcm9uYXZpcnVzLXBhbmRlbWljLTA2LTE0LTIwLWludGwvaW5kZXguaHRtbNIBVWh0dHBzOi8vYW1wLmNubi5jb20vY25uL3dvcmxkL2xpdmUtbmV3cy9jb3JvbmF2aXJ1cy1wYW5kZW1pYy0wNi0xNC0yMC1pbnRsL2luZGV4Lmh0bWw?hl=en-PK&gl=PK&ceid=PK%3Aen
Coronavirus: US daily infections jump the most in seven weeks — as it happened,Today's top stories: Apple will close some US stores as Covid-19 cases rise. UK medical officers report a steady decrease in new cases of the virus and ...,Financial Times,https://www.news.google.com/./articles/CAIiEDliRFHPA_96b7a6IURmGVoqFwgEKg8IACoHCAow-4fWBzD4z0gwwtp6?hl=en-PK&gl=PK&ceid=PK%3Aen
Coronavirus latest: Five new cases confirmed in Luton,"Five new instances of coronavirus have been confirmed in Luton over the past 24 hours, according to Public Health England.",Luton Today,https://www.news.google.com/./articles/CBMiaWh0dHBzOi8vd3d3Lmx1dG9udG9kYXkuY28udWsvaGVhbHRoL2Nvcm9uYXZpcnVzL2Nvcm9uYXZpcnVzLWxhdGVzdC1maXZlLW5ldy1jYXNlcy1jb25maXJtZWQtbHV0b24tMjkwNDIzOdIBbWh0dHBzOi8vd3d3Lmx1dG9udG9kYXkuY28udWsvaGVhbHRoL2Nvcm9uYXZpcnVzL2Nvcm9uYXZpcnVzLWxhdGVzdC1maXZlLW5ldy1jYXNlcy1jb25maXJtZWQtbHV0b24tMjkwNDIzOT9hbXA?hl=en-PK&gl=PK&ceid=PK%3Aen
"Coronavirus LIVE:Come forward and donate plasma, urges Delhi CM Arvind Kejriwal","New Delhi, July 06: India reports a spike of 24,248 new COVID-19 cases and 425 deaths in the last 24 hours. Positive cases stand at 6,97,413 including 2 ...",Oneindia,https://www.news.google.com/./articles/CBMigAFodHRwczovL3d3dy5vbmVpbmRpYS5jb20vaW5kaWEvY29yb25hdmlydXMtbGl2ZS1pbmRpYS1yZXBvcnRzLTI0LTI0OC1uZXctY292aWQtMTktY2FzZXMtNDI1LWRlYXRocy1pbi1sYXN0LTI0LWhvdXJzLTMwNDM1MDQuaHRtbNIBAA?hl=en-PK&gl=PK&ceid=PK%3Aen
Surging Coronavirus Cases Push Latin America ‘to the Limit’,"The U.S. caseload, already the world's highest, is approaching two million. A book about the fall of France in 1940 has become a hit during the pandemic.",The New York Times,https://www.news.google.com/./articles/CAIiEPfZAKV3ipIjPvds8Sn-TOMqFwgEKg8IACoHCAowjuuKAzCWrzww5oEY?hl=en-PK&gl=PK&ceid=PK%3Aen
Today's latest updates on the coronavirus pandemic,Hotline. • Lima hospitals established a Community Call Center at 419-226-9000. Residents are urged to call that number before visiting a health care provider or ...,LimaOhio.com,https://www.news.google.com/./articles/CBMiWmh0dHBzOi8vd3d3LmxpbWFvaGlvLmNvbS9uZXdzLzQxNzE1MC90b2RheXMtbGF0ZXN0LXVwZGF0ZXMtb24tdGhlLWNvcm9uYXZpcnVzLXBhbmRlbWljLTExNNIBAA?hl=en-PK&gl=PK&ceid=PK%3Aen
Coronavirus updates: Some Florida beaches open despite record daily case count; fireworks canceled as states fear Fourth of July crowds,"Thanks to rising coronavirus infections in the U.S.,most Americans' Fourth of July celebrations this year won't include a community fireworks display, a trip to a ...",USA TODAY,https://www.news.google.com/./articles/CAIiEN3e0HybkDDVwJvwW7Ri6h8qGQgEKhAIACoHCAowjsP7CjCSpPQCMM_b5QU?hl=en-PK&gl=PK&ceid=PK%3Aen
Several Coronavirus Treatments Besides Remdesivir Show Promise : Shots - Health News,"Right now, there is only one drug shown by rigorous scientific testing to be helpful for treating COVID-19. That drug is the antiviral medication called remdesivir, ...",NPR,https://www.news.google.com/./articles/CAIiEPs9HazybnuRZylx9Pd-xIsqFggEKg4IACoGCAow9vBNMK3UCDCvpUk?hl=en-PK&gl=PK&ceid=PK%3Aen
Honduran President Tests Positive,Scientists at the University of Oxford say they have identified a drug that can reduce coronavirus-related deaths. The virus flares in Beijing. Officials in Tulsa ...,The New York Times,https://www.news.google.com/./articles/CAIiEKbBjX6c4qkBqebig_gIomAqFwgEKg8IACoHCAowjuuKAzCWrzwwxoIY?hl=en-PK&gl=PK&ceid=PK%3Aen
Dane County adds 79 coronavirus cases; cases in age 20-29 pass 1000,"Dane County confirmed 79 new coronavirus cases this morning, bringing the total to 2381 cases since the pandemic began in March. Today's increase once ...",madison365.com,https://www.news.google.com/./articles/CBMiWmh0dHBzOi8vbWFkaXNvbjM2NS5jb20vZGFuZS1jb3VudHktYWRkcy03OS1jb3JvbmF2aXJ1cy1jYXNlcy1jYXNlcy1pbi1hZ2UtMjAtMjktcGFzcy0xMDAwL9IBAA?hl=en-PK&gl=PK&ceid=PK%3Aen
Today's coronavirus news: New cases worldwide hit record high; Canadian troops en route to Latvia forced to turn around after infection scare; two Americans charged in Ontario for Quarantine Act viola,The latest coronavirus news from Canada and around the world Sunday. This file will be updated throughout the day. Web links to longer stories if available.,Caledon Enterprise,https://www.news.google.com/./articles/CBMi_AFodHRwczovL3d3dy5jYWxlZG9uZW50ZXJwcmlzZS5jb20vbmV3cy1zdG9yeS8xMDA1ODczNC10b2RheS1zLWNvcm9uYXZpcnVzLW5ld3MtbmV3LWNhc2VzLXdvcmxkd2lkZS1oaXQtcmVjb3JkLWhpZ2gtY2FuYWRpYW4tdHJvb3BzLWVuLXJvdXRlLXRvLWxhdHZpYS1mb3JjZWQtdG8tdHVybi1hcm91bmQtYWZ0ZXItaW5mZWN0aW9uLXNjYXJlLXR3by1hbWVyaWNhbnMtY2hhcmdlZC1pbi1vbnRhcmlvLWZvci1xdWFyYW50aW5lLWFjdC12aW9sYS_SAQA?hl=en-PK&gl=PK&ceid=PK%3Aen
Live updates: Elected officials blame rush to reopen as coronavirus cases hit record for 27th day,"With the number of coronavirus cases soaring in the United States, many elected officials are beginning to acknowledge that rushing to reopen was a mistake.",The Washington Post,https://www.news.google.com/./articles/CAIiEDBNXfaT4bx0N1yCpMe-Fk8qGAgEKg8IACoHCAowjtSUCjC30XQw1o3TBg?hl=en-PK&gl=PK&ceid=PK%3Aen
Coronavirus Vaccine Tracker,"Researchers around the world are developing more than 145 vaccines against the coronavirus, and 21 vaccines are in human trials. Vaccines typically require ...",The New York Times,https://www.news.google.com/./articles/CBMiUWh0dHBzOi8vd3d3Lm55dGltZXMuY29tL2ludGVyYWN0aXZlLzIwMjAvc2NpZW5jZS9jb3JvbmF2aXJ1cy12YWNjaW5lLXRyYWNrZXIuaHRtbNIBVWh0dHBzOi8vd3d3Lm55dGltZXMuY29tL2ludGVyYWN0aXZlLzIwMjAvc2NpZW5jZS9jb3JvbmF2aXJ1cy12YWNjaW5lLXRyYWNrZXIuYW1wLmh0bWw?hl=en-PK&gl=PK&ceid=PK%3Aen
China Shuts Vast Beijing Market as It Hunts Coronavirus Cluster,The C.D.C. projects up to 140000 deaths in the U.S. by early July. A bat expert navigates a political minefield. Dozens of members of the Guatemalan president's ...,The New York Times,https://www.news.google.com/./articles/CAIiEOmsN9sP_aNw2nqygumvmKcqFwgEKg8IACoHCAowjuuKAzCWrzwwxoIY?hl=en-PK&gl=PK&ceid=PK%3Aen
